date,venue,race_no,place,horse_no,horse_name,jockey,gear,commentary
2021-06-13,沙田,11,10,11,美麗日子 (B076),黃皓楠,B/H,出閘後受催策上前，沿途居領放馬外側。二百米處再無餘力，其後迅速轉弱。洩氣潰敗。
2021-06-13,沙田,11,11,12,緻寶駒 (D236),梁家俊,B1,出閘後瞬即墮後，沿途居尾列。轉直路彎時持續遙居於後，沿欄競跑。四百米處落後領放馬四個半馬位，直路上進一步轉弱。（氣管內有血）。
2021-06-13,沙田,11,12,7,禪勝寶駒 (D270),何澤堯,XB/TT,沿途居中間稍前位置，走第三疊，沒有遮擋。四百米處落後領放馬稍逾一個馬位，繼而在直路中段力竭。在沿途走外疊後於末段迅速墮退。
2021-06-13,沙田,11,13,8,鴻圖巨星 (C163),彭國年,B-,沿途居領先馬匹之後，走勢良佳。四百米處僅落後領放馬兩個馬位。最後二百米嚴重轉弱，尾二過終點，所負甚遠。
2021-06-13,沙田,11,14,9,鑽一鑽 (D461),賀銘年,B-/CP1,沿途居第二疊第二位的好位。入直路前受力策，直路上嚴重轉弱，包尾大敗而回。（必須試閘及格後，才可再次出賽）。
