date,venue,race_no,place,horse_no,horse_name,jockey,gear,commentary
2023-01-24,沙田,10,14,10,朗朗乾坤 (G337),田泰安,CP,自外檔出閘後留後，沿途居後列，從未有力一爭。（心律不正常。）（一對後腿不良於行。）
2023-01-24,沙田,11,1,6,新力高升 (G319),何澤堯,H,早段及中段居中間位置，離欄競跑。接近七百米處時走第三疊。入直路時走最外疊。跑過三百五十米處時以勁勢衝刺。二百五十米處進佔領先位置。保持佳勢，以十分從容的姿態掄元。
2023-01-24,沙田,11,2,4,川河首駒 (G333),布文,TT,起步時向內斜跑及碰撞對手，其後收慢，留居尾三位置。趨近七百米處時移至第三疊。最後三百米以佳勢衝刺，最後七十五米進佔第二位，但落後頭馬頗遠過終點。
2023-01-24,沙田,11,3,1,開心寶貝 (H091),潘頓,B/TT,早段居中間位置，望空競跑。自七百五十米處起在馬匹之間競跑。接近四百米處時在馬匹之間推進之際被碰撞。最後三百米以佳勢衝刺。接近七十五米處時進佔第三位，但落後頭馬頗遠過終點。
2023-01-24,沙田,11,4,12,皇帝金 (E077),希威森,B1,自最外檔出閘後收慢及留後，並居包尾位置。入直路時持續靠近內欄競跑。三百五十米處向外移出。最後二百米以佳勢衝刺。過終點時落後亞軍馬匹一個馬位。
2023-01-24,沙田,11,5,7,大力猴王 (G307),巴度,CP/SR,起步時被碰撞及失蹄，其後在馬群之後切入，居包尾位置。入直路時仍遙居包尾位置。接近四百米處時向外移出，落後領放馬五個半馬位。末段在外疊衝刺尚可，居中間位置過終點。
2023-01-24,沙田,11,6,3,醉眼光 (G018),田泰安,--,居第三位，走內欄，走勢良佳。轉直路彎時緊隨領先馬匹。四百米處落後領放馬僅一個半馬位。保持不俗走勢，最後五十米被末段衝刺強勁的馬匹超越，居中間位置過終點。
2023-01-24,沙田,11,7,8,錶之量子 (H166),周俊樂,--,居中間位置，走內欄。四百米處持續走內欄，落後領放馬三個馬位。接近二百米處時在轉弱的領放馬之後空位不足。最後一百米衝刺尚可。
2023-01-24,沙田,11,8,13,飛馬將軍 (G189),波健士,V,起步後收慢，留居中間之後位置，離欄競跑。入直路時落後領放馬三個馬位，其後不久在受困而未能望空之際收慢避開他駒後蹄。末段衝刺僅屬一般。
2023-01-24,沙田,11,9,10,大勢至富 (G060),梁家俊,CP,展現一貫前速，取得領先。跑過四百米處時被超越。接近二百米處時力竭。最後一百米轉弱。或許未能適應增程角逐。
2023-01-24,沙田,11,10,5,威武覺醒 (G165),蘇兆輝,XB,起步時收慢，但跑來搶口，走第三疊。自八百米處起繞過馬群上前。六百五十米處被迫走第四疊。接近三百五十米處時加速上前，取得領先。二百五十米處被頭馬超越。沿途走外疊耗力太多，最後七十五米迅速轉弱。
2023-01-24,沙田,11,11,14,路路爽 (G151),潘明輝,PC,大部分途程居第二疊第二位，走勢良佳。就在六百五十米處前移至第三疊。接近三百七十五米處時緊迫競跑及碰撞對手，其後不久在受擠迫之際失地。最後三百米轉弱。
2023-01-24,沙田,11,12,11,電路九號 (G140),班德禮,H/B1/TT,出閘緩慢，其後受催策上前，居尾四位置，走內欄。入直路時受催策，落後約五個馬位。直路上無甚表現，尾二過終點。
2023-01-24,沙田,11,13,2,智慧神駒 (D456),賀銘年,SR-/XB-,受推策上前，大部分途程居第二位，離欄競跑。四百米處居第三位，落後領放馬稍逾一個馬位。最後三百米轉弱。包尾大敗而回。
