date,venue,race_no,place,horse_no,horse_name,jockey,gear,commentary
2020-12-16,跑馬地,1,1,2,緻寶駒 (D236),潘頓,--,出閘迅速，居中間位置，走第二疊。直路彎略為追近。二百米處取得領先。保持佳勢， 以一馬鼻位之先僅勝。
2020-12-16,跑馬地,1,2,11,榮惑 (C370),莫雷拉,V/TT,出閘普通，居尾列，走外疊。跑過七百米處後略為追近。入直路時走大外疊。衝刺強勁，僅以短距離之差見負。
2020-12-16,跑馬地,1,3,1,馬主星輝 (B427),賀銘年,B/TT,出閘迅速，居中間之前位置，走內欄。入直路時走第二疊。衝刺良佳，取得季軍。未能威脅前兩名馬匹。
2020-12-16,跑馬地,1,4,9,新界之星 (A081),潘明輝,TT,與對手同步出閘，居中間稍後位置，走第二疊。直路彎位置相若。直路上略為追前。
2020-12-16,跑馬地,1,5,6,神州福星 (B326),田泰安,CP/TT,自第九檔出閘，留居中間之後位置，走第二疊。直路彎落後五個馬位。入直路時走大外疊。末段略為追前。
2020-12-16,跑馬地,1,6,3,情趣 (V114),薛恩,B/TT,出閘迅速，居中間之前位置，走第二疊。直路彎追近。入直路時走第三疊。二百米處未能再增速，其後逐漸轉弱。
2020-12-16,跑馬地,1,7,8,生生福運 (D274),彭國年,--,自第十檔出閘，留居包尾位置，走內疊。直路彎走內疊節省腳程。直路上略為追前。
2020-12-16,跑馬地,1,8,7,活力得勝 (C091),楊明綸,B,出閘普通，居後列，走內疊。跑過四百五十米處後向外移出。以穩勢衝刺。
2020-12-16,跑馬地,1,9,4,世紀之威 (D301),周俊樂,B,自第一檔出閘一般，居中間之後位置，走內疊。直路彎走內疊節省腳程。直路上保持同速。
2020-12-16,跑馬地,1,10,10,甜酒杯 (D247),巴度,B-/H-/V1/TT,出閘迅速，居第二位，落後領放馬兩個馬位。跑過六百米處後受推策。四百米處取得領先。直路初未能再增速。二百米處被超越。最後一百米轉弱。（見競賽事件報告。）
2020-12-16,跑馬地,1,11,5,超得意 (D406),波健士,B1/TT,自第十一檔出閘迅速，受催策上前，取得領先，帶離兩個馬位。四百米處未能再增速並被超越。直路初轉弱。
2020-12-16,跑馬地,2,1,1,銀河飛馬 (C275),賀銘年,B,收慢留居中間之間位置。三百米處衝刺強勁，勝出賽事。
2020-12-16,跑馬地,2,2,2,電訊驫馬 (C181),薛恩,H-/TT,受力策上前，居包廂位置。三百五十米處取得領先。一百五十米處被超越。
2020-12-16,跑馬地,2,3,11,醒目再臨 (A314),巴度,B/H/TT,居包尾位置，走第二至第三疊。二百五十米處穩步上前。
2020-12-16,跑馬地,2,4,12,相中飛揚 (D028),田泰安,H,居後列，走第二疊。二百五十米處穩步追前。
2020-12-16,跑馬地,2,5,8,吉利大勝 (D122),潘頓,H-/B/TT,收慢留後，搶口，移入內欄。自四百米處至二百米處受阻。望空後穩步上前。
2020-12-16,跑馬地,2,6,6,巴基勇士 (D312),蔡明紹,B/TT,居中間位置，走內欄。直路上走勢尚可。
2020-12-16,跑馬地,2,7,5,開心有利 (E160),周俊樂,TT1,早段受力策，但未能加速，走第三疊。直路上保持位置。
2020-12-16,跑馬地,2,8,9,金剛福星 (D017),彭國年,E/TT1,收慢留後，移入內欄。自四百米處至二百米處欠缺空位。望空後穩步追前。
2020-12-16,跑馬地,2,9,3,福喜多多 (B128),黃皓楠,B,居中間之後位置，走第三疊。自四百米處至二百米處欠缺空位。走勢尚可。
2020-12-16,跑馬地,2,10,10,八心之威 (D285),波健士,B-/V1/TT1,受力策移入內欄領放。三百米處力竭。
2020-12-16,跑馬地,2,11,4,超組合 (D493),潘明輝,--,受力策上前，走第二疊。三百米處再無餘力。
2020-12-16,跑馬地,2,12,7,善傳千里 (A121),莫雷拉,--,受力策上前。五百米處迅速墮退。二百米處受阻礙。
2020-12-16,跑馬地,3,1,2,老表醒 (D249),潘頓,--,居中間之後位置。入直路時走外疊。跑過一百五十米處時加速，在未受挑戰下勝出。
2020-12-16,跑馬地,3,2,4,志聰明 (C319),周俊樂,CP/TT,居中間位置，走第三疊，有遮擋。跑過四百米處時推進。入直路時走外疊。跑過二百米處時追前，衝刺強勁。
2020-12-16,跑馬地,3,3,9,環保時代 (C355),莫雷拉,B,居後列。入直路時走最外疊。跑過六百米處時開始推進。末段追前甚多。賽後翌日右前腿肌腱受傷。
2020-12-16,跑馬地,3,4,10,總統之星 (C170),蔡明紹,CP-/B2/TT,居包廂位置。跑過五百米處時受催策。直路上以佳勢力拼。
2020-12-16,跑馬地,3,5,6,旺旺寶駒 (C418),巴度,--,居前列，沿途在沒有遮擋下走外疊。直路上略為追前。
2020-12-16,跑馬地,3,6,5,上浦福滿 (A193),彭國年,B,居中間位置，走內欄。直路初在催策下反應良佳。跑過五十米處時略為墮退。
2020-12-16,跑馬地,3,7,1,睡眠攻略 (C493),田泰安,SR/TT,居中間位置。轉直路彎時失去左前蹄的蹄鐵。接近一百米處時受阻。末段保持同速。
2020-12-16,跑馬地,3,8,7,旺舖必星 (C387),潘明輝,B,居中間之前位置。跑過六百米處時受催策。直路上在催策下毫無反應。
2020-12-16,跑馬地,3,9,8,威紫荊 (B325),賀銘年,--,前速甚快，居領放馬外側。接近五百米處時受催策。跑過二百米處時墮退。接近一百米處時受阻。
2020-12-16,跑馬地,3,10,3,路路富貴 (C442),薛恩,B/XB,受催策取得領先。趨近直路彎時受催策。直路上轉弱。騎師被查詢競跑策略。
2020-12-16,跑馬地,3,11,11,馬驕雄 (B455),波健士,CP,起步後在一段短途程上受擠碰，居包尾位置，走內欄。受催策，但毫無反應。
2020-12-16,跑馬地,3,12,12,叫關盈富 (B482),楊明綸,B,居中間之後位置，走內欄。轉直路彎時固守內欄。直路上力竭。
2020-12-16,跑馬地,4,1,11,金枝玉葉 (D363),潘頓,H2,靠近領放馬競跑，其後被超越，自八百五十米處起居領放馬匹之後。入直路時固守內欄。二百米處加速上前，取得領先。末段帶離對手，輕鬆勝出。
2020-12-16,跑馬地,4,2,5,名牌效應 (E030),巴度,--,接近九百五十米處時收慢，居中間位置，在馬匹之間競跑。四百米處仍落後領放馬三個半馬位。最後一百米衝刺良佳，過終點時取得亞軍。
2020-12-16,跑馬地,4,3,10,日日靚 (D070),彭國年,TT,起步後收慢，留居遙遙落後的尾二位置。四百米處移出較外疊以推進，落後領放馬五個半馬位。直路彎走最外疊。末段衝刺強勁，過終點時僅失亞軍。
2020-12-16,跑馬地,4,4,7,峰爭 (D472),田泰安,--,起步後加速，九百米處展步上前，取得領先。持續領先，接近二百米處時被頭馬追上及超越。最後一步失去季軍。
2020-12-16,跑馬地,4,5,3,銘記知心 (E089),莫雷拉,--,沿途居中間位置，在沒有遮擋下走第三疊。轉直路彎時持續走外疊。四百米處僅落後領放馬不足三個馬位。末段以佳勢力拼，在多駒齊過終點下，負於頭馬約兩個馬位。
2020-12-16,跑馬地,4,6,6,零距離 (D453),賀銘年,B1/TT1,起步後不久收慢避開他駒後蹄，其後推進，自九百米處起居第二疊第二位。直路上走勢尚可，在多駒齊過終點下，僅負於輕鬆勝出的頭馬約兩個馬位。
2020-12-16,跑馬地,4,7,9,文武先鋒 (B049),薛恩,TT,在馬群之後切入，居中間稍後位置，沿途走第三疊，有遮擋。四百米處持續走外疊，落後領放馬四個半馬位。入直路時移出較外疊。以穩勢衝刺，居中間位置過終點。
2020-12-16,跑馬地,4,8,2,騰龍駒 (B349),周俊樂,B-/V1/TT,收慢留居包尾位置。中段被馬群拋離。接近半程時落後領放馬逾八個馬位。四百米處仍居包尾位置。末段沿內疊超越數駒，但從未看似有力爭勝。
2020-12-16,跑馬地,4,9,12,喜又盈 (C515),波健士,V-,沿途居中間位置，走內欄。趨近四百五十米處時受催策。直路上轉弱，洩氣潰敗。
2020-12-16,跑馬地,4,10,1,牛精大哥 (C034),陳嘉熙,B/TT,出閘最快，早段取得領先。自九百米處起居領放馬外側競跑。入直路後瞬即力竭。最後二百五十米顯著轉弱，洩氣潰敗。
2020-12-16,跑馬地,4,11,8,明海快駒 (E067),楊明綸,--,缺乏前速，墮居尾三位置，走內欄。直路彎落後領放馬約五個馬位。直路上進一步墮退，負於頭馬八個馬位。
2020-12-16,跑馬地,4,12,4,豪情勁駿 (D325),巫顯東,B2,起步後墮居中間之後位置，在馬匹之間競跑。四百米處受力策，落後領放馬五個馬位。直路上轉弱，包尾大敗而回。
2020-12-16,跑馬地,5,1,8,機緣巧俠 (C358),巴度,H/TT1,起步時被觸碰，因而失去平衡，走第二疊，居中間之前位置。直路彎落後一至兩個馬位。末段衝刺強勁，勝出賽事。
2020-12-16,跑馬地,5,2,10,寶得住 (C125),賀銘年,TT,自第一檔出閘迅速，沿欄居中間位置。入直路時走較外疊。末段衝刺強勁，跑獲亞軍，過終點時最為接近。
2020-12-16,跑馬地,5,3,7,嫡愛摯寶 (C062),彭國年,B/TT,起步時向外斜跑，觸碰他駒，早段走第二疊，居後列。自一千米處起走第三疊。中段略為追近。直路彎落後三個馬位。末段衝刺甚佳，跑獲一席位置，未能威脅前兩名馬匹。
2020-12-16,跑馬地,5,4,3,鵲橋飛渡 (A247),潘頓,H/TT,出閘迅速，早段受催策上前，取得領先。接近千一米處時被超越。直路彎挑戰領放馬。二百米處取得領先。一百米處未能再增速，被超越。其後逐漸轉弱。過終點時失去季軍。
2020-12-16,跑馬地,5,5,4,好友利 (C223),田泰安,B,出閘俐落，早段居前列，但走外疊。千一米處帶頭。中段領先一個馬位。直路彎受對手挑戰。二百米處未能再增速，被超越。最後一百米轉弱。
2020-12-16,跑馬地,5,6,2,活力勇士 (A313),周俊樂,H,出閘迅速，沿欄居中間稍前位置。直路彎走內欄節省腳程。末段保持穩勢。
2020-12-16,跑馬地,5,7,9,又享耆成 (E069),楊明綸,XB/TT,自外檔出閘後留居包尾位置。直路彎落後七個馬位。直路上略為追前。
2020-12-16,跑馬地,5,8,5,御風超影 (C268),黃皓楠,SR/TT,出閘一般，早段走第三疊，居中間之後位置。跑過千二米處後逐漸上前，但仍走第三疊。直路彎落後四分三個馬位。直路初未能再增速。最後二百米轉弱。
2020-12-16,跑馬地,5,9,6,醉醒神 (B436),波健士,P1,起步時觸碰他駒，居中間之後位置，走內疊。直路彎落後五至六個馬位。末段保持穩勢。
2020-12-16,跑馬地,5,10,11,舉世無雙 (A310),潘明輝,B/H,與對手同步出閘，走第二疊，居中間位置。直路彎居相若位置。直路上毫無進展。
2020-12-16,跑馬地,5,11,12,隨我來 (B300),黎海榮,--,出閘普通，走第二疊，居中間之後位置。直路彎落後五至六個馬位。入直路時走大外疊。直路上毫無進展。
2020-12-16,跑馬地,5,12,1,開心財星 (D341),巫顯東,H/P/XB/TT,沿途居包尾位置。從未有力一爭。
2020-12-16,跑馬地,6,1,3,幸福老撾 (D321),周俊樂,B/TT,出閘笨拙，居尾列，走內欄。入直路時移出最外疊。追前，衝刺強勁，以四分三個馬位之先勝出賽事。
2020-12-16,跑馬地,6,2,2,星運子爵 (D187),莫雷拉,H-,居中間位置，走第二疊。以勁勢力拼，但不敵頭馬，取得亞軍。
2020-12-16,跑馬地,6,3,12,喜盈寶 (D424),巴度,--,居中間之後位置，走第二疊。入直路時向外移出。直路上略為追前。
2020-12-16,跑馬地,6,4,11,玩具達人 (D203),蔡明紹,H/XB,居中間位置，走內欄。穩步上前至終點。
2020-12-16,跑馬地,6,5,8,金獅大將 (E057),楊明綸,XB,留居後列，走第二疊。末段走勢僅屬普通。
2020-12-16,跑馬地,6,6,7,童話 (B238),賀銘年,CP,早段居中間之前位置。過了八百五十米處後持續上前，居領放馬外側，走第二疊。最後一百五十米再無餘力。
2020-12-16,跑馬地,6,7,6,心頭好 (D360),潘頓,TT,居領放馬之後位置，走內欄。直路上未能追前。（見競賽事件報告。）
2020-12-16,跑馬地,6,8,10,勁駒 (D138),潘明輝,B,居中間之後位置，走內欄。直路上僅能保持同速。
2020-12-16,跑馬地,6,9,1,必妙星 (C507),田泰安,CP/TT,受催策上前，居第二疊第二位。最後一百五十米洩氣。
2020-12-16,跑馬地,6,10,5,帥男 (D459),波健士,--,居尾列，走第二疊。接近二百五十米處時勒避，其後失地。
2020-12-16,跑馬地,6,11,4,妙算達人 (B224),陳嘉熙,B/TT,受催策上前領先，走內欄。接近二百五十米處時失地。（左後腿不良於行，氣管內有血及患有「喘鳴症」。）
2020-12-16,跑馬地,6,12,9,安頌 (D381),彭國年,--,居中間位置，走內欄。追前，但接近二百五十米處時大力勒避，其後無力爭勝。
2020-12-16,跑馬地,7,1,7,閃電精靈 (D071),潘頓,B/TT,與領先馬匹並跑，走內欄。進入直路彎時居第三位，落後一個馬位。五十米處受催策取得領先，從容勝出。
2020-12-16,跑馬地,7,2,12,精靈勇士 (D172),巴度,TT,起步時受擠迫，居包尾位置。直路初受困。最後一百三十米衝刺強勁。
2020-12-16,跑馬地,7,3,3,樂滿家 (A293),周俊樂,B/H,自第一檔出閘迅速，早段緊隨領先馬匹，其後墮居中間之前第六位，落後僅逾三個馬位。入直路時走內疊節省腳程。保持穩勢，未能構成威脅。
2020-12-16,跑馬地,7,4,6,富高八斗 (B473),波健士,TT,自大外檔出閘，受催策跟上領放馬。轉直路彎時居領放馬外側。二百米處受催策取得領先。耗力太多，最後五十米無以為繼。
2020-12-16,跑馬地,7,5,8,閃耀榮光 (B372),賀銘年,B/TT,早段緊隨領先馬匹，其後逐漸居於中間第七位。進入直路彎時輕微受妨礙。入直路時進佔第六位。二百五十米處輕微受干擾。受催策保持走勢，過終點時最為接近。
2020-12-16,跑馬地,7,6,2,艮志騰雲 (B119),薛恩,TT,自外檔出閘，居後列，走外疊。沿途仍走外疊。轉直路彎時走最外疊。直路上在跑道中央保持走勢，過終點時最為接近。
2020-12-16,跑馬地,7,7,11,過河勁卒 (C381),田泰安,--,出閘一般，受催策，在並排六駒中領先短距離，走第三疊。進入直路彎時在領先下移入內欄。保持領先，入直路時被超越。最後一百五十米迅速力竭。
2020-12-16,跑馬地,7,8,10,四條煙 (D365),黃俊,XB,出閘一般，逐漸居於後列。直路前大部分途程尾隨馬群。轉直路彎時走內欄節省腳程。直路上保持走勢，過終點時最為接近。
2020-12-16,跑馬地,7,9,1,夢幻人生 (C166),陳嘉熙,V,受催策跟上領先馬匹。進入直路彎時墮居第四位，落後約兩個馬位。入直路後逐漸轉弱。
2020-12-16,跑馬地,7,10,4,南區寶 (D149),莫雷拉,H/XB,自外檔出閘，早段在領先馬匹之間競跑，走外疊。跑過八百米處時留居中間之後位置，但轉直路彎時仍走外疊。二百米處受擠碰，但保持穩勢。（騎師被查詢競跑策略。）
2020-12-16,跑馬地,7,11,5,錶之鈴 (D401),潘明輝,PC/TT,出閘普通，受催策逐漸進佔中間之後第九位，走內欄。入直路時走內欄節省腳程。末段保持同速。
2020-12-16,跑馬地,7,12,9,實力飛駒 (V138),彭國年,B,出閘笨拙，早段受催策，並排領先。跑過八百米處時逐漸留居第五位，但轉直路彎時仍走外疊，進一步墮後。二百米處受阻礙時保持同速，其後從未能恢復走勢。
2020-12-16,跑馬地,8,1,9,大師級 (C271),波健士,B,跟隨領放馬，走外疊。直路中段加速取得領先。保持佳勢，勝出賽事。
2020-12-16,跑馬地,8,2,4,共創繽紛 (D335),莫雷拉,TT,出閘迅速，跟隨領放馬，走內疊。跑過三百米處時對催策反應良佳，但末段一直不敵頭馬。
2020-12-16,跑馬地,8,3,10,維港奔流 (D042),田泰安,SR,受約束留居中間位置，走內欄。跑過三百米處時以穩勢上前，不敵首兩名馬匹。
2020-12-16,跑馬地,8,4,7,人和家盛 (C531),巴度,--,起步時受擠迫，墮居包尾位置。入直路時被帶出最外疊。衝刺最快，過終點時最為接近。
2020-12-16,跑馬地,8,5,2,嘉應精英 (C240),周俊樂,TT,自第十二檔出閘迅速，受大力約束留居後列。沿途走外疊，沒有遮擋。最後三百米略為追前。（騎師及練馬師均被查詢競跑策略。）
2020-12-16,跑馬地,8,6,5,高明駿將 (C511),潘頓,B,居中間之後位置，走第三疊。接近四百米處時受力策。保持普通走勢，未能追及領先馬匹。
2020-12-16,跑馬地,8,7,8,帆哥兒 (B089),彭國年,V/TT-,起步時受擠迫，居後列。七百米處搶口。入直路時對催策反應一般。未能威脅領先馬匹。
2020-12-16,跑馬地,8,8,6,皇帝金 (E077),楊明綸,XB1,從未遠離領放馬。入直路時居第五位。在催策下保持同速。
2020-12-16,跑馬地,8,9,1,順意寶 (B164),薛恩,B/XB,居中間稍前位置。自九百米處起走外疊，沒有遮擋。轉直路彎時未能加速。末段保持同速。
2020-12-16,跑馬地,8,10,11,青蛙王子 (D324),蔡明紹,H/P/XB,一千米處上前取得領先。接近二百米處時被超越。末段轉弱。（翌日不良於行。）
2020-12-16,跑馬地,8,11,3,心中有馬 (D434),潘明輝,TT,居後列，落後領放馬五個馬位。最後三百米加速力不足以展開挑戰。從未參與競逐。
2020-12-16,跑馬地,8,12,12,量化歡騰 (D049),賀銘年,SR-/V1,居中間之後位置。接近四百米處時受力策。末段衝刺乏力。
