date,venue,race_no,place,horse_no,horse_name,jockey,gear,commentary
2026-01-11,沙田,11,5,10,大學生 (H116),金誠剛,SR/TT,居中間位置。入直路時須等待空位出現。一百五十米處空位不足。保持走勢，但速度不足以追上領先馬匹。
2026-01-11,沙田,11,6,3,天星 (K234),希威森,B,自外檔出閘後墮後。入直路時走外疊。保持走勢，進佔中間位置，但從未能構成威脅。
2026-01-11,沙田,11,7,12,勁進駒 (J384),紀仁安,CP,切入追逼領放馬。直路彎被頭馬追上，三百米處被超越。最後一百米洩氣。
2026-01-11,沙田,11,8,8,金發盛世 (E490),田泰安,B,出閘迅速，沿欄跟隨領先馬匹。直路初空位不足。二百米處望空，但未能增速。
2026-01-11,沙田,11,9,9,天福 (K167),潘頓,CP,居中間位置，走內欄。四百米處至一百五十米處之間在試圖取位之際受困。一百米處在嘗試推進之際勒避。未能全力施為。
2026-01-11,沙田,11,10,1,綫路滿貫 (K201),何澤堯,--,居中間之後位置。直路彎上前，走外疊。自四百米處起受催策，但未能加速。最後二百米墮退。
2026-01-11,沙田,11,11,5,驍將 (K567),艾道拿,TT,居中間位置。走勢暢順，直路初追趕領先馬匹。最後二百五十米迅速轉弱。
2026-01-11,沙田,11,12,11,揀馬之皇 (K397),蔡明紹,B1/TT,居後列，留力候上，走內欄。直路彎移出外疊以望空。毫無表現。
2026-01-11,沙田,11,13,4,勇冠群英 (H177),楊明綸,B/TT,帶頭競跑。直路早段難以保持領先位置。最後二百米迅速墮退，收慢。
2026-01-11,沙田,11,DISQ,6,紫荊盛勢 (K478),班德禮,H1/TT,居中間位置，走內欄。直路彎走勢欠順。未能望空直至三百米處。最後二百米以勁勢上前，僅敗。
