date,venue,race_no,place,horse_no,horse_name,jockey,gear,commentary
2026-04-08,跑馬地,1,1,1,有情有義 (K416),莫雷拉,V1/TT,自第十二檔出閘僅屬一般，居中間之後位置，走第二疊。入直路時走大外疊。直路上追前甚多，勝出賽事。
2026-04-08,跑馬地,1,2,7,千杯 (J482),鍾易禮,TT,起步時發生觸碰，受催策上前領放。直路彎前走勢良佳。直路上保持佳勢，但接近終點時未能抗衡頭馬。
2026-04-08,跑馬地,1,3,11,輕鬆大少 (J319),周俊樂,B/TT,起步後不久與對手互相觸碰，居中間稍後位置，走內疊。直路彎走內疊節省腳程。直路上追前甚多，過終點時最為接近。
2026-04-08,跑馬地,1,4,12,添喜運 (J218),田泰安,B/TT-,起步時發生觸碰，居中間之前位置，走外疊。入直路時落後三個半馬位。衝刺良佳，取得第四名。
2026-04-08,跑馬地,1,5,3,藍爵爺 (J448),希威森,CP-/XB-/TT-,出閘迅速，落後約一個馬位，走第二疊。直路彎居相若位置。直路上保持穩勢。
2026-04-08,跑馬地,1,6,9,駿馬之星 (J368),何澤堯,SR/TT,出閘稍慢及受擠迫，居後列，走外疊。入直路時走大外疊。直路上略為追前。
2026-04-08,跑馬地,1,7,8,焦點 (H173),布文,B/TT,自外檔出閘，留居包尾位置，落後約八個馬位。直路彎落後相同距離。直路上追前甚多，但未能構成威脅。
2026-04-08,跑馬地,1,8,4,歷險大將 (J344),奧爾民,B2/TT,自第一檔出閘迅速，居中間之前位置，走內疊。直路彎略為追近。直路初未能再增速。最後一百米逐漸轉弱。（見競賽事件報告。）
2026-04-08,跑馬地,1,9,6,神燦金剛 (K259),艾道拿,CP-/TT,出閘僅屬一般及發生觸碰，居中間位置，走內疊。直路彎走內疊節省腳程。直路初對催策反應平平。最後一百米逐漸轉弱。
2026-04-08,跑馬地,1,10,5,至臻完美 (K273),楊明綸,B-/XB-/TT-,留居後列，走內疊。入直路時落後七個馬位。直路初對催策反應平平。其後逐漸轉弱。（見競賽事件報告。）
2026-04-08,跑馬地,1,11,2,傳承效應 (K035),巴度,B-/CP2/TT,起步時發生觸碰，居中間位置，走第二疊。入直路時落後五個馬位。直路上衝刺乏力。
2026-04-08,跑馬地,1,12,10,喆喆友福 (J345),潘頓,B/TT,出閘一般，居中間位置，走第三疊，沿途沒有遮擋。直路初未能再增速。其後轉弱。
2026-04-08,跑馬地,2,1,7,上浦福旺 (L102),鍾易禮,CP/TT,領放。四百米處加速。直路上受亞軍馬匹的強勁挑戰。保持佳勢，保住勝局。
2026-04-08,跑馬地,2,2,12,隨緣得勝 (K223),田泰安,B/TT,出閘後受催策，追迫領放馬。直路上以佳勢上前挑戰頭馬，僅敗。
2026-04-08,跑馬地,2,3,10,耀昌勝世 (J529),巴度,--,跟隨領先馬匹，走內欄。四百米處受推策，追趕領先馬匹。保持走勢，但未能與領先馬匹抗衡。
2026-04-08,跑馬地,2,4,5,康昌之星 (K003),艾兆禮,B/TT,居中間之後位置，走內欄。轉入直路時須等待空位出現。保持穩勢，但未能威脅首兩名馬匹。
2026-04-08,跑馬地,2,5,6,佳福駒 (G230),何澤堯,B/TT,居中間位置。四百米處受催策，追趕領先馬匹。保持走勢，但速度不足以追及領先馬匹。
2026-04-08,跑馬地,2,6,11,佰勝金龍 (K458),梁家俊,CP-/BO1/TT,居中間位置。中段受催策以保持位置。直路初內閃。在催策下保持同速。
2026-04-08,跑馬地,2,7,1,爆出美麗 (K155),布文,TT,居後列。轉入直路時須等待空位出現。從未能構成威脅。
2026-04-08,跑馬地,2,8,4,唯美主義 (H289),希威森,PC1,自最外檔出閘後墮後。轉入直路時仍居最後兩位之內。速度不足以展開挑戰。
2026-04-08,跑馬地,2,9,9,準希望 (L047),班德禮,--,居後列，留力候上。入直路時受推策，走外疊。從未能追上領先馬匹。
2026-04-08,跑馬地,2,10,3,赤風驪 (L093),莫雷拉,PC1/TT,居中間之後位置，走第三疊。三百米處受催策。未能追前。
2026-04-08,跑馬地,2,11,8,金駿星 (H470),奧爾民,CP-/XB,跟隨領先馬匹。自五百米處起難以保持位置。最後三百米墮退。
2026-04-08,跑馬地,2,12,2,澳嘉輝 (K232),楊明綸,CP/TT2,居中間位置，走第三疊，沒有遮擋。直路彎受推策，但未能跟上步速。遙遙落後時收慢。
2026-04-08,跑馬地,3,1,4,財將 (L234),鍾易禮,TT1,居領放馬外側。以勁勢上前，取勝。
2026-04-08,跑馬地,3,2,3,美麗登場 (L260),潘頓,--,出閘迅速，取得領先。保持佳勢。
2026-04-08,跑馬地,3,3,1,巴閉王 (K479),奧爾民,CP/XB,居領先馬匹稍後位置。末段衝刺不俗。
2026-04-08,跑馬地,3,4,2,凝聚美麗 (J299),巴度,CP/TT,居前列，走第二疊。保持走勢，未能構成威脅。
2026-04-08,跑馬地,3,5,12,萬眾開心 (H208),艾兆禮,P/TT,居中間位置，走內欄。在催策下保持同速。
2026-04-08,跑馬地,3,6,11,友得盈 (K106),班德禮,B/TT,居中間位置﹐走第二疊。未能增速。
2026-04-08,跑馬地,3,7,8,風采人生 (J366),莫雷拉,B/TT,居後列。末段超越數匹已轉弱的對手。（見競賽事件報告。）
2026-04-08,跑馬地,3,8,5,領袖勁力 (L034),梁家俊,B-/TT2,居尾列。毫無表現。
2026-04-08,跑馬地,3,9,10,佳佳友 (L069),希威森,XB/B1,居中間之後位置，走內欄。未能追前。
2026-04-08,跑馬地,3,10,7,喜樂之星 (L235),巫顯東,TT,居中間之後位置，走第二疊。從未能構成威脅。
2026-04-08,跑馬地,3,11,9,怪獸波士 (L139),何澤堯,TT1,居後列。從未參與競逐。
2026-04-08,跑馬地,3,12,6,精算奕然 (K295),黃寶妮,P/TT,居接近中間位置，走第三疊。直路上轉弱。（見競賽事件報告。）
2026-04-08,跑馬地,4,1,7,喜馬 (K347),莫雷拉,B,出閘時與對手互相碰撞，居中間位置。直路彎以佳勢上前，但被迫走外疊。儘管在催策下走勢欠規矩，但在直路上以佳勢上前。最後一百米領先。
2026-04-08,跑馬地,4,2,2,勁進駒 (J384),潘頓,CP,沿途領先或爭奪領先。轉入直路時受催策。一百米處被超越。末段再無餘力。
2026-04-08,跑馬地,4,3,1,榮利雙收 (K382),班德禮,B,早段搶口，跟隨領放馬。自二百米處起未能抗衡頭馬，但持續力拼。
2026-04-08,跑馬地,4,4,5,奮鬥輝煌 (J236),布文,B/TT,早段走外疊，爭奪領先。一百米處仍甚具爭勝機會，但末段再無餘力。
2026-04-08,跑馬地,4,5,11,真叻仔 (K435),蔡明紹,CP,跟隨領先兩駒。三百米處在催策下展開追趕。最後一百五十米再無餘力。
2026-04-08,跑馬地,4,6,12,明亮光輝 (L005),金誠剛,CP/TT,居中間位置。在催策下保持同速。未能展開挑戰。
2026-04-08,跑馬地,4,7,9,寫我其誰 (L048),鍾易禮,TT,居最後兩位之內。直路彎仍落後甚遠。保持走勢，進佔中間位置。未能威脅領先馬匹。
2026-04-08,跑馬地,4,8,6,一風雲 (K336),梁家俊,B1/TT1,居中間位置。三百米處在催策下未能增速。毫無表現。
2026-04-08,跑馬地,4,9,8,頌星 (K343),奧爾民,B,居後列，走外疊。末段超越數匹對手。從未能構成威脅。
2026-04-08,跑馬地,4,10,4,新力飆 (K177),楊明綸,H1/TT,自外檔出閘，向內移入。在後列掙扎上前，三百五十米處勒避，其後落後頗遠。
2026-04-08,跑馬地,4,11,10,大數據 (H230),田泰安,V,居後列，留力候上。二百米處勒避。無甚表現。
2026-04-08,跑馬地,4,12,3,揀馬之皇 (K397),周俊樂,B/TT,居中間位置。直路彎難以保持位置。墮退。
2026-04-08,跑馬地,5,1,9,你知我得 (H278),潘頓,--,出閘迅速，受催策上前領放。入直路時領先四分三個馬位。末段保持佳勢，掄元。
2026-04-08,跑馬地,5,2,5,朗日自強 (J530),黃寶妮,V/TT,出閘迅速，緊隨領放馬，走內疊。直路彎走內疊節省腳程。入直路後保持走內疊。衝刺良佳，跑獲亞軍。
2026-04-08,跑馬地,5,3,6,三強 (K229),奧爾民,P,出閘普通，居中間之前位置，走第二疊。三百五十米處向外移出。直路上保持佳勢，跑獲季軍，但未能威脅首兩名馬匹。
2026-04-08,跑馬地,5,4,7,博愛先鋒 (G465),巴度,CP/TT,出閘迅速，居第二位，走第二疊。入直路時落後四分三個馬位。直路上保持同速。
2026-04-08,跑馬地,5,5,11,有你有我 (H057),希威森,H/P/TT,出閘僅屬一般，居中間之後位置，走第二疊。跑過四百米處後向外移出。入直路時走大外疊。直路上追前甚多。過終點時最為接近。
2026-04-08,跑馬地,5,6,4,紅愛舍 (H110),班德禮,B/TT,出閘僅屬一般，居中間位置，落後三個馬位，走內疊。直路彎走內疊節省腳程。直路上保持穩勢。
2026-04-08,跑馬地,5,7,2,仁仁有餘 (J421),莫雷拉,B/TT,出閘普通，居中間位置，走第二疊。四百米處開始上前。入直路時走大外疊。直路初略為追前。最後一百米再無餘力。（見競賽事件報告。）
2026-04-08,跑馬地,5,8,8,神異金剛 (K109),周俊樂,E/TT,自外檔出閘，留居後列，走內疊。四百米處向外移出。直路上移出外疊，追前甚多。過終點時最為接近。
2026-04-08,跑馬地,5,9,1,開心孖寶 (K475),艾道拿,B/TT,自第十檔出閘迅速，居中間之前位置，走第三疊。沿途沒有遮擋。入直路時被帶出更外疊。直路上保持同速。接近終點時空位不足。
2026-04-08,跑馬地,5,10,10,星光快驅 (K215),艾兆禮,B-/TT-,出閘普通，居後列，走外疊。入直路時落後六個馬位。直路上毫無表現。（見競賽事件報告。）
2026-04-08,跑馬地,5,11,3,莊家班 (L115),布文,B/TT,自大外檔出閘，留居包尾位置。入直路時落後七個馬位。直路初略為追前。最後一百米轉弱。（見競賽事件報告。）（賽後翌日右前腿不良於行。）
2026-04-08,跑馬地,5,12,12,飛越晨曦 (K483),金誠剛,PC-/H/XB/V1/TT,出閘緩慢，居中間之後位置，走內疊。入直路時走較外疊。直路上衝刺乏力。
2026-04-08,跑馬地,6,1,2,富心星 (K125),莫雷拉,TT,出閘迅速，取得領先。自五百米處起加速帶離對手，保持走勢至終點。
2026-04-08,跑馬地,6,2,11,電玩精英 (H356),班德禮,SR/TT,居中間位置，走內欄。衝刺良佳，取得亞軍。
2026-04-08,跑馬地,6,3,1,跨境駿馬 (L022),潘頓,B,居中間之後位置，走內欄。末段沿內疊追前甚多。（見競賽事件報告。）
2026-04-08,跑馬地,6,4,6,幸運愉快 (K064),潘明輝,H/TT,居中間之前位置，走第二疊。保持走勢，未能構成威脅。
2026-04-08,跑馬地,6,5,5,快樂共濟 (L049),何澤堯,XB,居領先馬匹之後。在催策下保持同速。
2026-04-08,跑馬地,6,6,4,智勝攻略 (H197),巴度,B,居後列，走內欄。保持一般走勢。
2026-04-08,跑馬地,6,7,8,金多囍 (K272),田泰安,PC/TT,居中間之後位置。末段超越數匹已轉弱的對手。
2026-04-08,跑馬地,6,8,3,仁者荃承 (K496),黃智弘,XB/SR2,早段受力策，居前列。直路上轉弱。
2026-04-08,跑馬地,6,9,10,閃電星福 (K431),金誠剛,H/TT,居中間位置，走第三疊。對催策反應平平。
2026-04-08,跑馬地,6,10,12,靖哥哥 (K503),周俊樂,TT,居後列。外閃，從未能真正施為。
2026-04-08,跑馬地,6,11,9,弘智多寶 (L084),希威森,B/TT,居接近中間位置，走第二疊。未能追前。
2026-04-08,跑馬地,6,12,7,佳運發 (E435),黃寶妮,--,居中間之前位置，走第三疊，沒有遮擋。直路上轉弱及力竭。
2026-04-08,跑馬地,7,1,1,銀亮奔騰 (K057),布文,CP/TT,居領放馬稍後的第三位，走內欄。七百米處居相若的第四位。五百米處直路彎開始上前，入直路時跟隨領放馬。一百米處在催策下佔得上風。
2026-04-08,跑馬地,7,2,2,滿心星 (K054),莫雷拉,TT,把握自第一檔出閘的優勢，瞬即取得領先。以平穩步速領放，七百米處被追上。入直路時重奪領先位置，帶離一個馬位。僅於最後一百米被超越。
2026-04-08,跑馬地,7,3,9,紫辰之星 (L149),班德禮,SR/TT,自外檔出閘後瞬即切入內欄取位，居中間第七位，落後領放馬約四個馬位。對面直路上略為追近至第六位。轉入直路時走內欄節省腳程。以穩勢上前，未能構成威脅。
2026-04-08,跑馬地,7,4,8,翠兒威威 (K084),周俊樂,CP/TT,自中檔出閘後受催策上前，千二米處首個彎位追上領放馬，走第二疊。七百米處居第三位，落後一個馬位，走第二疊。直路上在催策下保持同速。
2026-04-08,跑馬地,7,5,4,優才 (J536),艾兆禮,P-/TT,自外檔出閘迅速，居最後數位之內。九百米處迅速上前，七百米處並排領先。轉直路彎及入直路時在催策下保持位置。最後一百五十米無以為繼。
2026-04-08,跑馬地,7,6,7,浪漫鬥士 (L240),梁家俊,TT,早段緊隨領先馬匹。轉首個彎位時受約束，居第二疊第二位，即馬群中的第四位。約七百五十米處在約束下墮居第六位。直路上在催策下保持穩勢，未能構成威脅。
2026-04-08,跑馬地,7,7,10,雙星報喜 (K126),巴度,CP,居中間稍前的第五位，走第三疊，沒有遮擋。七百米處受催策以保持位置，但轉直路彎時走外疊，失位。直路上以穩勢力拼。
2026-04-08,跑馬地,7,8,5,爆笑 (J079),潘頓,TT,居後列，走內欄。九百米處至七百米處之間在馬群之後收慢，失位。直路彎重新發力，入直路時走內欄節省腳程。末段再無表現。
2026-04-08,跑馬地,7,9,6,勁好運 (H481),田泰安,CP,出閘迅速，居後列。對面直路早段居中間之後位置，走第三疊。七百米處追近，一度落後領放馬不逾四個馬位。開始轉直路彎時瞬即墮退至第八位，落後約五個馬位。直路上保持同速。
2026-04-08,跑馬地,7,10,3,天然數字 (L166),何澤堯,B-,自最外檔出閘後遙居於後。八百米處至六百米處之間一度發力。直路上再無表現。
2026-04-08,跑馬地,7,11,12,凱明神駒 (K190),希威森,B/TT,沿途遙居於後。從未有力一爭。
2026-04-08,跑馬地,7,12,11,妙算強人 (K577),鍾易禮,V-,逐漸居中間位置。八百米處步速加快時進一步墮退。從未能收復失地。
2026-04-08,跑馬地,8,1,4,精彩駿將 (J417),莫雷拉,H-/P-/TT,瞬即取得領先。直路前以穩定步速領放。跑過三百米處時加速良佳。末段保持佳勢，力拒緊追的對手。
2026-04-08,跑馬地,8,2,12,富國兄弟 (J396),蔡明紹,TT,躍出時失蹄。追趕領先馬匹，居第三位。四百米處受催策，接近二百米處時上前進佔第二位。末段未能追近頭馬。
2026-04-08,跑馬地,8,3,6,晶晶日上 (H089),梁家俊,CP/TT,居中間之前位置。四百米處落後領放馬三個馬位。直路上在跑道中央受催策。穩步上前，接近一百五十米處時進佔第三位，但未能追近頭馬。
2026-04-08,跑馬地,8,4,10,泰泰精神 (K007),艾兆禮,--,出閘一般，居後半馬群中，落後領放馬五至六個馬位。最後三百米以穩勢衝刺，取得第四名，未能威脅頭馬。
2026-04-08,跑馬地,8,5,5,星願無限 (L267),巫顯東,TT,起步時向外斜跑，展步最慢，其後恢復走勢，居中間位置。最後三百米以穩勢衝刺，但從未能挑戰領先馬匹。
2026-04-08,跑馬地,8,6,7,電源之駒 (E301),奧爾民,--,居中間之後位置。入直路時移出外疊以展開挑戰，但僅能略為追前。
2026-04-08,跑馬地,8,7,9,長勝隊長 (K379),金誠剛,TT,自第十二檔出閘，留力候上。居接近包尾位置，走第三疊，沒有遮擋，搶口。直路上移出最外疊，其後略為追前，居中間位置過終點。
2026-04-08,跑馬地,8,8,1,星月飛雲 (K363),布文,CP-/B1,自外檔出閘時受擠迫，其後留居後列。走勢一般，未能對領先馬匹構成威脅。接近一百米處時難以望空。
2026-04-08,跑馬地,8,9,11,驍將 (K567),鍾易禮,TT,出閘笨拙，留居後列，落後領放馬七至八個馬位。轉入直路保持走內疊，但在催策下衝刺乏力。
2026-04-08,跑馬地,8,10,3,傑出漢子 (G455),何澤堯,B,受催策上前，居第二位。入直路時對催策毫無反應。二百米處再無餘力，轉弱。（賽後翌日獲報告右前腿肌腱受傷。）
2026-04-08,跑馬地,8,11,8,椒椒醒 (H440),巴度,B-/XB-,自第一檔出閘迅速，居第四位。從未遠離領放馬。直路初掙扎上前。過了二百五十米處後轉弱。
2026-04-08,跑馬地,8,12,2,安康萬里 (J158),周俊樂,B/TT,起步時發生碰撞及失去平衡，居後列，落後六個馬位。入直路時走外疊，但在催策下衝刺乏力。（賽後接受獸醫檢查，並無發現任何明顯異常之處。）
2026-04-08,跑馬地,9,1,1,俏眼光 (L003),布文,H,出閘時向內斜跑，與他駒互相碰撞。緊隨領先馬匹，走內欄。中段追前甚多。走勢強勁，一百五十米處取得領先，輕鬆取勝。
2026-04-08,跑馬地,9,2,2,人和家興 (E061),班德禮,B/TT,出閘後受催策，跟隨領放馬。直路初率先加速，取得領先。一百五十米處被頭馬超越。僅保住亞軍。
2026-04-08,跑馬地,9,3,12,喵喵怪 (J487),巴度,CP/SR/TT,起步時向內斜跑。居中間位置。轉入直路時須等待空位出現。最後二百米以佳勢上前，追近領先馬匹。
2026-04-08,跑馬地,9,4,5,時尚風趣 (J164),梁家俊,XB/TT,居中間位置，走第三疊。直路彎追前甚多，挑戰領先馬匹。直路初持續上前，末段力弱。
2026-04-08,跑馬地,9,5,6,東來欣賞 (J290),周俊樂,TT,緊隨領先馬匹。四百米處受催策，追趕領先馬匹。直路早段未能完全望空。保持穩勢。
2026-04-08,跑馬地,9,6,11,盈妍威楓 (J300),艾兆禮,B/TT,出閘時向外斜跑，被碰撞。跟隨領放馬，走外疊，沒有遮擋。四百米處發力。在催策下保持同速。
2026-04-08,跑馬地,9,7,7,撼天鐵翼 (H162),艾道拿,B,居後列，留力候上。入直路時受推策，走外疊。速度不足以追及領先馬匹。
2026-04-08,跑馬地,9,8,4,三軍勇將 (J360),莫雷拉,TT,起步時嚴重受擠迫，被碰撞。居中間之後位置。未能望空直至二百米處。從未能構成威脅。
2026-04-08,跑馬地,9,9,10,佛亮老撾 (K174),田泰安,--,出閘時嚴重受擠迫，其後居後列。轉入直路時受困。末段未能追前。
2026-04-08,跑馬地,9,10,9,星火燎原 (J150),巫顯東,B,起步後不久嚴重受擠迫及勒避，墮後。入直路時受推策，走最外疊。毫無表現。
2026-04-08,跑馬地,9,11,3,赤海 (L195),潘頓,CP1/TT,自最外檔出閘時被碰撞，切入內疊領放。直路初被超越。最後二百米墮退。
2026-04-08,跑馬地,9,12,8,威力飛騰 (L247),潘明輝,B-,居中間位置，走內欄。直路彎難以保持位置。最後二百米未能跟上步速，被拋離。
