date,venue,race_no,place,horse_no,horse_name,jockey,gear,commentary
2026-01-11,沙田,1,1,1,凌風傲雪 (K025),潘頓,B-/TT,出閘普通，居前列，走外疊。入直路時落後半個馬位。三百米處取得領先，保持佳勢至終點，勝出賽事。
2026-01-11,沙田,1,2,7,盛勢威楓 (K111),潘明輝,B/XB,起步時發生碰撞，居中間之前位置，走第二疊。自五百五十米處起走第三疊。直路上保持佳勢，獲得亞軍。
2026-01-11,沙田,1,3,5,首駿 (K189),周俊樂,XB/TT,自外檔出閘後留後，居中間位置，走外疊。大部分途程沒有遮擋。趨近三百五十米處時受力策。直路上保持佳勢，跑獲季軍，但未能構成威脅。
2026-01-11,沙田,1,4,2,艾彼奧 (K193),奧爾民,B,起步後不久發生觸碰，居中間之前位置，走內疊。直路彎走內疊節省腳程。未能望空直至趨近一百米處。末段衝刺平穩。（見競賽事件報告。）
2026-01-11,沙田,1,5,6,美神來 (J174),巴度,B,起步後不久受擠迫，居中間稍後位置，走內疊。直路彎略為追近。跑過五百米處後走第二疊。直路早段未能望空，其後保持穩勢。
2026-01-11,沙田,1,6,3,皇金合 (K099),金誠剛,B,起步時向外斜跑，被碰撞，受催策上前領放。入直路時領先半個馬位。三百米處未能再增速，被超越。最後一百米逐漸轉弱。
2026-01-11,沙田,1,7,4,科創世紀 (K113),蔡明紹,CP1/TT,起步僅屬一般，居後列，走內疊。直路彎走內疊節省腳程。直路早段略為追前。二百米處未能再增速，最後一百米逐漸轉弱。
2026-01-11,沙田,1,8,10,不假外求 (J493),楊明綸,V,起步時向內斜跑，被碰撞，居中間位置，走第二疊。直路彎位置相若。直路早段對催策反應平平，最後一百米逐漸轉弱。
2026-01-11,沙田,1,9,8,添喜運 (J218),紀仁安,B/TT,起步時發生碰撞，早段居中間位置，走第三疊。自九百米處起居中間之後位置，走第二疊。六百米處向外移出。入直路時落後三個馬位。直路早段未能再增速，最後二百米轉弱。（見競賽事件報告。）
2026-01-11,沙田,1,10,11,歐洲傳奇 (H153),田泰安,B/TT,與對手同步躍出，居中間之後位置，走外疊。直路彎前居相同位置。直路早段未能再增速，其後轉弱。
2026-01-11,沙田,1,11,12,飛躍精英 (H247),艾兆禮,B/TT,起步時向外斜跑及發生觸碰，居後列，走外疊。入直路時落後約六個馬位。直路上衝刺乏力。（見競賽事件報告。）
2026-01-11,沙田,1,12,9,讓愛高飛 (E413),巫顯東,CP/TT2,起步時被碰撞。沿途居後列。從未參與競逐。
2026-01-11,沙田,2,1,1,勇者為皇 (L016),潘頓,--,展現甚快前速領放。直路初加速，瞬即控制大局。二百米處加速帶離兩個馬位，帶離對手勝出。
2026-01-11,沙田,2,2,5,幸運奇兵 (L071),霍宏聲,--,自大外檔出閘後墮後。入直路時走最外疊。四百米處在催策下展開挑戰。走勢強勁，追近頭馬，但一直落後。
2026-01-11,沙田,2,3,7,奇異歡星 (K255),田泰安,H/XB,跟隨領先馬匹。五百米處向外移出以望空，對催策交出反應。保持走勢，但未能追上領先馬匹。
2026-01-11,沙田,2,4,6,海鑽石 (L072),布文,SR1/TT1,出閘後向內斜跑及與對手互相碰撞，居中間之後位置，走第三疊。三百米處一度發力。其後在催策下保持同速。
2026-01-11,沙田,2,5,2,風火猴王 (J511),艾道拿,B/TT,居中間位置，走內欄。入直路時居好位。自三百米處起展開挑戰，已獲機會盡展所長，但末段未能增速以繼續挑戰。
2026-01-11,沙田,2,6,12,迅意 (K250),希威森,CP/TT,出閘時發生碰撞，其後居後列。直路初仍居包尾位置。末段略為追前，但從未能構成威脅。
2026-01-11,沙田,2,7,10,眼健康 (K455),艾兆禮,B1/TT1,自外檔出閘後墮後。直路初仍居後列。最後二百五十米追前數位，但從未能構成威脅。
2026-01-11,沙田,2,8,11,金風萬里 (K150),紀仁安,H2/TT,起步後不久受阻，居中間位置。三百五十米處在空位不足下勒避。二百五十米處移入內欄以望空。末段未能加速。
2026-01-11,沙田,2,9,3,不勞而獲 (K377),周俊樂,XB/TT,跟隨領放馬，走外疊，沒有遮擋。直路彎移出更外疊。自四百米處起難以保持位置。最後三百米墮退。
2026-01-11,沙田,2,10,4,挺秀弘利 (K481),梁家俊,CP/TT,出閘笨拙及失去平衡，居中間之後位置。直路彎在催策下追趕領先馬匹。二百五十米處被迫收慢。走勢稚嫩。
2026-01-11,沙田,2,11,9,紅衣財神 (K423),楊明綸,CP1,跟隨領先馬匹，走內欄。五百米處順勢上前挑戰。自四百米處起在催策下未能加速。末段迅速轉弱。
2026-01-11,沙田,2,12,8,快活同盟 (K316),何澤堯,TT,早段在催策下追趕領放馬。入直路時失位。自該處起墮後，收慢。
2026-01-11,沙田,3,1,3,精英高球 (L023),班德禮,--,跟隨領放馬。走勢稚嫩。沿途內閃。難以被全力催策。（見競賽事件報告。）
2026-01-11,沙田,3,2,7,逍遙人生 (J427),希威森,TT,在催策下取得領先。走勢強勁。已獲機會盡展所長。（見競賽事件報告。）
2026-01-11,沙田,3,3,1,大愛無疆 (K235),奧爾民,CP1,居中間之前位置。中段搶口。對催策反應良佳。（見競賽事件報告。）
2026-01-11,沙田,3,4,8,嘉應勇士 (H028),田泰安,XB,居前列。走勢尚可。末段保持穩勢。
2026-01-11,沙田,3,5,10,萬里雲 (K279),潘明輝,--,出閘僅屬一般，居中間之後位置。在鞭策下穩步追前。
2026-01-11,沙田,3,6,2,超拍檔 (K484),周俊樂,--,居中間位置，走外疊。保持同速至終點。
2026-01-11,沙田,3,7,12,問鼎巔峰 (K044),潘大衛,CP,居後列，走勢一般。直路上略為追前。
2026-01-11,沙田,3,8,9,幸運愉快 (K064),蔡明紹,H/TT,居後列。直路彎向外移出。對催策反應平平。（見競賽事件報告。）
2026-01-11,沙田,3,9,6,勇者無敵 (K217),梁家俊,XB/SR1/TT,居中間之後位置。早段搶口。未能追前。
2026-01-11,沙田,3,10,4,駿美一生 (L085),鍾易禮,TT1,居後列。受困而未能望空直至一百五十米處。未能被力策。
2026-01-11,沙田,3,11,5,海王 (K523),金誠剛,H-/CP1/TT,出閘僅屬一般，居後列。毫無表現。
2026-01-11,沙田,3,12,11,高感 (J515),楊明綸,CP/TT,居中間之後位置。直路彎向外移出。從未能構成威脅。
2026-01-11,沙田,4,1,6,進傲星 (J340),艾兆禮,B,跟隨領先兩駒。移入內欄及加速良佳，一百五十米處取得領先。僅勝。
2026-01-11,沙田,4,2,1,安泰 (H161),潘頓,P-/XB,居後列，留力候上。四百米處空位不足及受困。三百米處望空，隨即保持佳勢。過終點時仍在追近頭馬。
2026-01-11,沙田,4,3,11,綫路萬里 (H475),班德禮,PC/TT,跟隨領先兩駒。三百米處展開挑戰，已獲機會盡展所長。持續力拼。
2026-01-11,沙田,4,4,9,勤德天下 (K327),潘明輝,--,居中間位置。二百米處追前。保持穩勢。
2026-01-11,沙田,4,5,14,競駿天下 (G272),田泰安,CP,居中間之後位置。四百米處未能加速。最後一百米保持佳勢，但速度不足以展開挑戰。
2026-01-11,沙田,4,6,12,手到再來 (H429),鍾易禮,TT,居後列。自三百米處起追前。保持走勢。
2026-01-11,沙田,4,7,10,非凡時刻 (K275),巴度,V,帶頭競跑。一百五十米處被超越，再無餘力，外閃。
2026-01-11,沙田,4,8,5,星運少爵 (H459),何澤堯,--,跟隨領先馬匹，走第三疊。自四百米處起在催策下保持同速，未能展開挑戰。一百米處一度勒避。
2026-01-11,沙田,4,9,4,逍遙騎士 (K370),麥文堅,CP-/B1/TT,居後列。沿途走外疊。四百米處受催策。末段略為追前，從未能構成威脅。
2026-01-11,沙田,4,10,8,紅磚戰士 (K580),霍宏聲,XB,出閘緩慢，其後恢復走勢，居中間位置。二百米處未能加速，其後瞬即轉換跑線。轉弱。
2026-01-11,沙田,4,11,13,文明福星 (J315),金誠剛,BO/H,追逼領放馬。四百米處受催策。最後二百米轉弱。
2026-01-11,沙田,4,12,3,朗日自強 (J530),奧爾民,V/TT,自外檔出閘後留後。沿途居後列。
2026-01-11,沙田,4,13,7,彩虹戰士 (K348),希威森,SR-/CP1/TT,留居包尾位置。在催策下毫無表現。從未參與競逐。
2026-01-11,沙田,4,14,2,戀愛狂 (K118),布文,TT,居中間位置。沿途走外疊。四百米處轉弱，瞬即落後甚遠。
2026-01-11,沙田,5,1,5,機械之星 (K559),潘頓,CP,與對手同步躍出，居中間位置，走第二疊。接近五百五十米處時開始上前。入直路時走外疊。衝刺強勁，勝出賽事。
2026-01-11,沙田,5,2,4,龍城強將 (H095),希威森,B,自外檔出閘迅速，受催策上前領放。入直路時領先一個半馬位。二百米處被超越。五十米處重奪領先位置。末段保持佳勢，但未能抗衡對手的挑戰。
2026-01-11,沙田,5,3,6,跨境駿馬 (L022),艾道拿,B,出閘一般，居中間之前位置，走第二疊。直路彎前居相同位置。直路初對催策反應甚佳。二百米處取得領先。五十米處未能再增速及被超越。保持穩勢至終點。
2026-01-11,沙田,5,4,1,久久為軍 (K231),鍾易禮,TT,出閘僅屬一般，居後列。中段落後約九個馬位。入直路時走大外疊。直路上追前甚多，取得第四名，但未能威脅首三名馬匹。
2026-01-11,沙田,5,5,9,星辰千帥 (K325),奧爾民,TT,起步後不久受擠迫，居中間稍前位置，走第二疊。入直路時走較外疊。直路初略為追前。二百米處未能再增速。保持穩勢至終點。
2026-01-11,沙田,5,6,2,鋁神 (K105),霍宏聲,TT,出閘僅屬一般及發生觸碰，落後領放馬五個馬位，走內疊。五百米處向外移出。入直路時落後相同距離。末段以穩勢衝刺。
2026-01-11,沙田,5,7,3,奮鬥輝煌 (J236),周俊樂,B/TT,自外檔出閘迅速，受催策上前，居前列，走外疊。直路彎前居相同位置。直路初未能再增速。最後二百米轉弱。
2026-01-11,沙田,5,8,12,發財金戈 (K457),金誠剛,H,起步後不久被碰撞及失去平衡，居後列，走第二疊。入直路時落後九個馬位。直路上超越數匹已呈疲態的對手。
2026-01-11,沙田,5,9,14,競駿勇士 (K464),田泰安,PC/TT,出閘笨拙，居中間之後位置，走第二疊。入直路時落後六至七個馬位。直路上衝刺乏力。（賽後翌日左前腿不良於行。）
2026-01-11,沙田,5,10,10,勇敢孖寶 (K421),何澤堯,CP,躍出時向外斜跑及被碰撞，居中間稍前位置，走內疊。直路彎走內疊節省腳程。直路初未能再增速。其後轉弱。
2026-01-11,沙田,5,11,11,瑪納霏 (K075),梁家俊,XB/TT,起步時發生碰撞，居後列，走外疊。大部分途程沒有遮擋。直路上毫無表現。
2026-01-11,沙田,5,12,7,準希望 (L047),巴度,--,出閘稍慢及與對手互相碰撞，居後列，落後約八個馬位，走內疊。直路彎走內疊節省腳程。直路上毫無進展。
2026-01-11,沙田,5,13,8,摯友心得 (K263),潘大衛,P2,出閘迅速，居前列，走內疊。接近九百米處時讓對手過頭。直路彎緊隨領放馬。直路初未能再增速。最後二百五十米轉弱。
2026-01-11,沙田,5,14,13,無極勇將 (J169),紀仁安,B/TT,躍出時向內斜跑及與對手互相碰撞，留居包尾位置，走內疊。直路彎走內疊節省腳程。直路上毫無進展。（見競賽事件報告。）
2026-01-11,沙田,6,1,5,中國心 (K395),潘頓,B-,居中間之後位置，走第三疊。衝刺凌厲，掄元。
2026-01-11,沙田,6,2,1,大千雄心 (K398),布文,TT,居包尾位置。保持走勢，未能威脅頭馬。
2026-01-11,沙田,6,3,10,風火恆雲 (H388),紀仁安,B,居中間位置，走第三疊。直路初略為加速上前，保持走勢至終點。
2026-01-11,沙田,6,4,4,同益善 (K254),麥文堅,CP1/TT,居後列。直路上追前甚多。
2026-01-11,沙田,6,5,2,競駿良駒 (K178),奧爾民,CP/XB,居中間位置，走第二疊。衝刺不俗。
2026-01-11,沙田,6,6,8,佰勝金龍 (K458),梁家俊,CP/TT,居中間之後位置，走第二疊。在催策下保持同速。
2026-01-11,沙田,6,7,7,彭玥 (J447),何澤堯,B/TT,居前列，走第二疊。直路初受困。略為追前。
2026-01-11,沙田,6,8,6,包裝旋風 (H137),班德禮,B/TT,居中間位置，走內欄。無路可上。從未能真正施為。（氣管內有很多血。）
2026-01-11,沙田,6,9,14,架勢奇爸 (G312),艾兆禮,TT,居中間之後位置，走內欄。末段超越數匹已轉弱的對手。（見競賽事件報告。）
2026-01-11,沙田,6,10,13,多利神駒 (G292),霍宏聲,TT,出閘迅速，取得領先，搶口。直路上轉弱。（見競賽事件報告。）
2026-01-11,沙田,6,11,12,富喜來 (H213),潘明輝,B/TT,居領放馬之後，走內欄。從未參與競逐。
2026-01-11,沙田,6,12,3,金駒永騰 (J398),金誠剛,CP,居中間之前位置，走第三疊。自五百五十米處起受催策，其後瞬即墮退。（流鼻血。）
2026-01-11,沙田,6,13,9,耀昌勝世 (J529),巴度,V,居領放馬外側。直路上轉弱及力竭。
2026-01-11,沙田,6,14,11,歡樂老撾 (H432),田泰安,--,居前列，走第三疊，沒有遮擋。從未能構成威脅。（表現難以接受，必須試閘及格。）
2026-01-11,沙田,7,1,7,競駿皇者 (K011),霍宏聲,TT,自外檔出閘後瞬即留居遙遙落後的位置，留力候上。入直路時受困，移入內疊取位。五十米處在被迫移離內欄以繼續上前時衝刺良佳，過終點時險勝。
2026-01-11,沙田,7,2,9,超寫意 (K469),田泰安,TT,自大外檔出閘迅速，居好位，走外疊。約九百米處取得領先。開始轉直路彎時移入內欄。入直路時領先近一個馬位，在催策下保持走勢，但過終點時僅敗。
2026-01-11,沙田,7,3,1,星月飛雲 (K363),布文,CP,居最後數位之內，走內欄。入直路時居相若位置。以佳勢上前，但二百米處受困。就在過了一百米處後望空時重新發力，末段衝刺良佳。
2026-01-11,沙田,7,4,12,穿甲戰鷹 (J039),艾兆禮,CP/TT,居最後數位之內，走第三疊。入直路時移至最外疊。在跑道中央衝刺強勁，末段表現最佳。
2026-01-11,沙田,7,5,4,錶之極光 (K097),蔡明紹,V/TT,出閘迅速，大多居第五位，落後領放馬約三個馬位。入直路時移至較外疊，穩步上前，但未能構成威脅。
2026-01-11,沙田,7,6,10,馬馳登 (L133),巴度,TT1,居中間之前第六位，落後領放馬約三個馬位，走內欄。轉直路彎時略為墮退，但入直路時重新發力，在催策下持續力拼，但未能構成威脅。
2026-01-11,沙田,7,7,3,巴基之勝 (J363),奧爾民,B/TT,居領先馬群中，逐漸留後約兩個馬位。轉直路彎時居第二疊第二位，即馬群中的第四位。直路上保持穩勢，但未能構成威脅。
2026-01-11,沙田,7,8,8,盈妍威楓 (J300),希威森,B/TT,大多居中間位置，走第三疊。轉直路彎時略為墮後，走更外疊。最後三百米在催策下持續力拼，五十米處受阻礙。
2026-01-11,沙田,7,9,2,關鍵所在 (K154),黃智弘,B/TT,早段受催策，取得領先。直路彎早段失去領先位置，居第二位。轉入直路時居領先馬匹稍後的第三位，瞬即轉弱。
2026-01-11,沙田,7,10,5,星運傳奇 (L019),何澤堯,TT,自外檔出閘迅速，居第四位，落後領放馬約一個馬位，走第三疊，沒有遮擋。直路彎早段追上領放馬。入直路時並排領先，但無以為繼，最後三百米在催策下轉弱。
2026-01-11,沙田,7,11,11,鬆啲 (K384),楊明綸,TT,遙居於後。從未能構成威脅。
2026-01-11,沙田,7,12,6,弦力寶 (K317),潘頓,H1/TT1,出閘一般，瞬即恢復走勢，居中間之後第八位，走內欄。七百米處移出第二疊。直路早段在馬群之後受困。三百米處受阻礙，乏力墮退。（流鼻血。）
2026-01-11,沙田,8,1,8,小鳥天堂 (K246),潘頓,TT,出閘僅屬一般，居中間位置，走勢良佳。七百米處移離內欄。直路早段以佳勢加速，三百米處取得領先，保持勁勢，勝出賽事，表現出色。
2026-01-11,沙田,8,2,13,晒冷 (K369),巴度,--,自第十檔出閘，留居接近包尾位置。跑離直路彎時落後甚遠。自四百米處起受困而未能望空至二百五十米處，其後衝刺強勁，跑獲亞軍。
2026-01-11,沙田,8,3,11,駿跑得 (K208),蔡明紹,--,留居後列，走內欄。入直路時固守內疊。衝刺不俗，接近終點時跑獲季軍，但未能威脅頭兩名馬匹。
2026-01-11,沙田,8,4,9,威利金箭 (L035),艾兆禮,CP-,早段跟上步速，其後居領先馬匹之後，走第三疊，沒有遮擋。直路早段對催策反應良佳。接近二百米處時進佔第二位，但末段後勁不繼。
2026-01-11,沙田,8,5,1,永遠美麗 (H008),艾道拿,E-,居中間之後位置，落後六個馬位。跑過四百米處時衝刺欠強勁。未能對領先馬匹構成威脅。
2026-01-11,沙田,8,6,2,健康愉快 (D435),周俊樂,B/TT,居中間位置，落後步速甚快的領放馬四至五個馬位。入直路時對催策反應僅屬一般，未能威脅領先馬匹。（騎師被查詢有關他於中段的騎法。）
2026-01-11,沙田,8,7,6,信心星 (J161),布文,TT,早段跟上步速。進入直路彎時居第三位，跟隨領先馬匹。跑過五百米處時上前展開挑戰。直路早段爭奪領先，但跑過二百米處時無以為繼。
2026-01-11,沙田,8,8,3,笑傲江湖 (K168),何澤堯,--,與對手同步躍出，留居中間位置，走第三疊。入直路時移出最外疊以展開挑戰，但末段衝刺僅屬一般。（賽後接受獸醫檢查，並無發現任何明顯異常之處。）
2026-01-11,沙田,8,9,12,同樣美麗 (H334),鍾易禮,B/TT,居中間之前位置。接近九百米處時在受擠迫之際收慢，其後在一段途程上搶口。直路上在催策下衝刺乏力。從未能對領先馬匹構成真正威脅。
2026-01-11,沙田,8,10,5,飛鷹翱翔 (H117),紀仁安,--,起步後勒避，其後居於遠較往常為後的接近包尾位置。入直路時對催策反應僅屬平平。從未能構成威脅。
2026-01-11,沙田,8,11,10,競駿輝煌 (J195),楊明綸,E-/B,起步後搶口，早段領放，居於遠較賽前部署為前的位置。進入直路彎時跟隨領放馬。直路早段保持同速。二百五十米處轉弱。
2026-01-11,沙田,8,12,4,舞林密碼 (G365),黃智弘,TT,自第十四檔出閘，早段受催策上前。就在進入直路彎前切入領放。三百米處被對手超越，再無餘力及轉弱。
2026-01-11,沙田,8,13,14,一先生 (G227),班德禮,V/TT,自第十三檔出閘，墮居尾列。直路初仍落後頗遠，但對催策毫無反應。從未參與競逐。
2026-01-11,沙田,8,14,7,但求開心 (J420),巫顯東,CP/TT,自第一檔出閘，居中間之前位置，走內欄。直路早段力拼以跟上對手。二百米處迅速轉弱。（第二次流鼻血。須強制退役。）
2026-01-11,沙田,9,1,14,發財先鋒 (G171),梁家俊,B-/CP2,出閘緩慢，居後列。入直路時在推策下走外疊。四百五十米處一度受阻礙。衝刺強勁，一百五十米處取得領先，其後保持領先。
2026-01-11,沙田,9,2,2,桃花開 (J301),布文,CP/TT,躍出時發生碰撞，居後列，留力候上。四百米處跟隨頭馬上前。衝刺強勁，追近頭馬，但一直落後。
2026-01-11,沙田,9,3,10,豐辰 (K004),紀仁安,H,起步後不久受阻，居中間位置，走第三疊。直路彎受催策以追趕領先馬匹。保持走勢，但末段再未能威脅首兩名馬匹。
2026-01-11,沙田,9,4,12,包裝戰仕 (L112),希威森,TT1,居中間位置。直路初受催策，保持走勢，但從未能加速以挑戰領先馬匹。
2026-01-11,沙田,9,5,3,盈好威楓 (K131),周俊樂,V,早段居中間之後位置，走外疊。千四米處開始上前。九百米處追上領放馬。最後二百米轉弱。
2026-01-11,沙田,9,6,9,火焰閃爍 (K098),潘頓,B,居中間位置，走內欄。未能望空直至三百米處。二百五十米處發生碰撞及失去平衡。騎師對坐騎的動作有疑慮，因而未能全力施為。
2026-01-11,沙田,9,7,11,安可 (K252),艾兆禮,--,自最外檔出閘後墮後。直路彎沿欄受推策以追趕領先馬匹。最後二百米追前數位，但從未能構成威脅。
2026-01-11,沙田,9,8,4,星價 (K093),巴度,CP/TT,起步後不久受擠迫，居後列。直路彎未能跟上步速，被拋離。最後二百米保持佳勢，略為追前。
2026-01-11,沙田,9,9,8,浪漫戰神 (K012),霍宏聲,XB/TT,切入追迫領放馬。九百米處墮居第三位。四百米處順勢上前挑戰。最後二百米力竭。
2026-01-11,沙田,9,10,5,奔放 (K156),蔡明紹,TT,展現前速以切入內疊，以快步速領放。九百米處被追上。保持領先短距離直至一百五十米處始被頭馬超越，自該處起墮退。
2026-01-11,沙田,9,11,7,英駿飛駒 (H376),艾道拿,B-/XB/V2/TT,跟隨領先馬匹。直路初走勢暢順，追趕領先馬匹。最後二百米洩氣。
2026-01-11,沙田,9,12,13,八仟財陞 (J442),田泰安,B,出閘緩慢，居中間位置，走內欄。直路初一度發力。最後二百米再無餘力。
2026-01-11,沙田,9,13,1,春風萬里 (H383),黃智弘,TT,跟隨領先馬匹，走內欄。三百五十米處轉換跑線以望空。在催策下未能加速，迅速墮退。
2026-01-11,沙田,9,14,6,驥跑得 (K206),奧爾民,B,躍出時發生碰撞，跟隨領放馬，走外疊，沒有遮擋。半程時未能保持位置。二百五十米處被拋離時收慢。
2026-01-11,沙田,10,1,1,白鷺金剛 (K296),布文,CP,與對手同步躍出，居中間之後位置，走第二疊。跑過六百米處後向外移出。入直路時走大外疊。衝刺凌厲，勝出賽事。
2026-01-11,沙田,10,2,2,美麗星晨 (K491),潘頓,TT,起步時被碰撞，早段居前列，但走外疊。跑過千二米處後留居中間稍前位置，走第二疊。入直路時落後三個馬位。二百五十米處取得領先。保持佳勢，但最後五十米不敵頭馬。
2026-01-11,沙田,10,3,10,超勁赤兔 (K312),紀仁安,H/P/TT,出閘笨拙，居中間位置，走第二疊。入直路時落後約四個馬位。難以望空直至趨近一百五十米處。衝刺良佳，跑獲季軍，但未能威脅首兩名馬匹。
2026-01-11,沙田,10,4,14,智多多寶 (K387),楊明綸,XB-/H2/TT-,出閘僅屬一般，留居後列，走內疊。五百五十米處向外移出。直路上追前甚多，取得第四名。過終點時最為接近。
2026-01-11,沙田,10,5,9,加州熱浪 (K477),班德禮,B/XB/TT,起步時發生碰撞，早段居中間之前位置，但走大外疊。跑過千三米處後略為留居中間位置，走第三疊。入直路時落後四個馬位。直路初略為追前。一百五十米處未能再增速。末段保持穩勢。
2026-01-11,沙田,10,6,11,一世美麗 (K489),艾兆禮,H,出閘迅速，落後領放馬兩個馬位，走內疊。直路彎略為追近。直路初略為追前。一百五十米處未能再增速。最後一百米逐漸轉弱。
2026-01-11,沙田,10,7,12,爆得美麗 (K368),田泰安,--,自外檔出閘，留居中間之後位置，走外疊。接近五百五十米處時被帶出更外疊。入直路時走大外疊。直路上略為追前。
2026-01-11,沙田,10,8,8,高高至高 (L032),希威森,B-/CP2/TT,自第一檔出閘普通，居中間之後位置，走內疊。接近八百米處時一度受擠迫。直路彎走內疊節省腳程。直路初對催策反應平平。最後二百米逐漸轉弱。
2026-01-11,沙田,10,9,3,丞匡掠影 (L168),麥文堅,--,出閘迅速，落後兩個馬位，走第二疊。直路彎前居相同位置。直路初對催策略有反應。二百米處未能再增速。最後一百五十米轉弱。
2026-01-11,沙田,10,10,6,開心三寶 (K511),霍宏聲,--,與對手同步躍出，受催策上前帶頭。入直路時領先一個馬位。二百五十米處未能再增速及被超越。最後二百米轉弱。（見競賽事件報告。）
2026-01-11,沙田,10,11,13,時時開心 (K550),金誠剛,XB,躍出時受擠迫，留居後列，走外疊。入直路時落後約六個馬位。直路上衝刺乏力。
2026-01-11,沙田,10,12,4,天然數字 (L166),奧爾民,B2,與對手同步出閘，居第二位，走第二疊。直路彎前居相同位置。直路初未能再增速。最後二百五十米轉弱。（見競賽事件報告。）
2026-01-11,沙田,10,13,5,大文豪 (L134),何澤堯,--,自外檔出閘，留後。沿途居後列。從未有力一爭。
2026-01-11,沙田,10,14,7,綠色鐵蹄 (L147),潘明輝,TT1,出閘稍慢，居中間稍前位置，走第二疊。接近九百米處時移入內欄。直路彎走內欄節省腳程。直路初對催策毫無反應。三百米處轉弱。包尾大敗而回。
2026-01-11,沙田,11,1,13,一生好彩 (K114),潘明輝,XB,跟隨領放馬，走外疊，沒有遮擋。直路彎追前甚多，繼續走外疊。持續上前，三百米處取得領先。末段受亞軍馬匹的強勁挑戰，但保持佳勢，僅勝。
2026-01-11,沙田,11,2,7,凌登 (L151),巫顯東,P-/TT1,自最外檔出閘後墮後。入直路時仍居包尾位置，走最外疊，受推策。最後二百米以佳勢追前。五十米處進佔第三位。
2026-01-11,沙田,11,3,14,火悟空 (K335),艾兆禮,TT-,跟隨領先馬匹。直路初空位不足。最後二百米嘗試追前時未能完全望空。
2026-01-11,沙田,11,4,2,喜蓮勁感 (L028),布文,H/XB/TT,居中間位置，走第三疊，沿途搶口。直路彎上前，六百米處跟隨頭馬推進。自四百米處起展開挑戰，一度甚具爭勝機會。在催策下保持同速。
