date,venue,race_no,place,horse_no,horse_name,jockey,gear,commentary
2026-02-08,沙田,1,1,8,全神貫注 (H465),紀仁安,B,出閘迅速，居中間位置，走第三疊，有遮擋。入直路時落後三個馬位。直路上對催策反應甚佳，二百米處取得領先，保持甚佳走勢至終點。
2026-02-08,沙田,1,2,3,順善寶 (K239),黃智弘,B-/TT,出閘笨拙，居後列，走內疊。直路彎走內疊節省腳程。直路早段未能望空，接近二百五十米處時望空。末段衝刺良佳，跑獲亞軍。
2026-02-08,沙田,1,3,1,旋風傳奇 (J152),田泰安,B,與對手同步躍出，居中間之後位置，走第二疊。六百米處向外移出，入直路時走大外疊。直路早段追前甚多，一百米處未能再增速。保持穩勢至終點。
2026-02-08,沙田,1,4,5,美神來 (J174),巴度,B,與對手同步躍出，居中間稍後位置，走內疊。直路彎走內疊節省腳程。未能望空直至趨近一百五十米處。末段衝刺良佳，取得第四名，但未能威脅頭三名馬匹。
2026-02-08,沙田,1,5,7,首駿 (K189),麥文堅,XB/TT,與對手同步出閘，落後領放馬兩至三個馬位，走內欄。直路彎走內欄節省腳程。直路早段未能望空，接近二百五十米處時望空。保持穩勢至終點。
2026-02-08,沙田,1,6,14,紅旺繽紛 (J255),班德禮,CP/SR/TT,出閘迅速，居中間之前位置，走第二疊。直路彎居相同位置。直路早段略為追前，一百五十米處未能再增速，最後五十米轉弱。
2026-02-08,沙田,1,7,6,肥仔精神 (K110),周俊樂,BO/SR/TT,自大外檔出閘迅速，居前列，走第二疊。入直路時落後半個馬位。趨近二百五十米處時取得領先。二百米處未能再增速及被超越。最後一百米轉弱。
2026-02-08,沙田,1,8,9,常常感恩 (J065),艾兆禮,V/TT,自第一檔出閘普通，居領放馬之後，走內疊。直路彎走內疊節省腳程。直路上未能望空。
2026-02-08,沙田,1,9,11,工程小子 (K244),潘大衛,B/XB,自外檔出閘，留居後列，走外疊。入直路時走大外疊。末段超越數匹已呈疲態的對手。（見競賽事件報告。）
2026-02-08,沙田,1,10,13,歐洲傳奇 (H153),蔡明紹,B/TT,起步時碰撞對手，居中間位置，走第二疊。直路彎前居相同位置。直路早段未能再增速，最後二百米逐漸轉弱。
2026-02-08,沙田,1,11,2,海洋帝君 (K230),金誠剛,--,起步時被碰撞及失去平衡，居後列，走第二疊。入直路時落後五至六個馬位。直路上毫無表現。
2026-02-08,沙田,1,12,10,領航傳祺 (G126),潘明輝,P-/B2/TT,出閘稍慢，留居中間之後位置，走內疊。跑過六百米處後向外移出。入直路時落後四個馬位。直路早段未能望空，接近二百五十米處時受妨礙，其後毫無進展。
2026-02-08,沙田,1,13,12,不假外求 (J493),楊明綸,V-/CP2,自第十二檔出閘迅速，居中間之前位置，走第三疊。沿途沒有遮擋。直路早段未能再增速。最後二百米轉弱。
2026-02-08,沙田,1,14,4,飛黃 (J406),霍宏聲,H-/TT1,出閘普通，受催策上前領放。入直路時領先半個馬位。趨近二百五十米處時未能再增速及被超越。最後二百米轉弱。（見競賽事件報告。）
2026-02-08,沙田,2,1,12,勁勇皇駒 (K157),艾兆禮,B/XB,居中間之後位置。直路彎追前甚多。未能望空直至二百米處。衝刺強勁，在多駒幾乎齊過終點下率先衝線。
2026-02-08,沙田,2,2,1,馬錢子 (L053),紀仁安,--,居前列。直路早段加速，二百五十米處進佔領先位置。保持佳勢，但終點線上被頭馬超越。
2026-02-08,沙田,2,3,8,金多囍 (K272),何澤堯,B-/PC1/TT,起步緩慢，居中間位置，走第三疊。入直路時受推策，走外疊。末段保持佳勢。
2026-02-08,沙田,2,4,3,紅衣醒目 (K184),潘頓,CP2/TT,跟隨領先馬匹。七百米處碰撞他駒。直路彎追前甚多。自四百米處起展開挑戰，一度甚具爭勝機會。末段在催策下保持同速。
2026-02-08,沙田,2,5,10,摯友心得 (K263),田泰安,--,出閘時失蹄，居後列。入直路時受推策，走最外疊。保持走勢，但從未能加速以爭勝。
2026-02-08,沙田,2,6,2,飛來霸 (K284),潘明輝,TT,展現前速以切入內疊。直路初受對手挑戰。二百五十米處被亞軍馬匹超越，最後一百米洩氣。
2026-02-08,沙田,2,7,5,贏得自然 (J365),周俊樂,B-,跟隨領放馬，走外疊，沒有遮擋。七百米處被碰撞，失去平衡。直路彎被帶出較外疊。所負不遠。
2026-02-08,沙田,2,8,9,怡昌精神 (H379),金誠剛,B/XB/TT,出閘緩慢，不久後勒避，留居包尾位置。五百米處受催策。末段超越數匹漸呈疲態的對手。
2026-02-08,沙田,2,9,11,飛雲 (H320),巴度,TT,居中間位置，走內欄。七百米處被迫收慢避開對手的後蹄。四百五十米處受催策，但未能加速。
2026-02-08,沙田,2,10,4,平天雄 (K407),麥文堅,B-/V2,居中間之後位置，走內欄。直路初受催策，但速度不足以展開挑戰。
2026-02-08,沙田,2,11,6,火神神樂 (H384),蔡明紹,BO,跟隨領先馬匹，走內欄。七百米處被迫收慢避開對手的後蹄。直路彎難以保持位置。最後二百米墮退。
2026-02-08,沙田,2,12,7,威威神駒 (K565),奧爾民,CP1,出閘笨拙，居後列。六百米處墮後至包尾位置。最後三百米未能跟上步速，被拋離。
2026-02-08,沙田,3,1,5,幸運奇兵 (L071),霍宏聲,--,居中間位置。走勢暢順。轉直路彎時向外移出。最後二百米追前甚多。
2026-02-08,沙田,3,2,3,友瑩亮 (K400),潘頓,CP,居前列，走外疊。末段保持佳勢。已獲機會盡展所長。
2026-02-08,沙田,3,3,11,海王 (K523),金誠剛,CP/TT,居中間位置。走勢不俗。末段保持穩勢。
2026-02-08,沙田,3,4,7,好運年 (K443),潘明輝,--,居後列。末段對鞭策反應不俗。
2026-02-08,沙田,3,5,2,皇者有利 (J539),黃智弘,TT,受催策，取得領先。入直路時略為轉弱。速度不足以展開挑戰。
2026-02-08,沙田,3,6,8,睿智多寶 (L044),艾道拿,B-/V1/TT,追趕領放馬。走勢一般。二百米處一度受困。末段衝刺一般。（見競賽事件報告。）
2026-02-08,沙田,3,7,10,超開心 (K260),艾兆禮,B/TT,居中間之前位置。直路初受困。對催策反應不大。（見競賽事件報告。）
2026-02-08,沙田,3,8,14,連連好運 (K500),田泰安,CP,居中間位置。保持同速至終點。（見競賽事件報告。）
2026-02-08,沙田,3,9,13,威力非凡 (K152),紀仁安,XB,居中間之後位置。直路上未能加速。無甚表現。
2026-02-08,沙田,3,10,9,競駿傳奇 (K465),奧爾民,B,出閘笨拙。沿途居後列。末段略為追前。
2026-02-08,沙田,3,11,12,勝在當下 (K532),巴度,B/TT-,居前列。走勢稚嫩。對催策反應平平。
2026-02-08,沙田,3,12,1,醒目先駒 (K006),麥文堅,--,居後列。直路上向外移出。末段衝刺一般。（表現令人失望。必須試閘及格。見競賽事件報告。）
2026-02-08,沙田,3,13,4,日日獎 (H283),潘大衛,TT,居中間之後位置。從未能構成威脅。
2026-02-08,沙田,4,1,11,金玉良言 (J499),艾兆禮,CP-/B1,居中間位置，走第三疊。最後三百米保持穩勢。末段超越亞軍馬匹，取得領先。
2026-02-08,沙田,4,2,3,伶俐驫駒 (H108),田泰安,--,自大外檔出閘後受催策上前，跟隨領先兩駒。二百米處上前領放。保持佳勢至終點，但接近終點時被超越。
2026-02-08,沙田,4,3,1,顯勝高昇 (K409),梁家俊,XB,跟隨領放馬。在催策下保持走勢。末段被帶向外跑。
2026-02-08,沙田,4,4,12,起舞奜奜 (K405),何澤堯,B,跟隨領放馬。四百米處受推策，保持走勢。最後一百米受緊迫，未能被全力催策。
2026-02-08,沙田,4,5,2,瑤瑤日上 (J423),周俊樂,--,居中間位置。最後二百米在催策下保持走勢，但速度不足以展開挑戰。
2026-02-08,沙田,4,6,4,龍之邦 (K079),楊明綸,H/TT,居後列，留力待上。三百米處受催策。保持同速，從未能構成威脅。
2026-02-08,沙田,4,7,7,大番薯 (J383),霍宏聲,TT,帶頭競跑，在領放下受追迫。二百米處被超越，力竭。
2026-02-08,沙田,4,8,8,博愛先鋒 (G465),布文,TT,居中間位置。轉入直路時受催策。保持同速，從未能構成威脅。
2026-02-08,沙田,4,9,9,花果猴王 (H455),鍾易禮,H/TT,居後列。三百米處一度追前。無甚表現。
2026-02-08,沙田,4,10,6,幸運勝利 (L073),奧爾民,TT,出閘時受擠迫，居最後兩位。直路彎外閃，入直路時掙扎上前，瞬即遙遙落後。
2026-02-08,沙田,4,11,5,富心星 (K125),黃智弘,B/TT,追迫領放馬。二百五十米處轉弱。
2026-02-08,沙田,4,12,10,超智多寶 (K541),艾道拿,CP/TT,出閘緩慢，受擠迫，居最後兩位。掙扎上前，最後二百米被拋離。
2026-02-08,沙田,5,1,5,榮利雙收 (K382),班德禮,CP-/B1,起步時向外斜跑，居中間位置，走第二疊。五百米處向外移出。直路上對催策反應甚佳。趨近一百五十米處時取得領先。保持佳勢至終點，勝出賽事。
2026-02-08,沙田,5,2,2,進傲星 (J340),艾兆禮,B,自第一檔出閘普通，落後領放馬兩個馬位，走內疊。直路彎走內疊節省腳程。直路初未能望空。三百米處望空。衝刺良佳，跑獲亞軍，但未能威脅頭馬。
2026-02-08,沙田,5,3,14,超風速 (J205),田泰安,V,起步時發生碰撞，居前列，走外疊。直路彎前居相同位置。三百五十米處取得領先。一百五十米處未能再增速，被超越。保持穩勢至終點。
2026-02-08,沙田,5,4,7,逍遙騎士 (K370),麥文堅,B/TT,與對手同步躍出，居中間位置，走內疊。直路彎走內疊節省腳程。四百五十米處向外移出。直路初對催策略有反應。接近二百五十米處時未能望空。一百五十米處望空。其後略為追前。（見競賽事件報告。）
2026-02-08,沙田,5,5,6,爆出美麗 (K155),布文,TT,出閘稍慢及受擠迫，居後列，走內疊。五百米處向外移出。直路初略為追前。二百米處未能再增速。末段以穩勢上前。
2026-02-08,沙田,5,6,11,星光快驅 (K215),潘頓,CP-/B1/TT,起步時受擠迫，居包尾位置。直路彎走內疊節省腳程。入直路後保持走內疊，略為追前。
2026-02-08,沙田,5,7,8,花開 (L037),奧爾民,--,起步後不久與對手互相碰撞，居中間之後位置，走第二疊。直路彎墮居後列。直路初未能望空。其後略為追前。
2026-02-08,沙田,5,8,10,紅磚戰士 (K580),霍宏聲,XB,出閘笨拙，居中間之後位置，走內疊。直路彎走內疊節省腳程。未能望空直至趨近最後五十米。保持穩勢至終點。
2026-02-08,沙田,5,9,12,林寶精神 (K305),周俊樂,CP,起步後不久被碰撞，居後列，走第二疊。六百米處向外移出。入直路時走大外疊。直路上略為追前。
2026-02-08,沙田,5,10,13,勇敢孖寶 (K421),何澤堯,CP,自最外檔出閘，留居中間之後位置，走外疊。直路彎前居相同位置。末段保持同速。
2026-02-08,沙田,5,11,3,三強 (K229),楊明綸,P,與對手同步躍出，居中間之前位置，走第二疊。早段及中段難以穩定走勢。入直路時走第三疊。直路初對催策略有反應。二百米處未能再增速。最後一百五十米轉弱。（見競賽事件報告。）
2026-02-08,沙田,5,12,1,新力飆 (K177),金誠剛,TT,起步時發生碰撞，居後列，走外疊。中段沒有遮擋。入直路時走大外疊。直路上毫無進展。
2026-02-08,沙田,5,13,9,保羅輝煌 (K524),潘明輝,CP1,起步時發生碰撞，居中間之前位置，走外疊。入直路時落後兩個半馬位。直路初未能再增速。其後轉弱。
2026-02-08,沙田,5,14,4,龍城強將 (H095),希威森,B,起步時向內斜跑及發生觸碰，受催策上前取得領先。三百五十米處未能再增速，被超越。其後轉弱。（心律不正常。）（見競賽事件報告。）
2026-02-08,沙田,6,1,7,鼓浪好友 (J217),田泰安,--,出閘迅速，居前列，走第二疊。末段受衝刺強勁的對手挑戰時保持勁勢。
2026-02-08,沙田,6,2,4,賢知友您 (K545),奧爾民,XB1/TT,出閘一般，逐漸居最後數位之內。四百五十米處移出外疊望空。衝刺強勁，一百五十米處居頭馬外側，落後四分三個馬位，但未能進一步收窄距離。
2026-02-08,沙田,6,3,2,錶之浩瀚 (L106),周俊樂,TT,出閘迅速，居第二疊第二位，落後領放馬三個馬位。直路上一度空位不足，其後末段在催策下以勁勢衝刺。
2026-02-08,沙田,6,4,3,北地烈馬 (J488),梁家俊,H-/TT,與對手同步躍出，受催策上前，單騎領放。轉直路彎時仍領先一個半馬位。以佳勢力拼，取得第四名。
2026-02-08,沙田,6,5,1,遨遊波士 (K321),潘頓,B,自最外檔出閘，收慢留居後列，走第三疊，有遮擋。入直路時移出外疊。末段追前頗多。（見競賽事件報告。）
2026-02-08,沙田,6,6,10,增旺 (K148),艾道拿,--,居中間位置，走第二疊。中段搶口。衝刺良佳。僅以不足三個馬位之差落敗。
2026-02-08,沙田,6,7,8,嘉嘉友福 (K456),布文,CP/XB/TT,出閘笨拙，迅速恢復走勢，居第三位，緊隨對手。末段難以望空。未能全力施為。落敗情有可原。
2026-02-08,沙田,6,8,6,縱橫大兄 (L012),希威森,CP-/TT,與對手同步躍出，切入內欄，居中間位置。受困直至三百米處。保持位置。
2026-02-08,沙田,6,9,5,豐功偉績 (K480),麥文堅,H,早段留居包尾位置。直路彎受推策以居啣接位置。保持佳勢。
2026-02-08,沙田,6,10,11,花香月明 (K276),金誠剛,XB/H1/TT,自外檔出閘，早段迅速在馬群之後切入。加速需時。從未參與競逐。
2026-02-08,沙田,6,11,9,龍傲綾羅 (K318),何澤堯,--,出閘笨拙，其後不久受對手擠迫，居中間稍後位置，走內欄。末段受困。表現欠佳。（見競賽事件報告。）
2026-02-08,沙田,6,12,12,風采人生 (J366),潘大衛,B/TT,自第十檔出閘，未能切入內疊。沿途多走腳程。中段走勢欠順。最後二百米受催策時力竭。
2026-02-08,沙田,7,1,9,閃耀天河 (K514),周俊樂,XB1/TT-,留居中間之後位置，走第三疊，有遮擋。入直路時瞬即展開挑戰。在催策下上前，約一百米處取得領先。
2026-02-08,沙田,7,2,5,巴基之勝 (J363),奧爾民,B-/V1/TT,出閘迅速，早段領先。約一千米處逐漸留後一個馬位，走內欄。三百米處展開挑戰，頗具勝望，但不敵頭馬。
2026-02-08,沙田,7,3,6,健康快車 (H439),麥文堅,E,自大外檔出閘，遙居於後，留力候上。轉直路彎時居包尾位置，入直路時走最外疊的馬匹之一。在跑道中央在催策下以佳勢上前，過終點時最為接近。
2026-02-08,沙田,7,4,1,星月飛雲 (K363),布文,CP,居中間之後位置，走內欄，搶口。轉直路彎時追近，入直路時並列第六位。保持穩勢，但未能構成威脅。
2026-02-08,沙田,7,5,11,馬馳登 (L133),巴度,TT,並列第四位，落後領放馬稍逾三個馬位，走內欄。開始轉首個彎位時進一步墮後至第五位。直路早段在對手之後空位不足。最後一百米追前甚多。
2026-02-08,沙田,7,6,8,超寫意 (K469),田泰安,TT,自外檔出閘後受催策上前，約一千米處取得領先。開始轉首個彎位時移入內欄領放，減慢步速。入直路時一度被超越，但瞬即再度領先。僅在一百米處再度被超越。
2026-02-08,沙田,7,7,7,飛馬座 (L075),紀仁安,TT,早段居中間位置，約一千米處上前居並列第四位。約八百米處步速減慢時仍居第四位，落後約兩個馬位。直路上保持穩勢，未能加速。最後一百米被超越。
2026-02-08,沙田,7,8,3,競駿皇者 (K011),霍宏聲,TT,居最後數位之內。入直路後受困。最後二百米內閃，難以策騎。
2026-02-08,沙田,7,9,2,忠誠明駒 (K574),梁家俊,CP,出閘笨拙，居後列。入直路時受催策，但餘下途程在馬匹之間空位不足。
2026-02-08,沙田,7,10,10,財富非凡 (L057),楊明綸,H/TT,瞬即遙居於後。入直路時走內疊節省腳程。再無表現。
2026-02-08,沙田,7,11,12,志善思源 (L055),潘明輝,H1/TT,早段受催策，但其後墮居中間位置。首個彎位前走第三疊，沒有遮擋。最後三百五十米再無餘力。
2026-02-08,沙田,7,12,4,關鍵所在 (K154),黃智弘,B/TT,出閘普通，其後受催策上前，約一千米處居第二疊第二位。入直路時一度以短距離領先。迅速力竭。
2026-02-08,沙田,8,1,7,數字天文 (L080),梁家俊,XB,瞬即領放。中段被對手追迫。直路前以快步速領放。跑過四百米處時保持佳勢。直路中段加速，力拒第二位馬匹的挑戰，末段帶離對手，贏得漂亮。
2026-02-08,沙田,8,2,5,勁速威龍 (H380),希威森,B,跟隨領放馬，賽事步速甚快。直路上力拼。接近終點時進佔第二位，但未能追近頭馬。（騎師報告，坐騎在直路上大部分途程在催策下外閃。）
2026-02-08,沙田,8,3,4,安遇 (G236),田泰安,--,居後列，賽事步速甚快。入直路時居包尾位置。保持走勢，跑獲季軍，未能威脅遙遙領先的頭馬。
2026-02-08,沙田,8,4,6,安騁 (H452),艾兆禮,P,早段走外疊，其後推進至領放馬外側。直路初未能加速，看似洩氣，但末段略為追前，終點線上負於入位馬匹不遠。
2026-02-08,沙田,8,5,3,禪勝輝煌 (H212),潘頓,B/XB,追趕領先馬匹，賽事步速甚快。三百五十米處以勁勢上前挑戰，直路中段落後頭馬不逾半個馬位，但瞬即後勁不繼，末段無甚餘力。
2026-02-08,沙田,8,6,2,美麗同享 (E058),布文,TT,居包尾位置，留力候上。五百五十米處開始上前。二百五十米處最接近領先馬匹，但末段再無餘力。
2026-02-08,沙田,8,7,1,直線力山 (G435),麥文堅,V,居中間位置。中段落後領放馬三至四個馬位。跑過三百米處時無以為繼。（騎師報告，坐騎在直路上受催策之際不願展步。）
2026-02-08,沙田,9,1,5,錶之極光 (K097),麥文堅,V/TT,出閘時向外斜跑及碰撞對手，跟隨領先馬匹。入直路時居好位。以勁勢上前，接近終點時取得領先。
2026-02-08,沙田,9,2,11,穿甲戰鷹 (J039),田泰安,CP/TT,居中間位置，走第三疊。入直路時跟隨頭馬。末段以佳勢上前，追近頭馬，但始終未能超越。
2026-02-08,沙田,9,3,2,時時歡欣 (K141),奧爾民,--,追趕領先馬匹，走外疊，沒有遮擋。直路初加速，二百五十米處領先。接近終點時被首兩名馬匹超越。
2026-02-08,沙田,9,4,6,晶晶日上 (H089),金誠剛,CP/TT,爭奪領先。五百米處受催策以保持位置。不敵三甲馬匹，但保持走勢，帶離餘駒，取得第四名。
2026-02-08,沙田,9,5,3,樂勝天下 (J540),潘頓,TT,沿途走最外疊。八百米處墮居後列。入直路時在最外疊受推策。保持走勢，但速度不足以追及領先馬匹。
2026-02-08,沙田,9,6,8,星火燎原 (J150),紀仁安,B,居後列，留力候上。六百米處受催策，保持走勢，但從未能加速以爭勝。
2026-02-08,沙田,9,7,4,熾烈神駒 (J157),黃智弘,B/TT,爭奪領先。直路初受對手挑戰。二百五十米處被超越。最後一百米力竭。
2026-02-08,沙田,9,8,10,龍威心得 (L120),班德禮,--,自外檔出閘，墮後。直路上沿欄略為追前。保持走勢，但從未能加速上前挑戰對手。
2026-02-08,沙田,9,9,1,馬力 (J431),布文,XB/TT,居後列，留力候上。直路初受催策，但速度不足以展開挑戰。
2026-02-08,沙田,9,10,7,德心知遇 (J133),艾兆禮,E/PC/TT,居中間位置。三百米處一度發力。最後二百米再無餘力。
2026-02-08,沙田,9,11,12,共創歡欣 (L118),鍾易禮,CP/TT,居中間之後位置，走外疊，沒有遮擋。四百米處發力上前，但未能展開挑戰。
2026-02-08,沙田,9,12,9,幸運大夫 (L225),希威森,XB-/TT2,出閘時被碰撞，居中間位置，走內欄。直路彎難以保持位置。最後三百米未能跟上步速，被拋離。
2026-02-08,沙田,10,1,4,會當凌 (K122),周俊樂,TT,出閘迅速，居中間稍前位置。直路彎走內疊節省腳程。直路初未能望空。三百米處望空。衝刺強勁，掄元。
2026-02-08,沙田,10,2,2,嘉應奇兵 (J391),潘明輝,B-/V1,出閘迅速，居第二位。入直路時落後半個馬位。三百米處取得領先。保持佳勢，但最後一百米不敵頭馬。
2026-02-08,沙田,10,3,1,至尊高超 (J443),艾道拿,H,出閘迅速，居中間之前位置，走第二疊。直路彎前居相同位置。接近三百米處時被碰撞。以穩勢衝刺。
2026-02-08,沙田,10,4,5,幸運風彩 (K576),霍宏聲,B/TT,自大外檔出閘，留居中間之後位置，走內疊。直路彎走內疊節省腳程。直路初未能望空。三百米處向外移出。衝刺良佳，跑獲第四名。
2026-02-08,沙田,10,5,10,紫荊拼搏 (K031),紀仁安,--,起步後不久發生觸碰，居中間位置，落後四個馬位，走第三疊，有遮擋。直路彎落後相同距離。直路上略為追前。
2026-02-08,沙田,10,6,9,百威多贏 (K261),希威森,SR/TT,出閘迅速，受催策上前領放。入直路時領先半個馬位。三百米處未能再加速，被超越。最後二百米逐漸轉弱。
2026-02-08,沙田,10,7,14,定數 (H438),楊明綸,B/XB/TT,出閘緩慢，居包尾位置，走內疊。直路彎走內疊節省腳程。直路初未能望空。趨近二百米處時望空，其後略為追前。
2026-02-08,沙田,10,8,8,雙星報喜 (K126),艾兆禮,CP,起步時發生觸碰，留居後列，走第二疊。入直路時落後七個馬位。直路初略為追前。（見競賽事件報告。）
2026-02-08,沙田,10,9,6,巴閉仔 (H298),麥文堅,B,出閘緩慢，恢復走勢後居中間位置，走內疊。直路彎走內疊節省腳程。直路初對催策略有反應。一百五十米處未能再加速，其後逐漸轉弱。
2026-02-08,沙田,10,10,3,同心同夢 (L215),田泰安,CP1,與對手同步出閘，居中間之後位置，走第三疊，有遮擋。直路彎走第二疊。直路上略為追前。
2026-02-08,沙田,10,11,12,銀光奔騰 (K425),金誠剛,H-/XB2,出閘緩慢，居中間位置，走第二疊。直路彎前居相同位置。直路初未能再加速。最後二百米轉弱。
2026-02-08,沙田,10,12,11,家傳之寶 (K490),潘大衛,CP-/E1/TT,起步後不久發生觸碰，居中間之後位置，走外疊。入直路時落後六個馬位。直路上衝刺乏力。
2026-02-08,沙田,10,13,7,劍飛聲 (L097),黃智弘,TT,自第十三檔出閘，留居後列，走外疊。入直路時走大外疊。直路上毫無進展。
2026-02-08,沙田,10,14,13,君子 (K534),鍾易禮,CP/H/TT,起步時向內斜跑，發生觸碰，居中間之前位置，走外疊。大部分途程沒有遮擋。入直路時落後三個馬位。直路初未能再加速。最後二百五十米轉弱。
2026-02-08,沙田,11,1,13,細水長流 (K562),艾兆禮,B,居中間位置。中段搶口。直路彎墮居中間之後位置。未能望空直至二百米處。衝刺強勁，終點線上取得領先。
2026-02-08,沙田,11,2,2,話你知 (G392),麥文堅,TT,留居包尾位置。轉入直路時須等待空位出現。二百五十米處望空。以佳勢上前，僅以短距離之差落敗。
2026-02-08,沙田,11,3,4,一定超 (K298),潘頓,XB,跟隨領先馬匹。八百米處墮居中間位置。四百米處順勢上前挑戰。保持走勢，但不敵首兩名馬匹。
2026-02-08,沙田,11,4,11,豐辰 (K004),紀仁安,H,追趕領放馬。自直路初起展開挑戰，一度甚具爭勝機會。末段保持穩勢。
2026-02-08,沙田,11,5,3,幸運派彩 (K313),奧爾民,TT,自外檔出閘後墮後。入直路時受推策，走最外疊。末段以佳勢上前。
2026-02-08,沙田,11,6,12,包裝戰仕 (L112),希威森,H1/XB1/TT,居中間位置，走內欄。轉入直路時須等待空位出現。自二百米處起沿欄展開挑戰。末段保持走勢。
2026-02-08,沙田,11,7,7,發財先鋒 (G171),梁家俊,CP,帶頭競跑。八百米處被追上及追迫。二百五十米處被超越。末段持續力拼。
2026-02-08,沙田,11,8,9,榮駿大道 (K474),田泰安,B/TT,居中間位置，走第四疊。八百米處上前追趕領放馬以節省腳程。二百五十米處展開挑戰，以短距離領先。接近終點時轉弱。
2026-02-08,沙田,11,9,1,桃花開 (J301),布文,CP/TT,居後列。直路初受催策。保持走勢，但未能增速以追及領先馬匹。
2026-02-08,沙田,11,10,8,火焰閃爍 (K098),艾道拿,B,居後列，走內欄。直路上在取位時受困，未能全力施為。
2026-02-08,沙田,11,11,5,友瑩光 (K564),霍宏聲,TT,跟隨領先馬匹，走內欄。四百米處至二百米處之間取位不太暢順。自二百米處起至一百米處在空位不足時兩度勒避。未能被力策至終點。
2026-02-08,沙田,11,12,14,智多多寶 (K387),楊明綸,H,居後列，留力候上。九百米處被帶出較外疊，沒有遮擋。速度不足以展開挑戰。
2026-02-08,沙田,11,13,10,紫辰之星 (L149),何澤堯,XB-/SR/TT,跟隨領放馬，走外疊，沒有遮擋。直路彎外閃。自四百米處起受催策，但未能加速。最後一百五十米力竭。
2026-02-08,沙田,11,14,6,星價 (K093),巴度,CP/TT,居中間位置，走第三疊。直路彎難以保持位置。最後二百米墮退。
