date,venue,race_no,place,horse_no,horse_name,jockey,gear,commentary
2018-10-07,沙田,3,4,9,鑽飾飛龍 (V002),何澤堯,--,居後列，靠近外欄競跑。跑過二百米處後追前甚多。末段衝刺良佳。
2018-10-07,沙田,3,5,7,電訊兄弟 (B243),史卓豐,--,居領放馬之後位置。跑過四百米處時力拼。末段走勢尚可。
2018-10-07,沙田,3,6,4,開心有你 (T402),蔡明紹,B/XB,自內檔出閘後留後。逐漸追前，保持走勢至終點。
2018-10-07,沙田,3,7,2,運財童子 (A008),祈普敦,--,居領放馬之後位置。直路上受催策，走勢平平。
2018-10-07,沙田,3,8,3,醒蹄飛 (T396),梁家俊,TT,自內檔起步後留後。跑過一百五十米處時墮退。
2018-10-07,沙田,3,9,1,金剛 (B431),楊明綸,--,居領放馬之後位置。跑過三百米處時力竭。
2018-10-07,沙田,4,1,4,真跑得 (A220),田泰安,XB1,出閘迅速，沿欄居中間位置。中段走勢輕鬆。三百二十五米處移離他駒後蹄，持續上前取勝。
2018-10-07,沙田,4,2,7,五陵霸 (A311),潘頓,B/E,出閘笨拙及緩慢，其後追前，居後列，走內疊。入直路時遙居於後，其後在馬群中上前，僅敗。
2018-10-07,沙田,4,3,12,洪荒駿駒 (A031),李寶利,V,出閘迅速，受催策上前爭奪領先。一千米處收慢留居領放馬之後位置。入直路時在他駒後蹄之後橫移。直路上力拼。
2018-10-07,沙田,4,4,5,好叻仔 (V102),黃皓楠,PC/TT,出閘一般，在催策下進佔前列位置。中段居領放馬外側位置。直路上走勢一般。
2018-10-07,沙田,4,5,10,樂多福 (A208),賴維銘,V,自最外檔出閘後受力策，自千一米處起取得領先。入直路時仍帶頭。直路較後階段逐漸轉弱。
2018-10-07,沙田,4,6,9,金錢炮 (T022),何澤堯,B/H/XB,出閘普通，首一百米收慢留居後列，走第二疊。自六百五十米處起開始上前。入直路時走第二最外疊。從未有力爭勝。
2018-10-07,沙田,4,7,1,真好意 (A386),史卓豐,P-,出閘普通，收慢留居中間之後位置，走內欄。沿途走勢輕鬆。直路上表現平平。
2018-10-07,沙田,4,8,14,仗義執言 (A014),蔡明紹,B-,出閘一般，首二百米收慢留居中間之後位置，走第二疊。入直路時墮退，從未真正有力爭勝。
2018-10-07,沙田,4,9,6,荷蘭風車 (T288),黃俊,B2/TT,出閘迅速，放棄爭奪領先，居中間位置，離欄競跑。五百五十米處繞過他駒後蹄開始上前，但轉直路彎時及在直路上墮退。
2018-10-07,沙田,4,10,13,勝在煌 (S425),潘明輝,B-/TT,自外檔出閘迅速，但收慢留居後列，走第四疊。自七百米處起上前，但六百五十米處及四百二十五米處兩度受阻。直路上落後太遠，未能構成威脅。
2018-10-07,沙田,4,11,8,好運齊來 (B124),巫顯東,B/TT,出閘不快，收慢在他駒後蹄之後向內移入，居馬群後列。自六百五十米處起嘗試上前。入直路時移至大外疊。直路上乏力上前。
2018-10-07,沙田,4,12,2,和諧繁榮 (B233),沈拿,B1,出閘僅屬普通，在一段四百米途程上受催策，居中間位置，離欄競跑。入直路時望空，受催策，但毫無反應。直路上墮退。
2018-10-07,沙田,4,13,3,大笑大少 (P297),梁家俊,B,出閘僅屬普通，首二百五十米上前，居領先四駒之後，走第二疊。趨近一千米處時略受擠迫。入直路時受催策，但毫無反應。
2018-10-07,沙田,4,14,11,日東昇 (V302),麥偉利,--,出閘僅屬一般，首二百五十米受力策以居於前半馬群內。走第四疊，中段持續走外疊。自五百米處起墮退，洩氣潰敗。
2018-10-07,沙田,5,1,6,數糊勇士 (B421),潘頓,SR,自第十檔出閘普通，居中間位置，走第二疊。入直路時走第三疊。直路上對催策反應甚佳。接近一百五十米處時取得領先。保持勁勢至終點。
2018-10-07,沙田,5,2,2,勁好玩 (A408),巫顯東,H,與對手同步出閘，受催策上前，居前列位置。接近千一米處時取得領先。直路彎走勢甚佳。直路上保持甚佳走勢，但不敵頭馬。
2018-10-07,沙田,5,3,3,帝勝之星 (A145),李寶利,B/TT-,出閘稍慢，居中間位置，走內欄。直路彎走內欄以節省腳程。直路初未能望空。最後一百五十米望空後衝刺凌厲，跑獲季軍。過終點時最為接近。
2018-10-07,沙田,5,4,10,最佳禮物 (A069),蔡明紹,B/H,躍出時一對前腳並舉，出閘緩慢，居包尾位置，落後五至六個馬位。直路彎追近。跑過五百米處後移出大外疊。直路上衝刺凌厲，跑獲第四。過終點時最為接近。
2018-10-07,沙田,5,5,5,紅駿之星 (V334),黃俊,B,與對手同步出閘，未能切入內欄，居中間之前位置，走第三疊。直路彎推進。直路初保持佳勢。接近一百五十米處時未能再增速，其後略為轉弱。（見競賽事件報告。）
2018-10-07,沙田,5,6,4,陽明秋秋 (A057),何澤堯,TT,躍出時與他駒互相碰撞，居中間之前位置，走第二疊。直路彎前居相同位置。直路初未能望空。望空後以穩勢衝刺。
2018-10-07,沙田,5,7,9,競駿飛鷹 (B292),沈拿,B-/CP1,出閘普通，居中間之後位置，落後四個馬位。直路彎走內欄以節省腳程。入直路後持續走內欄。末段以穩勢衝刺。
2018-10-07,沙田,5,8,7,幸運精選 (B114),田泰安,--,自第一檔出閘迅速，緊隨領放馬，走內欄。直路彎走內欄以節省腳程。直路初保持穩勢。自一百五十米處起逐漸轉弱。
2018-10-07,沙田,5,9,8,領闖者 (A399),史卓豐,H/V/XB1/TT,出閘後留居後列，落後五個馬位，走第二疊。直路彎略為推進。直路上衝刺乏力。
2018-10-07,沙田,5,10,1,隨我來 (B300),楊明綸,--,起步時與他駒互相碰撞，居中間之後位置，走第二疊。入直路時落後三至四個馬位。直路上毫無進展。
2018-10-07,沙田,5,11,11,金湶德 (A427),蘇狄雄,P-/CP2,自大外檔出閘迅速，受催策上前，居前列位置，走第二疊。入直路時受力策。直路初轉弱，其後收慢。
