date,venue,race_no,place,horse_no,horse_name,jockey,gear,commentary
2018-07-15,沙田,11,8,3,豈等閒 (S312),黃皓楠,CP,早段儘管受力策，但未能加速，居後列。直路上僅能超越保持同速的對手。（流鼻血／右前腿不良於行。）
2018-07-15,沙田,11,9,6,勇霸神駒 (T403),貝湯美,B-/XB/TT,居中間位置，走第三疊。受催策時衝刺乏力。
2018-07-15,沙田,11,10,2,劍斷浪 (V142),柏寶,--,出閘迅速，受約束，居中間位置，落後領放馬四個馬位。對催策毫無反應，瞬即再無爭勝機會。
2018-07-15,沙田,11,11,1,真先生 (S253),潘明輝,CP,一直落後領放馬不逾三個馬位。五百米處移出更外疊。入直路時未能加速。
2018-07-15,沙田,11,12,13,添好運 (T306),吳嘉晉,--,墮居中間之後位置。入直路時轉弱。從未構成威脅。
2018-07-15,沙田,11,13,5,將令 (B212),郭能,H/P/TT,居中間位置。自九百米處起走第四疊，沒有遮擋。跑離直路彎時未能加速以展開挑戰。從未參與競逐。
2018-07-15,沙田,11,14,14,多多醒 (B306),史卓豐,--,力追領先馬匹，走第三疊，沒有遮擋。入直路時瞬即墮退。包尾大敗而回。（表現難以接受。）
