date,venue,race_no,place,horse_no,horse_name,jockey,gear,commentary
2018-02-18,沙田,11,6,1,帝豪寶寶 (A050),黃皓楠,B,受推策，緊隨領放馬，居第四位。八百米處搶口。自三百五十米處起加速力不足，僅能保持位置。（氣管內有血。）
2018-02-18,沙田,11,7,3,紅運爵士 (A196),杜利萊,--,出閘笨拙，居中間之後位置，走第二疊。四百米處落後領放馬五個馬位。保持一般走勢至終點。
2018-02-18,沙田,11,8,7,飛星凱旋 (T352),巴度,SR,與對手同步躍出，居第五位。半程落後領放馬三個馬位。最後四百米受力策時未能增速。一百米處力竭。
2018-02-18,沙田,11,9,14,喜得福 (T421),吳嘉晉,TT,早段受催策。千三米處收慢以取得遮擋，居後列，走第三疊。直路上在外疊以普通走勢上前。末段超越數名對手，未能構成威脅。
2018-02-18,沙田,11,10,9,勤德兼備 (A071),潘明輝,CP,起步後未受催策，留居尾二位置，走內欄。最後四百米未能追近領先馬匹。
2018-02-18,沙田,11,11,6,醉多福 (A372),莫雷拉,B1,居領放馬之後的前列位置。入直路時對催策毫無反應。二百米處轉弱。接近終點時收慢。
2018-02-18,沙田,11,12,8,艦長天下 (B096),沈拿,--,居中間位置，走內欄。自四百米處起急促墮退。
2018-02-18,沙田,11,13,5,新力威 (V176),貝湯美,H/XB/TT,收慢留後，在十三駒中居後列第十一位。跑離直路彎時未能加速。一百五十米處已無爭勝機會時收慢。
