date,venue,race_no,place,horse_no,horse_name,jockey,gear,commentary
2024-06-15,沙田,11,12,1,紅愛舍 (H110),楊明綸,TT,自第一檔出閘，上前追趕領先馬匹，走內疊。三百米處再無餘力，迅速轉弱。
2024-06-15,沙田,11,13,10,華美之威 (J193),潘明輝,H,自外檔躍出時發生碰撞，其後持續上前，追趕領先馬匹，沒有遮擋。自五百米處起轉弱。直路初再無餘力。（表現難以接受‧。）
2024-06-15,沙田,1,1,8,精英勇士 (J306),希威森,--,出閘普通，落後領放馬一個馬位，靠近跑道中央競跑。跑過三百米處後受催策。趨近二百米處時空位不足。一百五十米處望空。一百米處取得領先。末段保持勁勢。
2024-06-15,沙田,1,2,7,嘉應駿馬 (J439),潘頓,TT1,自第一檔出閘普通，落後領放馬一個馬位，在跑道中央競跑。趨近三百五十米處時開始發力。二百米處取得領先。一百米處未能再增速及被超越。保持穩勢，取得亞軍。
2024-06-15,沙田,1,3,4,聖托里尼 (J076),田泰安,CP,出閘迅速，受催策上前，居前列，在跑道中央競跑。自三百五十米處起受力策。進入最後二百米時甚具爭勝機會。一百米處未能再增速。末段保持穩勢。
2024-06-15,沙田,1,4,10,錶之宇宙 (J357),霍宏聲,--,起步後不久發生碰撞，受催策上前，居前列，走外欄第四疊。跑過四百米處後受力策，但反應僅屬平平。末段保持穩勢。
2024-06-15,沙田,1,5,2,加州活力 (J131),艾道拿,CP/TT,出閘僅屬一般，居中間之後位置，在跑道中央競跑。四百米處落後五個馬位。衝刺良佳，但未能威脅頭數名馬匹。
2024-06-15,沙田,1,6,11,東昇鉞 (J264),黃智弘,CP,自第十四檔出閘迅速，居前列，走外欄。趨近三百五十米處時受力策。保持佳勢直至一百五十米處。最後一百米逐漸轉弱。（見競賽事件報告。）
2024-06-15,沙田,1,7,1,加州星皓 (J132),鍾易禮,CP/TT,起步後不久與對手互相大力碰撞，居後列。中段落後約九個馬位。最後四百米超越數匹已呈疲態的對手。
2024-06-15,沙田,1,8,3,玫瑰寶 (J297),陳嘉熙,--,與對手同步出閘，居後列。中段落後八個馬位。最後四百米保持同速。
2024-06-15,沙田,1,9,13,洛河 (J308),楊明綸,TT1,與對手同步出閘，跟隨領先馬匹。四百米處落後一個半馬位。二百五十米處未能再增速，其後轉弱。
2024-06-15,沙田,1,10,12,風雲 (J371),班德禮,CP1,出閘迅速，跟隨領先馬匹，靠近外欄競跑。趨近三百米處時受催策，但反應僅屬平平。最後二百米轉弱。
2024-06-15,沙田,1,11,14,紅旺繽紛 (J255),梁家俊,--,出閘緩慢，沿途居後列。從未有力一爭。
2024-06-15,沙田,1,12,5,黃金見聞 (J165),湯普新,B/TT,起步後不久被碰撞，居後列，在跑道中央競跑。最後四百米毫無進展。
2024-06-15,沙田,1,13,9,心之靈 (J412),董明朗,--,開閘時以後足豎立，出閘十分緩慢，其後恢復走勢，落後領放馬四個馬位，在跑道中央競跑。趨近三百米處時受催策，但毫無反應。最後二百五十米轉弱。
2024-06-15,沙田,1,14,6,天使之聲 (J336),艾兆禮,CP1/XB1/TT1,出閘僅屬一般，受催策上前，居前列，靠近外欄競跑。六百米處取得領先。三百米處未能再增速及被超越，其後轉弱。（見競賽事件報告。）
2024-06-15,沙田,2,1,3,智勝攻略 (H197),巴度,B,出閘迅速，居領放馬之後的第三位。直路上受困而未能望空，跑過二百五十米處時望空。衝刺強勁，最後五十米取得領先。
2024-06-15,沙田,2,2,1,上校 (D090),霍宏聲,V,展現一貫前速，單騎領放。保持領先，三百五十米處以勁勢加速。以佳勢力拼，僅於最後五十米被頭馬超越。
2024-06-15,沙田,2,3,10,可愛新星 (H291),梁家俊,H1,出閘僅屬一般，接近八百五十米處時緊迫競跑之際失去平衡，其後居中間位置，走內欄。直路初等待空位出現。最後一百五十米以佳勢衝刺。
2024-06-15,沙田,2,4,4,南區旺 (H178),鍾易禮,SR,出閘迅速，早段居於領放馬外側的前列位置。跑過四百米處時在催策下向外斜跑。以勁勢力拼，最後五十米失去季席。
2024-06-15,沙田,2,5,12,綫路光明 (E482),楊明綸,XB2,沿途居於領先馬群中，在沒有遮擋下走外疊。三百米處上前挑戰，其後受催策，最後一百米保持同速。表現不俗。
2024-06-15,沙田,2,6,7,日新月著 (G109),布文,V,自大外檔出閘後留力待拼，留居包尾位置，走第二疊。直路彎在馬匹之間受困。最後一百五十米在望空下追前甚多。
2024-06-15,沙田,2,7,6,快馬加鞭 (H144),田泰安,TT,起步時被大力碰撞，居中間位置，在馬匹之間競跑。跑過八百米處時搶口。直路彎在第三疊取位。其後在催策下外閃。最後一百米保持同速。
2024-06-15,沙田,2,8,9,投資有利 (G025),班德禮,CP/TT,出閘迅速，但走外疊，其後留居尾四位置，走第五疊，有遮擋。直路上走最外疊，初段追前，其後保持走勢，但所負頗遠。
2024-06-15,沙田,2,9,8,前風 (E281),何澤堯,B,出閘迅速，自八百五十米處起須在沒有遮擋下走外疊。直路上在跑道中央競跑。持續上前，但最後二百米僅能保持同速。
2024-06-15,沙田,2,10,11,星叻無敵 (G205),潘明輝,CP/TT,起步時被大力碰撞，因而居於較賽前部署為後的接近包尾位置，走內欄。直路上空位不足，但最後二百五十米在望空下僅能保持同速。
2024-06-15,沙田,2,11,2,欣感 (H443),湯普新,B/TT,出閘僅屬一般，繼而受催策，保持尾三位置，在馬匹之間競跑。跑過三百米處時受催策。二百米處居包尾位置，其後力竭。
2024-06-15,沙田,2,12,5,威力飛彈 (G210),周俊樂,--,出閘迅速，居第五位，走第二疊。開始轉直路彎時受困。跑過二百五十米處時受催策。最後二百米墮退，包尾而回。
