date,venue,race_no,place,horse_no,horse_name,jockey,gear,commentary
2024-06-02,沙田,1,6,12,鑽石福將 (H285),潘明輝,--,出閘稍慢，居後列，走外疊。直路彎落後八個馬位。入直路時走大外疊。末段略為追前。
2024-06-02,沙田,1,7,10,喜悅一生 (G072),巫顯東,B/TT,出閘迅速，居中間位置，落後約四個馬位，走第二疊。入直路時走較外疊。直路初保持穩勢。最後一百米逐漸轉弱。
2024-06-02,沙田,1,8,4,怡昌勇士 (E025),田泰安,CP/XB,出閘普通，居中間位置，走內疊。六百米處向外移出。入直路時落後五個馬位。直路初未能再增速。最後二百米轉弱。（見競賽事件報告。）（氣管內有血。）
2024-06-02,沙田,1,9,11,小鳥 (H040),蔡明紹,B,出閘普通，居中間之後位置，走內疊。直路彎未能再增速。直路上逐漸轉弱。（見競賽事件報告。）
2024-06-02,沙田,1,10,5,神舟飛駒 (G295),班德禮,B/TT,與對手同步出閘，居中間之後位置，走外疊。入直路時落後七個馬位。直路上衝刺乏力。（見競賽事件報告。）
2024-06-02,沙田,1,11,2,滿載歸來 (H083),布文,B/TT,自最外檔出閘後留後，沿途居後列。從未有力一爭。
2024-06-02,沙田,1,12,8,爸巴閉 (D235),湯普新,TT-,留居後列，走內疊。自六百五十米處起走第二疊。入直路時落後七個馬位。直路上衝刺乏力。
2024-06-02,沙田,1,1,7,國大合 (G322),希威森,B,出閘一般，居中間之前位置，走內疊。趨近一千米處時走第二疊。七百米處開始發力。六百五十米處取得領先。入直路時領先一個馬位。直路上保持甚佳走勢，以兩個馬位之先勝出。
2024-06-02,沙田,1,2,9,符號 (E194),巴度,--,出閘迅速，受催策上前，取得領先。趨近六百五十米處時被超越。入直路時居第二位。直路上保持佳勢，但未能威脅頭馬。
2024-06-02,沙田,1,3,6,上市魅力 (H196),艾兆禮,P/TT,出閘迅速，居前列，走外疊。接近千一米處時讓對手過頭。直路彎居第三位。直路上保持佳勢，取得一席季軍，但未能威脅頭兩名馬匹。
2024-06-02,沙田,1,4,1,竣誠駒 (H486),鍾易禮,TT,自外檔出閘迅速，跟隨領先馬匹，走外疊。進入對面直路後追近。五百五十米處被拋離。入直路時落後四個馬位。直路上保持穩勢。
2024-06-02,沙田,1,5,3,樂天派 (E166),董明朗,CP2,出閘迅速，落後約五個馬位，走第二疊。直路彎落後相同距離。直路上略為追前。
2024-06-02,沙田,1,6,12,鑽石福將 (H285),潘明輝,--,出閘稍慢，居後列，走外疊。直路彎落後八個馬位。入直路時走大外疊。末段略為追前。
2024-06-02,沙田,1,7,10,喜悅一生 (G072),巫顯東,B/TT,出閘迅速，居中間位置，落後約四個馬位，走第二疊。入直路時走較外疊。直路初保持穩勢。最後一百米逐漸轉弱。
2024-06-02,沙田,1,8,4,怡昌勇士 (E025),田泰安,CP/XB,出閘普通，居中間位置，走內疊。六百米處向外移出。入直路時落後五個馬位。直路初未能再增速。最後二百米轉弱。（見競賽事件報告。）（氣管內有血。）
2024-06-02,沙田,1,9,11,小鳥 (H040),蔡明紹,B,出閘普通，居中間之後位置，走內疊。直路彎未能再增速。直路上逐漸轉弱。（見競賽事件報告。）
2024-06-02,沙田,1,10,5,神舟飛駒 (G295),班德禮,B/TT,與對手同步出閘，居中間之後位置，走外疊。入直路時落後七個馬位。直路上衝刺乏力。（見競賽事件報告。）
2024-06-02,沙田,1,11,2,滿載歸來 (H083),布文,B/TT,自最外檔出閘後留後，沿途居後列。從未有力一爭。
2024-06-02,沙田,1,12,8,爸巴閉 (D235),湯普新,TT-,留居後列，走內疊。自六百五十米處起走第二疊。入直路時落後七個馬位。直路上衝刺乏力。
