date,venue,race_no,place,horse_no,horse_name,jockey,gear,commentary
2024-06-08,沙田,1,4,5,智勁駒 (G285),艾道拿,--,與對手同步出閘，居中間位置，走內疊。自六百米處起第二疊。入直路時落後兩個半馬位。直路初未能望空。一百五十米處望空。衝刺良佳，跑獲第四名。
2024-06-08,沙田,1,5,10,贏科超影 (A164),湯普新,B/XB,出閘一般，居中間之後位置，走內疊。直路彎走內疊節省腳程。未能望空直至趨近最後一百米。衝刺良佳，但未能構成威脅。
2024-06-08,沙田,1,6,3,喜勝威龍 (G395),黃智弘,B/TT,出閘迅速，居中間之前位置，走外疊。沿途沒有遮擋。直路初保持佳勢。一百五十米處未能再增速。末段保持穩勢。
2024-06-08,沙田,1,7,7,最多歡笑 (G251),梁家俊,B/XB/TT,漏閘，因而失地甚多，早段被拋離。八百米處追至馬群後列。入直路時落後五個半馬位。直路上移出外疊，略為追前。
2024-06-08,沙田,1,8,9,上浦精選 (G425),何澤堯,CP,出閘普通，居後列，走第二疊。直路彎位置相若。直路上略為追前。
2024-06-08,沙田,1,9,12,荃程路通 (E403),蔡明紹,H-/TT,自第一檔出閘迅速，落後領放馬一個馬位，走內欄。入直路時走第二疊。直路初對催策反應平平。二百米處未能再增速。最後一百米逐漸轉弱。
2024-06-08,沙田,1,10,8,洪運派彩 (G414),巴度,--,自最外檔出閘迅速，受催策上前，取得領先。入直路時領先四分三馬位。直路初保持佳勢。二百米處未能再增速及被超越。最後一百五十米逐漸轉弱。
2024-06-08,沙田,1,11,2,全神貫注 (H465),霍宏聲,PC,出閘普通，落後領放馬兩個馬位，走內欄。直路彎走內欄節省腳程。直路上未能望空。
2024-06-08,沙田,1,12,14,帝豪歡星 (H248),希威森,CP-/H-/B1/TT-,出閘普通，落後約一個馬位，走第二疊。入直路時走第三疊。直路初未能再增速。最後二百米轉弱。
2024-06-08,沙田,1,13,13,星雲浩騰 (G372),艾兆禮,V1/TT,自外檔出閘後留後，居後列。入直路時落後七個馬位。直路上毫無進展。
