date,venue,race_no,place,horse_no,horse_name,jockey,gear,commentary
2024-02-28,跑馬地,1,1,3,大登殿 (G172),潘頓,V,起步時發生碰撞，因而失去平衡。居中間位置，走第二疊。跑過八百五十米處後受催策上前。接近六百米處時取得領先。入直路時領先一又四分三個馬位。保持甚佳走勢至終點，取得勝利。
2024-02-28,跑馬地,1,2,10,赤子雄心 (E489),田泰安,--,起步時發生碰撞。受催策上前，居前列，走第二疊。直路彎落後兩個馬位。直路上保持佳勢，取得亞軍，但未能威脅頭馬。
2024-02-28,跑馬地,1,3,5,豐盛多彩 (G301),鍾易禮,B/TT,出閘迅速，受催策上前領放。接近六百米處時被超越。入直路時落後一又四分三個馬位。直路上保持穩勢。
2024-02-28,跑馬地,1,4,12,威力星 (G117),董明朗,B,自外檔出閘後留居後列。入直路時落後七個馬位。直路上追前甚多，取得第四名。
2024-02-28,跑馬地,1,5,2,樂捉鳥 (G470),周俊樂,TT,起步時向外斜跑，被碰撞，居中間之前位置，走第二疊。直路彎落後約三個馬位。直路上保持穩勢。
2024-02-28,跑馬地,1,6,9,鑽石福將 (H285),賀銘年,H,起步時發生碰撞，居中間之後位置，走內疊。自八百米處起走第二疊。直路彎落後五個馬位。直路初空位不足。其後追前甚多。過終點時最為接近。
2024-02-28,跑馬地,1,7,11,皇金風速 (E448),巴度,--,自第一檔出閘迅速，跟隨領先馬匹，走內疊。中段未能保持位置。直路初略為追前。接近二百米處時未能望空。其後保持穩勢。
2024-02-28,跑馬地,1,8,7,綫路菁英 (E487),梁家俊,B/TT,出閘笨拙及被碰撞，居中間稍前位置，走內疊。中段墮居後列。入直路時走第二疊。直路初未能望空。其後保持同速。
2024-02-28,跑馬地,1,9,8,光明先驅 (G255),班德禮,CP1/TT,出閘迅速，居中間位置，走第二疊。自七百米處起走第三疊。入直路時落後約四個馬位。直路上毫無表現。（見競賽事件報告。）
2024-02-28,跑馬地,1,10,4,國大合 (G322),蔡明紹,CP-/B2,留居後列，走外疊。入直路時落後約五個馬位。直路上毫無進展。
2024-02-28,跑馬地,1,11,6,全才 (B213),布文,SR/TT,起步後不久發生碰撞，居後列，走內疊。七百米處開始上前，但對催策反應僅屬平平。入直路時走大外疊。直路上毫無進展。
2024-02-28,跑馬地,1,12,1,神舟飛駒 (G295),湯普新,B/TT,躍出時發生碰撞，居中間之後位置，走外疊。跑過八百米處後追近。中段沒有遮擋。直路初轉弱。
2024-02-28,跑馬地,2,1,6,智勝攻略 (H197),霍宏聲,B,出閘僅屬一般，居中間位置，走內疊。自三百米處起加速良佳。力拼，接近終點時取得領先。
2024-02-28,跑馬地,2,2,2,精明勇駿 (G031),布文,V/TT,出閘迅速，跟隨領放馬。接近四百米處時取得領先。在催策下加速良佳。力拼，接近終點時僅敗。
2024-02-28,跑馬地,2,3,9,星際精英 (D281),班德禮,TT,出閘迅速。八百米處被對手超越時搶口。自三百米處起力拼至終點。末段不敵首兩名馬匹。
2024-02-28,跑馬地,2,4,7,飛躍凱旋 (G250),田泰安,B/TT,起步後未受催策，收慢留居後列，走外疊，沒有遮擋。入直路時走最外疊。略為追前，取得第四名，但未能威脅前三名馬匹。
2024-02-28,跑馬地,2,5,11,富存大師 (D371),賀銘年,PC-/XB/B2/TT,與對手同步出閘，居後列，走第三疊。入直路時走外疊。末段衝刺普通，從未具勝望。
2024-02-28,跑馬地,2,6,5,喜駿風采 (G422),蔡明紹,CP-/TT,起步時發生碰撞，瞬即在馬群之後切入，居後列，落後四至五個馬位，走內疊。入直路時僅能勉力而為，未能追近前三名馬匹。
2024-02-28,跑馬地,2,7,4,謙謙君子 (G352),艾兆禮,B/TT,緊隨領先馬匹。轉直路彎時蓄勢待發。僅能以穩勢衝刺，末段再無餘力。
2024-02-28,跑馬地,2,8,12,蒲俠超得 (E138),楊明綸,B/XB,起步後受推策。一千米處受擠迫及失位。轉直路彎時居中間之後位置，落後領放馬四個馬位。末段衝刺僅屬一般。一百米處收慢。
2024-02-28,跑馬地,2,9,10,錢途光明 (G423),梁家俊,H/V/TT,自大外檔出閘，留居包尾位置，搶口。直路初仍落後頗遠。接近二百五十米處時受困。末段略為追前，但最後五十米再次受困。
2024-02-28,跑馬地,2,10,3,紅鬃烈馬 (D087),湯普新,CP,起步後受催策，居中間位置，走外疊。三百米處在馬匹之間受擠迫，未能望空直至過了二百米處後。未能爭入前列。
2024-02-28,跑馬地,2,11,1,潮州大兄 (E188),巴度,B/TT1,出閘僅屬一般，受催策上前帶頭。四百米處受催策，瞬即轉弱。（騎師表示，坐騎走勢平平。）（心律不正常。）
2024-02-28,跑馬地,2,12,8,天時明駒 (H016),周俊樂,H1/TT,自第十一檔出閘，未能切入內欄，追趕領先馬匹，走外疊，沒有遮擋。跑過四百米處時墮退。包尾大敗而回。
2024-02-28,跑馬地,3,1,12,精益大師 (H134),班德禮,B/TT,居中間位置，走內欄，走勢暢順。五十米處略為加速，衝刺強勁。
2024-02-28,跑馬地,3,2,8,快如龍 (G456),艾兆禮,B/XB/TT,居後列。轉直路彎時向外移出。直路上追前頗多。衝刺良佳。
2024-02-28,跑馬地,3,3,2,顏色王子 (E418),霍宏聲,SR/TT,沿途追趕領放馬。一百五十米處略為轉弱。保持不俗走勢，取得季軍。
2024-02-28,跑馬地,3,4,10,電路七號 (D474),潘頓,B/H/TT,居中間位置，走第二疊，走勢不俗。跑過二百米處時對催策反應良佳。
2024-02-28,跑馬地,3,5,5,超額認購 (C361),巴度,XB,出閘迅速，居中間位置，走第三疊。沿途走外疊。衝刺一般。
2024-02-28,跑馬地,3,6,1,超勁火力 (J184),田泰安,--,出閘僅屬一般，居中間之後位置。轉直路彎時受擠迫及勒避。走勢平穩。
2024-02-28,跑馬地,3,7,4,隼閣 (J056),楊明綸,TT1,出閘僅屬一般，居後列。直路初受困。末段未能望空。
2024-02-28,跑馬地,3,8,7,龍東傳承 (E158),湯普新,H/SR/TT,居中間之前位置。二百米處被碰撞。在催策下略為追前。
2024-02-28,跑馬地,3,9,9,輗多福 (E105),巫顯東,H/P/XB/TT,受力策，取得領先。跑過一百米處時轉弱，逐漸力竭。
2024-02-28,跑馬地,3,10,6,美麗緣分 (H281),蔡明紹,CP/TT,居中間之後位置。直路初收慢。毫無表現。
2024-02-28,跑馬地,3,11,3,勝萬金 (H405),鍾易禮,H/TT,居中間之後位置。對催策毫無反應。從未能構成威脅。（必須經閘廂測試及格。）
2024-02-28,跑馬地,3,12,11,鑽飾翱翔 (G201),賀銘年,TT,居中間之前位置。接近一百米處後顯著轉弱及力竭。從未有力一爭。
2024-02-28,跑馬地,4,1,2,建測羣英 (H070),周俊樂,CP/TT,沿途居領先馬匹之後，走勢良佳。直路初在馬群之後受困。跑過二百米處時望空。衝刺良佳，最後七十五米取得領先。
2024-02-28,跑馬地,4,2,5,紅海勁 (H207),潘頓,TT,大部分途程居第二疊第二位，走勢良佳。就在入直路前移至第三疊。一百五十米處上前並排領先。最後七十五米被頭馬超越。
2024-02-28,跑馬地,4,3,9,美麗歡聲 (H066),鍾易禮,V/TT,受推策上前，居領放馬外側。趨近二百米處時上前領放。一百五十米處被追上。末段力拼，走勢尚可，僅負於頭馬一個馬位，跑入季席。
2024-02-28,跑馬地,4,4,3,皇仁福星 (H128),田泰安,V/XB,受推策上前領放。接近二百米處時被追上。末段力拼，取得第四名，但不敵頭三名馬匹。
2024-02-28,跑馬地,4,5,6,皇者驕傲 (E351),賀銘年,B-/TT,留居中間之後位置，走第三疊，沒有遮擋。推進至中間位置，自六百米處起略有遮擋。入直路時走最外疊。在外疊以穩勢衝刺，保持居中間位置過終點。
2024-02-28,跑馬地,4,6,7,金德義 (H106),董明朗,--,居中間位置，離欄競跑。直路上衝刺僅屬普通，居中間位置過終點，未能構成威脅。
2024-02-28,跑馬地,4,7,11,星雲浩騰 (G372),蔡明紹,B/TT,自大外檔出閘後收慢，留居後列。四百米處居尾二位置，落後領放馬近七個馬位。末段超越數匹漸呈疲態的對手，追前一至兩個馬位至中間位置。
2024-02-28,跑馬地,4,8,4,金發銀發 (G112),艾兆禮,B,起步後留居尾三位置。對面直路上移至第三疊，有遮擋。四百米處落後領放馬五個馬位。末段僅能保持同速。過終點時落後相同距離。
2024-02-28,跑馬地,4,9,12,中華叻叻 (G054),楊明綸,--,居中間位置，走內欄。入直路時僅落後領放馬三個馬位。保持靠近內疊競跑，但末段轉弱，墮退數個馬位。表現平平。
2024-02-28,跑馬地,4,10,8,友誼喜悅 (H295),湯普新,B-/CP2,起步後留居中間稍後位置，在馬匹之間競跑。四百米處居尾三位置，落後領放馬五個馬位。直路上固守內欄，但末段無甚表現。
2024-02-28,跑馬地,4,11,10,勇晉當銳 (H425),梁家俊,TT,起步後在收慢之際搶口，留居後列。對面直路上移至第四疊，開始繞過馬群上前。自六百米處起居中間之前位置，但直路上轉弱，墮退至尾二位置。
2024-02-28,跑馬地,4,12,1,聖鑽神駒 (H071),陳嘉熙,PC/TT,起步時收慢，其後留居中間之後位置，走內欄。接近五百五十米處時在力策下墮居包尾位置。末段嚴重轉弱，遙遙包尾而回。
2024-02-28,跑馬地,5,1,5,精算暴雪 (H368),潘頓,P1,出閘迅速，居中間位置，走第二疊。跑過七百米處後略為追近。直路彎落後約一個馬位。四百米處向外移出。二百米處取得領先。末段保持勁勢，從容勝出。
2024-02-28,跑馬地,5,2,2,電源之駒 (E301),布文,E,出閘迅速，居中間位置，走內疊。四百米處向外移出。衝刺良佳，跑獲亞軍，但未能威脅頭馬。
2024-02-28,跑馬地,5,3,6,撼天鐵翼 (H162),班德禮,B,自第九檔出閘，留居包尾位置，走內疊。趨近四百米處時向外移出。入直路時落後五個馬位。直路上追前頗多，跑獲季軍。
2024-02-28,跑馬地,5,4,1,八駿巨昇 (H092),鍾易禮,H/TT,出閘笨拙，觸碰閘廂左側，居第二位。中段搶口。三百米處受力策。二百米處一度極具爭勝機會。一百五十米處未能再增速。最後五十米轉弱。
2024-02-28,跑馬地,5,5,7,昇瀧駒 (J141),霍宏聲,--,與對手同步出閘，居中間之後位置，走外疊。入直路時走大外疊。衝刺平穩。
2024-02-28,跑馬地,5,6,9,久久為金 (J110),董明朗,B,出閘僅屬一般，居後列，走內疊。直路彎走內疊節省腳程。衝刺平穩。
2024-02-28,跑馬地,5,7,3,添開心 (H203),巴度,TT,出閘一般，居中間之前位置。入直路時落後約一個馬位。直路初對催策反應平平。最後一百米轉弱。（見競賽事件報告。）
2024-02-28,跑馬地,5,8,8,知道長勝 (H366),梁家俊,B/TT,與對手同步出閘，受催策上前帶頭。入直路時受對手挑戰。二百米處未能再增速，被超越。最後一百五十米轉弱。（見競賽事件報告。）
2024-02-28,跑馬地,5,9,4,能文能武 (G269),艾兆禮,B,出閘僅屬一般，居後列，走外疊。入直路時走大外疊。直路初對催策毫無反應。最後二百米收慢。
2024-02-28,跑馬地,6,1,2,時尚風趣 (J164),周俊樂,--,出閘迅速，瞬即取得領先。早段搶口。直路上加速。沿途佔優下勝出。
2024-02-28,跑馬地,6,2,11,戰鬥英雄 (D050),陳嘉熙,V/TT,跟隨領放馬。保持佳勢至終點，跑獲亞軍。
2024-02-28,跑馬地,6,3,3,金鼓齊昇 (H019),潘頓,XB/TT,跟隨領放馬，走第三疊，沒有遮擋。末段走勢尚可，跑獲季軍，但未能威脅頭兩名馬匹。
2024-02-28,跑馬地,6,4,1,電訊飛車 (G259),布文,--,居中間之前位置，走第二疊。衝刺一般。
2024-02-28,跑馬地,6,5,12,誠心所願 (E343),鍾易禮,--,居領先馬匹稍後位置，走內欄。直路上未能加速。
2024-02-28,跑馬地,6,6,8,金莊令 (D222),班德禮,--,居後列，早段搶口。保持普通走勢。
2024-02-28,跑馬地,6,7,5,砂漿金剛 (G328),梁家俊,XB/V1/TT,居中間之後位置，走內欄。直路初頗為難以望空。望空後衝刺一般。
2024-02-28,跑馬地,6,8,6,好戰小子 (J041),董明朗,XB/TT,居後列。毫無表現。
2024-02-28,跑馬地,6,9,7,華麗活力 (G051),賀銘年,CP,居中間之後位置，走第二疊。從未能追前。
2024-02-28,跑馬地,6,10,4,馬利奧 (J100),巴度,B,居中間位置，走第二疊。直路上對催策反應平平。
2024-02-28,跑馬地,6,11,9,妙玲瓏 (H068),艾兆禮,B/H/TT,居中間位置，走內欄。沿途受催策。直路上轉弱。（見競賽事件報告。）（表現令人失望。必須試閘及格。）
2024-02-28,跑馬地,7,1,10,駿行星 (H080),田泰安,TT,居中間之後第六位，落後四個馬位，走內欄。約五百五十米處在催策下開始上前。轉直路彎時沿欄上前。保持勁勢，最後數步佔得上風。
2024-02-28,跑馬地,7,2,1,亞機拉 (H113),鍾易禮,H/TT,瞬即取得領先，以快步速領放，走內欄。轉直路彎時加速帶離兩個馬位。接近終點時無以為繼及被超越。
2024-02-28,跑馬地,7,3,4,獨角獸 (G466),布文,H/P/TT,出閘緩慢，居後列，走內欄。直路彎受催策。入直路時向外移出取位。走勢良佳，過終點時最為接近。
2024-02-28,跑馬地,7,4,3,十八掌 (H033),班德禮,B/TT,居第四位，走第二疊。約五百五十米處受催策。保持同速，未能加速。
2024-02-28,跑馬地,7,5,2,銀亮光速 (H171),周俊樂,XB,居第三位，落後一個馬位，走內欄。轉直路彎時追趕正在加速的領放馬，居第二位，落後兩個馬位。入直路後在催策下再無餘力。
2024-02-28,跑馬地,7,6,5,大學生 (H116),蔡明紹,SR/XB/TT,居接近中間的第五位，落後逾三個馬位。約五百五十米處居相若的第六位。轉入直路時為走最外疊的馬匹之一，自該處起內閃。保持同速，未能加速。
2024-02-28,跑馬地,7,7,7,唯美主義 (H289),潘頓,B,居後列，留力候上。入直路時走最外疊。保持走勢，過終點時最為接近。
2024-02-28,跑馬地,7,8,9,安泰 (H161),艾兆禮,XB,起步笨拙。首六百米走第三疊，沒有遮擋。自六百米處起儘管受催策，但仍居最後數位之內。直路上再無表現。（騎師被查詢競跑策略。）
2024-02-28,跑馬地,7,9,8,陸知 (G120),賀銘年,H/TT,首次跑過終點時居中間之後位置，搶口。對面直路上及轉直路彎時仍居後列。末段再無進展。
2024-02-28,跑馬地,7,10,6,日日型 (E322),湯普新,PC,自大外檔出閘，受催策上前，居領放馬外側。自五百五十米處起在催策下轉弱。
2024-02-28,跑馬地,8,1,4,鈁糖武士 (G016),陳嘉熙,TT,自最外檔出閘，切入第二疊， 居領先馬匹之後。直路初加速甚快。接近二百米處時領先，以勁勢帶離勝出。
2024-02-28,跑馬地,8,2,9,旭日昇 (E466),田泰安,B,自外檔出閘，切入內疊，早段居後列。二百五十米處收慢，移向內欄以望空。衝刺不俗，但未能與奮戰到底的頭馬抗衡。
2024-02-28,跑馬地,8,3,3,有財有勢 (H037),賀銘年,B,出閘緩慢，居後半馬群中。衝刺良佳，接近終點時取得第三名。
2024-02-28,跑馬地,8,4,8,勇威神駒 (G471),潘頓,CP/TT,出閘迅速，瞬即受約束，居中間位置。中段搶口。過了三百米處後一度受困，其後衝刺普通。
2024-02-28,跑馬地,8,5,5,爆笑 (J079),鍾易禮,B/TT,自第一檔出閘迅速，保持緊隨領放馬。最後三百米衝刺僅屬一般。自直路中段起未能構成威脅。
2024-02-28,跑馬地,8,6,7,爭金奪冠 (J138),蔡明紹,H/CP1/TT,留居後列。四百米處落後五個馬位。在外疊持續力拼，但對領先馬匹無甚威脅。
2024-02-28,跑馬地,8,7,2,歡樂至寶 (H198),艾兆禮,TT,與對手同步出閘，居中間之後位置，落後三至四個馬位。直路彎前保持位置，但末段衝刺不及預期。（騎師表示，坐騎走勢令人滿意，但加速不及預期。）
2024-02-28,跑馬地,8,8,1,伊臣 (G061),布文,V/TT,與對手同步出閘，瞬即受約束，居後列。四百米處落後六至七個馬位，但對催策反應僅屬平平。
2024-02-28,跑馬地,8,9,6,祥勝霸駒 (G196),班德禮,B/TT,受推策，在十駒中居第二位。五百米處受催策。跑過二百五十米處時再無餘力。
2024-02-28,跑馬地,8,10,10,心想事成 (G012),湯普新,B/XB1/TT,出閘笨拙，加速取得領先。接近二百米處時被超越。再無餘力，迅速墮退，包尾而回。（騎師報告，坐騎於競賽期間發出呼吸聲。）
2024-02-28,跑馬地,9,1,1,無限美麗 (H377),潘頓,--,與對手同步出閘，居中間之前位置，走第二疊。入直路時走較外疊。二百米處取得領先。保持甚佳走勢至終點，輕鬆勝出。
2024-02-28,跑馬地,9,2,6,多利神駒 (G292),班德禮,TT,與對手同步出閘，居中間位置，走第三疊。自九百米處起沒有遮擋。入直路時落後三個馬位。衝刺良佳，跑獲亞軍，但未能威脅頭馬。
2024-02-28,跑馬地,9,3,11,花好月盈 (H317),賀銘年,TT,出閘笨拙，居後列，落後六個馬位，走內疊。三百五十米處向外移出。直路上追前頗多，跑獲季軍，但未能構成威脅。（見競賽事件報告。）
2024-02-28,跑馬地,9,4,7,勝利神駒 (G401),巴度,--,出閘迅速，居前列，走內疊。接近八百米處時取得領先。入直路時領先半個馬位。二百米處未能再增速及被超越。最後一百米逐漸轉弱。
2024-02-28,跑馬地,9,5,2,精選威 (G088),鍾易禮,B,出閘一般，居中間之前位置，走內疊。趨近三百五十米處時向外移出。直路上保持同速。
2024-02-28,跑馬地,9,6,10,青春力量 (H358),梁家俊,H-/TT,與對手同步躍出，居中間位置，走第二疊。直路彎位置相若。直路上保持穩勢。
2024-02-28,跑馬地,9,7,12,進優自在 (D258),蔡明紹,B/TT,自外檔出閘迅速，受催策上前，居前列，走外疊。入直路時落後半個馬位。直路初未能再增速。最後二百米逐漸轉弱。
2024-02-28,跑馬地,9,8,3,銀進 (G266),布文,H/TT,自第一檔出閘迅速，居中間位置，走內疊。直路彎走內疊節省腳程。直路初對催策略有反應。最後一百五十米未能望空，穩步上前。
2024-02-28,跑馬地,9,9,4,大眾勝利 (E177),湯普新,H/TT,自大外檔出閘，留居包尾位置，落後約七個馬位。直路彎落後相同距離。直路上超越部分已呈疲態的對手。
2024-02-28,跑馬地,9,10,5,皇帝英明 (G264),田泰安,SR/XB,出閘緩慢，居中間之後位置，落後約四個馬位，走內疊。直路彎走內疊節省腳程。直路上未能望空，未能充分施為。
2024-02-28,跑馬地,9,11,8,星火燎原 (J150),周俊樂,CP1,出閘僅屬一般，受擠迫，居後列，走第二疊。入直路時走大外疊。直路上毫無進展。
2024-02-28,跑馬地,9,12,9,天生夠響 (H360),霍宏聲,PC-/B2/TT1,起步後不久發生碰撞，居中間之後位置，走外疊。入直路時落後約四個馬位。直路初轉弱。
