date,venue,race_no,place,horse_no,horse_name,jockey,gear,commentary
2024-07-01,沙田,10,12,9,同喜 (J403),鍾易禮,H1/TT1,起步後不久發生碰撞，受催策上前，居第二位，走第二疊。直路彎前居相同位置。直路初未能再增速，其後轉弱。
2024-07-01,沙田,10,13,14,歐洲傳奇 (H153),楊明綸,B/TT,自外檔出閘後留後，居中間之後位置，落後約四個馬位，走外疊。入直路時走大外疊。末段毫無進展。
2024-07-01,沙田,10,14,13,凝聚美麗 (J299),梁家俊,CP1/TT,自第十三檔出閘迅速，落後一個半馬位，在沒有遮擋下走第三疊。五百米處轉弱。直路初收慢。（見競賽事件報告。）
2024-07-01,沙田,11,1,1,晴王 (G380),希威森,--,早段走外疊，其後獲許展步上前，跟隨領放馬。直路初展開強勁挑戰。接近二百米處時取得領先。末段全力以赴，力拒緊追不捨的亞軍馬匹勝出。
2024-07-01,沙田,11,2,9,和平波 (J245),潘頓,--,出閘迅速，追趕領放馬，沿途居前列。直路中段對催策反應良佳，爭奪領先。末段力拼，僅不敵頭馬。
2024-07-01,沙田,11,3,8,光明傳承 (J215),班德禮,B,居中間之後位置，走第二疊。四百米處落後五個馬位。以佳勢追前，過終點時最為接近，僅失亞席。（騎師於二百五十米處跌掉馬鞭。）
2024-07-01,沙田,11,4,10,金陽飛駒 (J168),巴度,CP,出閘僅屬一般，留居後列。二百五十米處難以望空。其後以佳勢衝刺，過終點時最為接近。
2024-07-01,沙田,11,5,14,君智盛 (J213),潘明輝,CP,與對手同步出閘，居中間之前位置。跑過四百米處時力拼。一百米處難以望空。末段未能追上領先馬匹。
2024-07-01,沙田,11,6,12,艾莉奧 (G223),田泰安,CP/TT,自第十三檔出閘後展步上前，取得領先。單騎領放至直路初。二百米處未能抗衡對手挑戰。末段力竭，跑獲第六名。
2024-07-01,沙田,11,7,6,獨步天下 (H319),何澤堯,--,追趕領先馬匹。直路彎居第四位，但入直路時加速力不足以展開真正挑戰。最後二百米衝刺一般。
2024-07-01,沙田,11,8,3,發財鴻星 (J210),艾道拿,H1,受約束，居後列，落後領放馬六至七個馬位。跑過四百米處時加速穿越馬群上前。一百五十米處轉換跑線以繼續上前。所負不遠。
2024-07-01,沙田,11,9,7,奪金精靈 (J073),董明朗,B-/H/SR1/TT,自第一檔出閘，佔取中間位置，走內疊。最後四百米保持同速，一直落後領先馬匹。
2024-07-01,沙田,11,10,5,錶之量子 (H166),楊明綸,TT,自外檔出閘後留後，居後列。中段落後領放馬八個馬位。入直路時走外疊。保持走勢，未能威脅領先馬匹。
2024-07-01,沙田,11,11,2,十八掌門 (J104),艾兆禮,--,出閘僅屬一般，未能展現足夠前速以佔取更為靠前的位置。沿途居後列。最後三百五十米走勢一般，遙遙落後領先馬匹。末段未能望空。
2024-07-01,沙田,11,12,4,星運少爵 (H459),布文,TT1,居中間位置。直路初未能望空。最後二百米保持同速。
2024-07-01,沙田,11,13,11,幸運同行 (J331),賀銘年,B,出閘緩慢，早段居後列。中段進佔中間位置，但在沒有遮擋下走外疊。直路初對催策毫無反應。二百五十米處收慢，被對手拋離。
2024-07-01,沙田,11,14,13,時時有道 (J206),湯普新,CP1/TT,自大外檔出閘後墮後，居後列，走第三疊。入直路時瞬即落後。末段衝刺乏力。
