date,venue,race_no,place,horse_no,horse_name,jockey,gear,commentary
2024-03-31,沙田,10,11,10,翩翩君子 (G013),賀銘年,H/P/TT,出閘笨拙，居中間之後位置，走外疊。入直路時走大外疊。直路上衝刺乏力。
2024-03-31,沙田,10,12,3,都靈星球 (J209),布文,--,起步時受擠迫，居後列，走第二疊。入直路時走第三疊。直路初轉弱。
2024-03-31,沙田,10,13,14,有鴻利 (E184),湯普新,V,起步時被碰撞後軀，落後約兩個馬位，走第二疊。直路彎居相若位置。直路初未能再增速。其後轉弱。
2024-03-31,沙田,10,14,6,連連有盈 (G065),潘明輝,H/TT,起步時發生觸碰，居中間之前位置，走外疊。沿途沒有遮擋。直路初未能再增速。最後三百米轉弱。
2024-03-31,沙田,1,1,8,競駿天下 (G272),潘頓,--,出閘普通，居中間位置，走第二疊。跑過七百米處後走第三疊。入直路時落後兩個半馬位。直路上對催策反應甚佳。二百米處取得領先。末段保持甚佳走勢，勝出賽事。
2024-03-31,沙田,1,2,10,桃花多 (E488),希威森,H-/B/TT,自第十二檔出閘後留後，居後列，走內疊。跑過六百米處後向外移出。入直路時落後四個馬位。衝刺良佳，取得亞軍，但未能威脅頭馬。
2024-03-31,沙田,1,3,13,勇冠群英 (H177),楊明綸,B1/TT,出閘迅速，居第二位。直路彎落後四分三馬位。直路上保持佳勢，取得一席季軍，但未能構成威脅。（見競賽事件報告。）
2024-03-31,沙田,1,4,3,洪運派彩 (G414),鍾易禮,--,出閘俐落，受催策上前，取得領先。直路彎前走勢良佳。二百米處未能再增速及被超越。最後一百米逐漸轉弱。
2024-03-31,沙田,1,5,14,荃程路通 (E403),蔡明紹,H/TT,自第一檔出閘普通，落後領放馬一個半馬位，走內欄。直路彎走內欄節省腳程。直路初保持佳勢。一百五十米處未能再增速。末段保持穩勢。
2024-03-31,沙田,1,6,7,極速之星 (G181),巴度,B,自外檔出閘後留後，居後列，走外疊。入直路時落後約六個馬位。直路上追前甚多。過終點時最為接近。
2024-03-31,沙田,1,7,11,喜報圍家 (G437),賀銘年,B/TT,出閘僅屬一般，居中間之後位置，走第二疊。自六百米處起走第三疊。入直路時落後四個半馬位。以穩勢衝刺。
2024-03-31,沙田,1,8,2,陽光燦爛 (H484),黃智弘,--,自外檔出閘後留後，居後列，走第二疊。直路彎落後約六個馬位。直路上略為追前。
2024-03-31,沙田,1,9,6,贏科超影 (A164),湯普新,B/XB,自第十三檔出閘後留後，居包尾位置，落後十一個馬位。跑過七百米處後追近。入直路時落後五個馬位。直路上保持同速。
2024-03-31,沙田,1,10,9,紅鬃烈馬 (D087),班德禮,CP,自最外檔出閘迅速，居中間稍前位置，走第二疊。直路彎位置相若。直路初未能再增速。最後二百米逐漸轉弱。
2024-03-31,沙田,1,11,5,誠心所願 (E343),霍宏聲,B2,與對手同步出閘，居中間之前位置，走內疊。直路彎走內疊節省腳程。直路初對催策反應平平。最後二百米逐漸轉弱。（見競賽事件報告。）
2024-03-31,沙田,1,12,12,喜駿風采 (G422),布文,TT,與對手同步出閘，居中間之後位置，走內疊。直路彎走內疊節省腳程。直路初對催策反應平平。最後二百米逐漸轉弱。
2024-03-31,沙田,1,13,1,錶之多多 (H476),田泰安,SR,出閘稍慢，落後約兩個馬位，走第二疊。直路彎位置相若。直路初未能再增速。最後二百米轉弱。
2024-03-31,沙田,1,14,4,福恩多多 (G344),周俊樂,H-/TT,出閘迅速，留居中間之後位置，走外疊。大部分途程沒有遮擋。最後四百五十米轉弱。直路初收慢。（右前腿不良於行。）（見競賽事件報告。）
