date,venue,race_no,place,horse_no,horse_name,jockey,gear,commentary
2024-04-07,沙田,1,10,5,全城帶勝 (H200),梁家俊,CP/H/TT,起步時受擠迫，居後列，走第三疊。入直路時走大外疊。直路上保持同速。
2024-04-07,沙田,1,11,10,錢途光明 (G423),潘明輝,V-/H/TT,與對手同步出閘，居中間位置，走外疊。入直路時落後約四個馬位。直路初未能再增速。最後二百五十米轉弱。
2024-04-07,沙田,1,12,3,潮州大兄 (E188),布文,B/TT-,出閘笨拙，落後約一個馬位，在沒有遮擋下走第三疊。直路初未能再增速，其後轉弱。（見競賽事件報告。）
2024-04-07,沙田,1,13,1,高氣派 (H315),霍宏聲,TT,起步時發生觸碰，落後約一個馬位，走第二疊。五百米處未能再增速。最後二百五十米轉弱。（見競賽事件報告。）
2024-04-07,沙田,1,14,14,神魔金剛 (G443),蔡明紹,B,出閘稍慢，留居尾列。直路彎落後七個馬位。直路初對催策毫無反應，其後轉弱。
