date,venue,race_no,place,horse_no,horse_name,jockey,gear,commentary
2019-07-14,沙田,1,1,6,高瞻遠矚 (B345),潘頓,PC-/XB-/B2,起步時被碰撞，居中間之後位置，走第二疊。跑過六百五十米處後開始發力。入直路時走外疊。衝刺凌厲，勝出賽事。（右後蹄球節部位有一處輕微割傷。）
2019-07-14,沙田,1,2,1,劍聶風 (A201),陳嘉熙,CP,出閘迅速，受催策上前，取得領先。直路彎前走勢良佳。直路初保持佳勢。接近一百米處時未能再增速及被超越。保持走勢，跑獲亞軍。
2019-07-14,沙田,1,3,4,跑得威 (C127),杜美爾,B/TT,出閘俐落，早段居前列，但走外疊。自千二米處起走第二疊，其後瞬即取得遮擋。直路彎走勢良佳。接近五百米處時向外移出。衝刺良佳，跑入季席，但未能構成威脅。
2019-07-14,沙田,1,4,3,金童 (V232),沈拿,V,自最外檔出閘迅速，居中間位置。直路彎走內欄節省腳程。跑過五百米處後向外移出。直路上略為追前，跑獲殿軍。
2019-07-14,沙田,1,5,2,賞心星 (C251),何澤堯,--,出閘笨拙，碰撞他駒。居中間位置，走第二疊。跑過六百米處後開始發力。直路上略為上前，未能威脅前列馬匹。
2019-07-14,沙田,1,6,10,火天大有 (V406),莫雷拉,V,起步時被碰撞，居後列，落後約八個馬位，走第二疊。入直路時追近，走大外疊。直路上略為追前。
2019-07-14,沙田,1,7,12,金禧足球 (A085),蔡明紹,B,自第一檔出閘迅速，落後領放馬三個馬位，走內欄。直路彎落後相同距離。接近五百米處時向外移出。直路初未能再增速，其後逐漸轉弱。
2019-07-14,沙田,1,8,7,黃埔之星 (B146),潘明輝,--,與對手同步出閘，居中間之前位置，走第二疊。接近九百米處時收慢避開他駒後蹄。跑過五百五十米處後受力策。直路初未能再增速，保持同速。
2019-07-14,沙田,1,9,13,投資旺 (A424),楊明綸,B/TT,起步時向外斜跑，碰撞他駒。居包尾位置，落後約十個馬位。入直路時略為追近。直路上略為追前。
2019-07-14,沙田,1,10,9,競駿飛鷹 (B292),李寶利,B-,出閘一般，居中間之後位置，走內欄。跑過六百米處後向外移出。直路上保持同速。
2019-07-14,沙田,1,11,5,艦長天下 (B096),波健士,B/XB/TT,起步時被碰撞，落後領放馬一個馬位，走內欄。直路彎走內欄節省腳程。直路上逐漸轉弱。（氣管內有血。）
2019-07-14,沙田,1,12,11,小奇妙 (T298),田泰安,CP/TT,自外檔出閘迅速，早段受催策上前，居前列，但走外疊。自千一米處起走第二疊。直路彎居相若位置。直路初未能再增速，其後逐漸轉弱。
2019-07-14,沙田,1,13,8,自由飛翔 (T292),史卓豐,--,自外檔出閘後留居尾列，走第二疊。直路彎前居相同位置。直路上衝刺乏力。
2019-07-14,沙田,1,14,14,火箭活力 (A322),蘇狄雄,B/TT,出閘十分笨拙，碰撞他駒。居後列，走內疊。直路彎未能再增速。直路初轉弱。
2019-07-14,沙田,2,1,3,全勝姿態 (V011),蔡明紹,V2/TT,受力策上前，步速緩慢，有利發揮。衝刺強勁，勝出賽事。
2019-07-14,沙田,2,2,1,香江世億 (A407),史卓豐,B/TT,居包廂位置，慢步速有利發揮。保持位置，取得亞軍。
2019-07-14,沙田,2,3,2,越跑越好 (T140),利敬國,B/TT,居尾列。自四百米處至二百米處缺乏空位。儘管慢步速不合發揮，但望空後衝刺強勁。
2019-07-14,沙田,2,4,4,金錢炮 (T022),何澤堯,B/H/XB,收慢留後。慢步速不合發揮。二百五十米處衝刺良佳。
2019-07-14,沙田,2,5,6,銀城福星 (V088),陳嘉熙,H/XB/TT,切入內欄，以緩慢步速輕鬆領放。保持走勢，二百五十米處轉弱。
2019-07-14,沙田,2,6,11,雷超 (V414),李寶利,TT,收慢，留居尾列。慢步速不利發揮。二百米處衝刺良佳。
2019-07-14,沙田,2,7,10,不忘初心 (B231),潘明輝,B,早段受力策，居中間之前位置。衝刺乏力。
2019-07-14,沙田,2,8,13,日東昇 (V302),楊明綸,--,居後列。慢步速不利發揮。走勢尚可。
2019-07-14,沙田,2,9,12,漸信名駒 (T253),田泰安,B/TT,居中間位置。慢步速不合發揮。衝刺乏力。
2019-07-14,沙田,2,10,7,威水武士 (B313),杜美爾,B/TT,出閘緩慢，居後列。慢步速不利發揮。毫無進展。
2019-07-14,沙田,2,11,9,樂無極 (B277),郭能,B,受催策上前。三百米處再無餘力。
2019-07-14,沙田,2,12,8,明月昇輝 (A324),潘頓,H/PC,收慢留後。慢步速不合發揮。直路上大部分途程受困。望空後走勢一般。
2019-07-14,沙田,2,13,14,鑲黃旗 (A312),蘇狄雄,B,從未有力一爭。
2019-07-14,沙田,2,14,5,大灣駒 (C018),夏禮賢,B,從未有力一爭。
2019-07-14,沙田,3,1,9,同歡樂 (B084),田泰安,H,居尾列。入直路時走最外疊。接近二百米處時展開挑戰。跑過一百五十米處時加速，勝出賽事。
2019-07-14,沙田,3,2,4,珍珠鳳凰 (B201),利敬國,B,出閘後留後。過了一千米處後居尾列，走外疊，沒有遮擋。入直路時走外疊。衝刺強勁。氣管內有血。
2019-07-14,沙田,3,3,13,電訊火箭 (C137),潘明輝,--,上前，居包廂位置。接近四百五十米處時受催策。直路上對催策反應良佳。騎師被查詢騎法。
2019-07-14,沙田,3,4,7,春風得意 (C309),潘頓,H,出閘笨拙，居中間之後位置。接近二百米處受擠迫時嚴重失去平衡。末段衝刺良佳。
2019-07-14,沙田,3,5,6,笑傲成功 (C250),楊明綸,TT,自最外檔出閘迅速，其後受催策，取得領先。直路初對催策反應良佳。跑過五十米處時略為墮退。
2019-07-14,沙田,3,6,5,繽紛駿驥 (A292),何澤堯,CP/TT,出閘迅速。跑過一千米處時居中間之後位置，走外疊，沒有遮擋。直路上對催策反應普通。
2019-07-14,沙田,3,7,12,安定繁盛 (C064),李寶利,B-/V1/TT,居中間位置。接近五百米處時受催策。直路初對催策反應良佳。過了二百米處後保持同速。
2019-07-14,沙田,3,8,10,三圓䮭路 (C149),波健士,H-,居後列。跑過三百米處無路可上時勒避。末段僅能保持同速。
2019-07-14,沙田,3,9,3,都市神話 (A086),杜美爾,B,躍出時受擠迫，其後受催策以保持位置。居中間之後位置，走內欄。力拼，但僅能保持同速。
2019-07-14,沙田,3,10,2,快利 (A006),史卓豐,B/H,起步後受催策，居領放馬外側。直路上受催策，但跑過一百五十米處時墮退。
2019-07-14,沙田,3,11,8,自由奔放 (B310),郭能,--,出閘僅屬一般，居後列。接近五百米處時嘗試推進。直路上對催策反應有限。
2019-07-14,沙田,3,12,1,壽臣 (C326),梁家俊,PC-/B2,起步後受催策。過了一千米處後居前列，走外疊，沒有遮擋。跑過三百米處受擠迫時勒避。跑過二百米處時轉弱。
2019-07-14,沙田,3,13,11,好醒神 (C175),沈拿,H-/B1,出閘僅屬一般。居中間位置，走內欄。受催策，但跑過三百米處時墮退。未能保持走勢。
2019-07-14,沙田,3,14,14,皇家魅力 (A356),蘇狄雄,CP/TT,受催策，居第二疊第二位。跑過二百米處時再無餘力。未能保持走勢。
2019-07-14,沙田,4,1,3,首飾大聖 (B378),莫雷拉,--,居中間稍後位置，離欄競跑。過了早段後落後領放馬八個馬位。中段上前，三百米處在馬匹之間推進。衝刺強勁，穩操勝券。
2019-07-14,沙田,4,2,11,八卦 (C102),何澤堯,XB,向內移入，居中間位置，離欄競跑。跑過八百米處時落後領放馬五個馬位。最後二百米在馬匹之間取位上前。以勁勢衝刺，跑獲一席接近的亞軍。
2019-07-14,沙田,4,3,1,大四喜 (A301),杜美爾,B/TT,居中間位置，走內欄。過了早段後落後領放馬四個馬位。跑過六百米處時移離內欄。三百米處追前，與領放馬並跑。最後二百米被追及，末段力拼。
2019-07-14,沙田,4,4,4,惜多福 (A323),利敬國,B,向內移入，居中間位置，離欄競跑。轉彎後落後領放馬三個馬位。三百米處前受困及受擠迫。二百五十米處向外移出。最後二百米以佳勢衝刺。（騎師被查詢。）
2019-07-14,沙田,4,5,7,水箭龜 (C450),李寶利,--,出閘後受擠迫及失地，居後列。持續居後列，轉彎時落後領放馬接近五個馬位。最後三百米穩步上前，落後不遠。
2019-07-14,沙田,4,6,8,精進百樂 (C177),田泰安,--,收慢，在馬群之後切入，居尾二位置。轉彎時居包尾位置，移出更外疊。自後列追前甚多。
2019-07-14,沙田,4,7,14,友盈有款 (B182),梁家俊,--,展步上前，居前四位之內，離欄競跑。中段沿途失去平衡，外閃。轉彎時跟隨領放馬，走外疊。最後一百五十米未能再加速。
2019-07-14,沙田,4,8,13,孖寶 (C239),蔡明紹,--,出閘後展現前速，保持領先。最後三百米被超越。末段洩氣，墮後數個馬位。
2019-07-14,沙田,4,9,6,箭神寶 (C384),郭能,--,展現前速，受推策上前，居第三位。半程時推進至領先馬匹之後位置。轉彎時橫越對手的後蹄。持續緊隨領放馬。二百五十米處未能再加速，末段墮退。
2019-07-14,沙田,4,10,12,辣得真 (C021),陳嘉熙,H/B1,出閘笨拙及失地，其後推進至中間稍後位置。八百米處落後領放馬八個半馬位。轉彎時落後領放馬五個馬位，固守內欄。末段落後相同距離。
2019-07-14,沙田,4,11,2,齊齊發 (B356),楊明綸,--,出閘後收慢，在馬群之後切入。過了首三百米後明顯包尾。持續居後列，入末段時落後領放馬六個半馬位，末段僅追前一個馬位。
2019-07-14,沙田,4,12,5,堅有料 (C011),潘頓,TT,向內移入，六百米處前居中間位置，走外疊，沒有遮擋。五百米處前受力策，末段墮退。（發出異常呼吸聲。氣管內有血。必須通過獸醫檢驗後，才可再次出賽。）
2019-07-14,沙田,4,13,9,太陽勝將 (C365),波健士,B1,前速頗快，受推策上前，居領放馬外側。跑過四百米處時落後領放馬一個馬位。跑過三百米處時墮退。末段轉弱。
2019-07-14,沙田,4,14,10,玩到贏 (B468),黃皓楠,H/TT1,出閘後在馬群之後切入，居中間之後位置，離欄競跑。轉彎時落後領放馬六個馬位，失位甚多，居遙遙落後的包尾位置。（氣管內有痰。必須試閘及格，才可再次出賽。）
2019-07-14,沙田,5,1,8,電路三號 (B360),田泰安,B/TT,出閘普通，居中間位置，走第二疊。直路彎居相若位置。衝刺強勁，勝出賽事。
2019-07-14,沙田,5,2,10,帶榮來 (B197),潘頓,B,出閘時向外斜跑，落後約一個馬位，走第二疊。直路彎前居相同位置。直路初受催策，反應良佳。接近二百五十米處時取得領先。保持佳勢，過終點時不敵頭馬。
2019-07-14,沙田,5,3,14,開心大師 (B222),蔡明紹,TT,出閘時碰撞對手，居後列，走內疊。直路彎走第二疊。直路上追前甚多。取得季軍，過終點時最為接近。
2019-07-14,沙田,5,4,1,順意寶 (B164),何澤堯,CP,出閘笨拙，居中間之後位置，走第三疊，有遮擋。跑過六百米處後向外移出。衝刺強勁，跑獲殿軍。
2019-07-14,沙田,5,5,2,燈胆精英 (A183),莫雷拉,--,自第一檔出閘迅速，居中間位置，走內欄。接近七百米處時收慢避開對手的後蹄。直路彎走內欄以省腳程。直路上略為上前。
2019-07-14,沙田,5,6,5,和諧小子 (V012),黃皓楠,--,自最外檔出閘迅速，受催策上前領先。直路彎前走勢良佳。直路初保持佳勢。接近二百五十米處時未能再加速及被超越，其後逐漸轉弱。
2019-07-14,沙田,5,7,6,友瑩利 (C310),郭能,--,出閘時一對前腳並舉，出閘緩慢。居中間之後位置，走內欄。直路彎走內欄以省腳程。直路上略為上前。
2019-07-14,沙田,5,8,11,睡眠大學 (A362),波健士,B,出閘時被碰撞，落後四個馬位，走第三疊，有遮擋。直路彎落後相同距離，以穩勢衝刺。
2019-07-14,沙田,5,9,7,勁瀟灑 (C252),李寶利,XB/TT,出閘普通，居中間之後位置，走第二疊。直路彎前居相同位置。直路初未能望空，望空後以穩勢衝刺。 
2019-07-14,沙田,5,10,9,嘉應風采 (B115),楊明綸,H/V/XB,自外檔出閘迅速，未能切入內疊。走外疊，沒有遮擋，落後一至兩個馬位。直路彎居相若位置。直路上逐漸轉弱。
2019-07-14,沙田,5,11,12,鋒仔 (C282),利敬國,B,自外檔出閘後留居後列，走第二疊。直路彎落後約六個馬位。直路上未能以勁勢衝刺。
2019-07-14,沙田,5,12,3,叫座力 (B267),潘明輝,H/TT,出閘略為緩慢，被碰撞。居中間之前位置，走第三疊，有遮擋。接近一千一百五十米處時勒避對手的後蹄。直路彎落後三個馬位。直路初未能再加速。最後二百米轉弱。
2019-07-14,沙田,5,13,4,瀟灑王子 (V069),陳嘉熙,B,出閘迅速，居後列，走外疊。直路彎落後五至六個馬位。入直路時走大外疊。直路初轉弱。跑過二百米處後收慢。（躍出時騎師腳部脫出腳踏。）
2019-07-14,沙田,5,14,13,皇仁傳奇 (C169),蘇狄雄,B,出閘時向外斜跑，碰撞對手。受催策上前，居前列位置，走內欄。接近八百米處時讓對手過頭。直路彎走內欄以省腳程。直路初受催策，毫無反應，其後收慢。（心律不正常。）
2019-07-14,沙田,6,1,1,關鍵時機 (C159),潘頓,B,居中間稍後位置，走外疊，但有遮擋。末段走勢良佳，保持領先，以半個馬位之先勝出。
2019-07-14,沙田,6,2,11,多多 (C109),莫雷拉,H,居包尾位置。九百米處彎位前移至第二疊。追前甚多，末段衝刺強勁，跑獲亞軍。
2019-07-14,沙田,6,3,9,榮冠大道 (V378),郭能,V,約居中間位置，走內欄。持續上前，末段衝刺良佳，跑獲季軍。
2019-07-14,沙田,6,4,10,牛精輝煌 (A118),田泰安,H,留居後列，走外疊，但有遮擋。持續上前至終點。
2019-07-14,沙田,6,5,14,加州明雋 (B363),潘明輝,B/TT,受催策上前，移入內欄，早段遙遙領先。一百米處被超越，但保持走勢。
2019-07-14,沙田,6,6,8,開心日子 (A333),波健士,B/TT,居中間稍前位置，走內欄。末段展開衝刺。（三百五十米處騎師左邊韁繩脫手。）
2019-07-14,沙田,6,7,3,活力飛彈 (B322),史卓豐,CP,上前居於包廂位置。保持走勢至一百米處，其後再無餘力。
2019-07-14,沙田,6,8,6,君臨大地 (V192),利敬國,SR/TT,居中間之後位置，走第二疊。接近二百米處時緊迫競跑。其後衝刺尚可。
2019-07-14,沙田,6,9,5,神州福星 (B326),陳嘉熙,SR,居中間位置，在沒遮擋下走第三疊。保持同速。
2019-07-14,沙田,6,10,2,陽光 (A371),何澤堯,V,居中間位置，走第二疊。保持同速，末段收慢。
2019-07-14,沙田,6,11,12,華麗再現 (V326),杜美爾,B/H/TT,居領放馬之後，走第二疊。保持走勢，跑過三百米處時洩氣。（見競賽事件報告。）
2019-07-14,沙田,6,12,13,鴻圖機會 (A284),沈拿,V/TT-,居後列，走內欄。毫無威脅。
2019-07-14,沙田,6,13,4,王者再現 (V156),夏禮賢,V,收慢留居後列，走外疊，但有遮擋。毫無競爭力。
2019-07-14,沙田,6,14,7,閃電王 (V013),李寶利,--,受催策，未能取得遮擋，走外疊，居中間位置。遙遙尾隨而回。必須試閘及格。
2019-07-14,沙田,7,1,3,友瑩囍 (B249),莫雷拉,--,居中間之後位置。入直路後開始發力，加速強勁，接近終點時取得領先。
2019-07-14,沙田,7,2,1,美麗甜心 (B410),潘頓,B/TT,居領放馬稍後位置，走內欄。保持穩勢，但未能威脅頭馬。
2019-07-14,沙田,7,3,7,極速王 (C231),史卓豐,--,出閘迅速，居中間稍前位置。入直路時居第五位，落後稍逾三個馬位。持續力拼，但未能構成威脅。
2019-07-14,沙田,7,4,6,明欣賞 (C327),何澤堯,--,在沒遮擋下走第三疊，居中間稍後位置。入直路時居相若位置。持續力拼，末段取得殿軍。
2019-07-14,沙田,7,5,2,朝五晚九 (B330),陳嘉熙,CP/XB,居中間位置，走外疊。轉直路彎時進佔略為接近的位置，走外疊。保持同，未能加速。
2019-07-14,沙田,7,6,13,博愛友威 (C152),波健士,--,自外檔出閘後居後列。轉直路彎及入直路時尾隨馬群。保持佳勢至終點。
2019-07-14,沙田,7,7,9,全民佳知 (C288),田泰安,CP/H1/TT,起步時受阻礙，遙居於後。入直路時走內欄節省腳程。保持穩勢，未能加速。
2019-07-14,沙田,7,8,11,正本雄心 (V303),李寶利,B/TT,沿欄居中間位置。入直路時走內欄節省腳程。保持同速，未能加速。（騎師被查詢競跑策略。）
2019-07-14,沙田,7,9,5,勞動創造 (C138),潘明輝,B/TT,大多在沒遮擋下走第三疊，居中間位置。末段在催策下保持同速。（騎師被查詢競跑策略。）
2019-07-14,沙田,7,10,8,德勝門 (C375),楊明綸,B1,瞬即帶頭。一千米處移入內欄。領先至二百五十米處，其後再無餘力。
2019-07-14,沙田,7,11,10,育馬新星 (C162),利敬國,CP,沿途居後列。從未看似有力爭勝。
2019-07-14,沙田,7,12,12,放眼量 (A140),蘇狄雄,H/V,出閘迅速，瞬即墮居中間之後位置。直路上毫無表現。
2019-07-14,沙田,7,13,4,大當家 (B145),梁家俊,TT,起步後不久受阻礙。一千米處跑來搶口，勒避他駒後蹄。入直路時走外疊。末段保持同速。
2019-07-14,沙田,7,14,14,電子傳承 (C322),黃皓楠,--,自最外檔出閘後居前列。開始轉直路彎時與領放馬並跑。入直路後受催策，但逐漸轉弱。
2019-07-14,沙田,8,1,10,協霸神駒 (B405),利敬國,SR/TT,賽事步速偏快，墮居後列。四百米處居第八位，落後五個馬位。以勁勢上前，一百五十米處追上領放馬。末段佔得上風。（刷新班次紀錄時間。）
2019-07-14,沙田,8,2,7,志趣相投 (A367),莫雷拉,B,受約束，居中間之後位置。直路彎追近。四百米處落後領放馬僅逾三個馬位。加速良佳，一百五十米處取得領先。瞬即被頭馬追上。力拼後以短距離之差落敗。帶離餘駒。
2019-07-14,沙田,8,3,4,嘉應之星 (C198),何澤堯,CP/TT,早段跟上步速。跑過千二米處時居領先馬匹之後。加速良佳，三百米處取得領先。最後一百五十米被首兩名馬匹超越。
2019-07-14,沙田,8,4,6,幸福分享 (A409),杜美爾,H,受催策，追趕領先馬匹，居第四位。直路初上前挑戰。三百米處一度具爭勝機會。最後一百五十米衝刺力不及首兩名馬匹。末段力竭。
2019-07-14,沙田,8,5,1,龍船鼓響 (T286),潘明輝,H/XB,居中間位置，走內欄。直路上保持同速。從未看似有力一爭。
2019-07-14,沙田,8,6,3,達羅素 (V246),李寶利,B/TT,居後列。中段落後領放馬甚遠。直路上略為追前，但落後太遠，未能構成威脅。
2019-07-14,沙田,8,7,5,信心保證 (B105),潘頓,B/XB,留居中間位置，走第二疊。直路初對催策略有反應。最後二百米未能保持走勢。
2019-07-14,沙田,8,8,8,妙算達人 (B224),梁家俊,B/TT,早段領先。自千二米處起被對手挑戰。第二段以快步速領放。直路前跟隨領放馬。爭奪領先，三百米處再無餘力。
2019-07-14,沙田,8,9,11,世界紀錄 (V040),波健士,XB,收慢，留居包尾位置。中段落後領放馬逾十個馬位。六百米處移出外疊，未能加速展開挑戰。
2019-07-14,沙田,8,10,9,精算閃擊 (B147),蔡明紹,H,早段追趕領先馬匹，難以穩定走勢。跑過千一米處時單騎領放。第二段以快步速領放。三百米處被超越，迅速轉弱。
2019-07-14,沙田,8,11,2,勝得威 (A025),田泰安,CP-/TT,居接近包尾位置。中段落後領放馬甚遠。跑離直路彎時未能保持走勢。從未參與競逐。
2019-07-14,沙田,9,1,10,幸福笑容 (C199),陳嘉熙,B-,自第一檔出閘迅速，緊隨領放馬，走內欄。直路彎走勢輕鬆。入直路後持續走內疊。衝刺強勁，以四分三馬位之先勝出。
2019-07-14,沙田,9,2,2,劍斷浪 (V142),蔡明紹,--,展步迅速，受催策上前，取得領先。直路彎前走勢暢順。直路上保持甚佳走勢。最後五十米僅不敵頭馬。
2019-07-14,沙田,9,3,5,競駿天驕 (B097),利敬國,H/TT,自外檔出閘後留後。早段難以穩定走勢，居中間之後位置，落後四個馬位，走第三疊，有遮擋。跑過六百米處後開始上前。衝刺強勁，跑獲季軍。（見競賽事件報告。）
2019-07-14,沙田,9,4,1,包裝才子 (C069),杜美爾,B/TT,出閘一般，落後領放馬三個馬位，走內欄。直路彎略為追近。直路上保持佳勢，跑獲殿軍。未能構成威脅。
2019-07-14,沙田,9,5,14,環翠戰士 (A187),梁家俊,--,躍出時與對手互相碰撞，居前列，走第二疊。直路彎落後四分三馬位。直路初保持佳勢。接近二百米處時未能再增速。末段以穩勢上前。（翌晨右後腿不良於行。）
2019-07-14,沙田,9,6,3,飈驥 (C160),史卓豐,B/H/TT,自第十三檔出閘，留居後列，走第三疊。直路彎前居相同位置。直路初未能望空。其後追前頗多。過終點時最為接近。（右前腿脛部外側割傷。）
2019-07-14,沙田,9,7,6,健康美麗 (B384),田泰安,CP/TT,起步時與對手互相碰撞，居中間位置，走第三疊，有遮擋。直路彎居相同位置。直路初對催策略有反應。接近一百五十米處時未能再增速。末段以穩勢上前。
2019-07-14,沙田,9,8,7,英明神駒 (V046),沈拿,XB,出閘一般，居後列，走第二疊。直路彎前居相同位置。直路初向外移出。其後略為追前。
2019-07-14,沙田,9,9,4,嫡愛摯寶 (C062),莫雷拉,B,自外檔出閘，留居後列，落後五個馬位，走內欄。直路彎沿欄追近。直路初向外移出，未能望空。接近三百五十米處時受擠迫。最後一百五十米望空後略為追前。
2019-07-14,沙田,9,10,11,嬴風雲 (V321),楊明綸,B/TT,躍出時與對手互相碰撞，居後列，走第四疊，沿途沒有遮擋。直路上逐漸轉弱。
2019-07-14,沙田,9,11,13,小威人 (C217),波健士,--,自大外檔出閘普通，未能切入內疊，落後約三個馬位，走大外疊，沒有遮擋。入直路時追近。直路上逐漸轉弱。
2019-07-14,沙田,9,12,8,盈嘉輝 (C080),潘明輝,B/TT2,與對手同步出閘，居中間之後位置，走第二疊。直路彎前居相同位置。跑過五百米處後向外移出。直路初受擠迫。其後以穩勢衝刺。
2019-07-14,沙田,9,13,9,上捕先鋒 (C300),李寶利,--,出閘迅速，落後約兩個馬位，走第二疊。直路彎居相若位置。直路初未能再增速。最後二百米轉弱。
2019-07-14,沙田,9,14,12,大聚會 (V293),黃皓楠,CP,起步時與對手互相碰撞，未能切入內疊。早段居中間位置，走外疊，沒有遮擋。跑過一千米處後追近。直路彎落後一個半馬位。直路初未能再增速。其後逐漸轉弱。
2019-07-14,沙田,10,1,9,悅裕 (B189),田泰安,B/TT,出閘緩慢，居包尾位置，落後十一個馬位。直路彎追近。入直路時走大外疊。衝刺凌厲，勝出賽事。
2019-07-14,沙田,10,2,5,全才 (B213),潘明輝,B/TT,留居尾列，落後九至十個馬位，走內欄。直路彎沿欄追近，跑過五百米處後向外移出。直路上追前甚多，跑獲亞席，僅以短距離之差落敗。
2019-07-14,沙田,10,3,12,傲風雲 (A344),史卓豐,B/TT,出閘時向內斜跑，碰撞對手，居中間稍前位置，走第二疊。自接近五百五十米處起向外移出。衝刺良佳，跑獲季軍，僅以一馬頸位之差見負。
2019-07-14,沙田,10,4,6,蟲草之星 (B070),潘頓,B,出閘迅速，早段與對手互相碰撞，受催策上前，取得領先。中段走勢暢順。入直路後保持佳勢。接近二百五十米處時一度被超越，在力拼下反先。走勢良佳，但接近終點時不敵對手。
2019-07-14,沙田,10,5,7,幸運時代 (A045),黃皓楠,B,自第九檔出閘迅速，早段與對手互相碰撞，落後兩至三個馬位，走第二疊。直路彎追近，直路初對催策反應甚佳。接近一百五十米處時未能再增速，其後保持穩勢。
2019-07-14,沙田,10,6,3,有備而來 (A240),杜美爾,TT,自第一檔出閘普通，居中間位置，走內欄。直路彎前走內欄節省腳程。入直路後持續走內疊，略為追前。
2019-07-14,沙田,10,7,2,二郎 (C019),何澤堯,H/TT,出閘俐落，受催策上前，居前列。跑過千一米處後取得遮擋，直路彎前走勢良佳。直路初對催策反應良佳，接近二百五十米處時取得領先。一百五十米處未能再增速，被超越，其後轉弱。
2019-07-14,沙田,10,8,13,駿王 (V423),波健士,B/TT,出閘時被碰撞，居中間之前位置，走內欄。沿途走內欄節省腳程。保持穩勢至終點。
2019-07-14,沙田,10,9,14,湛江最醒 (B406),蔡明紹,H/TT,與對手同步出閘，居中間之後位置，走內欄。直路彎沿欄略為追近，直路上略為追前。
2019-07-14,沙田,10,10,10,上浦福滿 (A193),楊明綸,B,出閘迅速，居中間稍後位置，落後六至七個馬位。直路彎追近，直路上毫無進展。
2019-07-14,沙田,10,11,8,開懷大少 (A278),梁家俊,B/TT,自最外檔出閘後留後，沿途居尾列。從未構成威脅。
2019-07-14,沙田,10,12,4,守正用奇 (C196),夏禮賢,--,自外檔出閘後留後，落後約八個馬位，走第二疊。跑過五百五十米處後開始上前，入直路時走大外疊。直路初未能再增速，最後二百米轉弱。
