date,venue,race_no,place,horse_no,horse_name,jockey,gear,commentary
2019-06-23,沙田,1,7,13,日東昇 (V302),楊明綸,--,出閘普通，居中間之後位置，落後七個馬位，走第三疊。直路彎落後相同距離，直路上略為追前。
2019-06-23,沙田,1,8,6,洪荒駿駒 (A031),黃皓楠,V,出閘迅速，居中間之前位置，走第三疊。接近一千米處時受阻礙，直路彎沒有遮擋。直路初保持穩勢，跑過二百米處後逐漸轉弱。
2019-06-23,沙田,1,9,7,金剛秀 (T436),郭能,B/TT,自第一檔出閘普通，居中間之前位置，走內欄。接近一千米處時受阻礙，直路彎走內欄節省腳程。直路初未能再增速，其後逐漸轉弱。
2019-06-23,沙田,1,10,12,勁皇子 (V143),莫雷拉,P/TT,起步時向內斜跑，碰撞對手，居中間位置。接近一千米處時受阻礙，被帶出較外疊。直路彎落後四個馬位。直路初保持穩勢，最後二百米轉弱。
2019-06-23,沙田,1,11,3,勇晉大師 (B452),沈拿,CP1/H1,自外檔出閘普通，居後列，走第三疊。入直路時落後九個馬位，直路上衝刺乏力。
2019-06-23,沙田,1,12,9,哥哥仔 (V074),蔡明紹,B,出閘迅速，欠缺前速，居尾列，落後九個馬位，走外疊。直路彎落後相同距離，直路上毫無進展。
2019-06-23,沙田,1,13,10,開心再現 (A216),史卓豐,B,出閘時被碰撞，居中間之前位置，走第二至第三疊。接近一千米處時受阻礙。直路彎位置相若，直路初轉弱。
2019-06-23,沙田,1,14,11,易勝相吸 (B275),潘頓,B-/CP1/TT,出閘迅速，居中間之前位置，走第二疊。接近一千米處時嚴重受阻礙。中段居中間之後位置，走內欄。直路初對催策毫無反應，跑過三百米處後收慢。（見競賽事件報告。）
