date,venue,race_no,place,horse_no,horse_name,jockey,gear,commentary
2019-07-14,沙田,10,13,1,共創歡樂 (C210),蘇狄雄,H/SR,出閘一般，居中間之後位置，落後七個馬位，走第二疊。直路彎略為追近，跑過五百五十米處後受力策。入直路時走外疊，直路上逐漸轉弱。
2019-07-14,沙田,11,1,7,百步穿雲 (A165),何澤堯,H,在馬群之後切入內疊，居尾三位置。持續居尾列，進入末段時落後四個半馬位。跑過二百五十米處時衝刺強勁。末段追前甚多，最後一步取得領先。
2019-07-14,沙田,11,2,11,友好日子 (C054),李寶利,--,出閘後上前，居中間位置，離欄競跑。入直路時收慢，移出更外疊。跑過三百米處時衝刺強勁，一百五十米處取得領先。保持勁勢至終點，最後一步被超越。
2019-07-14,沙田,11,3,3,烽煙四喜 (A036),梁家俊,TT,前速頗快，推進至領放馬之後。入直路後望空，最後二百米與另外三駒並排領先。以佳勢力拼，緊隨首兩名馬匹過終點。
2019-07-14,沙田,11,4,9,勁無比 (B034),利敬國,V,出閘一般，固守內欄，推進至中間位置。跑過三百米處時在馬匹之間衝刺良佳。最後二百米與另外三駒並排領先。力拼，以短距離之差落敗。
2019-07-14,沙田,11,5,4,志同道合 (B287),莫雷拉,SR,自外檔出閘，受推策上前。持續推進，九百米處居領放馬外側。中段並排領放。入直路時拋離餘駒。保持領先至一百五十米處。末段向內斜跑及失地。
2019-07-14,沙田,11,6,5,邊個邊個 (B412),史卓豐,TT,收慢，在馬群之後切入內疊，居中間稍後位置，離欄競跑。跑過半程時移至第三疊，有遮擋，取得平衡後落後領放馬四個馬位。最後三百米追前甚多，所負不遠。
2019-07-14,沙田,11,7,13,馬友冠 (C299),蔡明紹,--,出閘笨拙，首段墮後。中段推進。轉直路彎時走內欄，落後領放馬兩個馬位。四百米處及最後一百米兩度受擠迫，末段未能施為。上前，但未能構成威脅。
2019-07-14,沙田,11,8,10,美麗精神 (B409),潘明輝,CP/TT,居中間位置，早段及中段沿途在有遮擋下走第三疊。直路彎走最外疊，落後領放馬三個半馬位。末段落後相同距離。
2019-07-14,沙田,11,9,2,加州議長 (A114),田泰安,B/H/TT,落後領放馬不逾兩個馬位，自八百五十米處起走第三疊，沒有遮擋。轉直路彎時被迫走更外疊，最後三百米追近領放馬。二百五十米處受緊迫及勒避，其後墮退數個馬位。
2019-07-14,沙田,11,10,14,川河寶駒 (T375),波健士,TT,在馬群之後切入內欄，居尾列。轉直路彎時靠近內欄競跑，取得平衡後落後領放馬四個馬位。末段僅能保持位置。
2019-07-14,沙田,11,11,1,旌暉 (V077),陳嘉熙,B-,未受催策，居中間位置，在馬匹之間競跑。直路彎落後領放馬三個半馬位，末段未能構成威脅。
2019-07-14,沙田,11,12,6,常感恩 (B312),潘頓,CP,受催策上前，居前列，在第二疊取得遮擋。接近八百五十米處時落後一個馬位。轉直路彎時移至第三疊，入直路後不久受力策。最後三百米顯著墮退。
2019-07-14,沙田,11,13,8,豐彩皇 (V118),蘇狄雄,B/TT-,自大外檔出閘後收慢，在馬群之後切入內疊，居包尾位置。入直路時仍居包尾位置，落後領放馬逾六個馬位。直路上再墮退十個馬位。
2019-07-14,沙田,11,14,12,巡航導彈 (B337),楊明綸,--,起步後加速上前。過了首一百五十米後取得領先。八百五十米處被對手追上，繼而被超越。自四百米處起顯著墮退。洩氣潰敗。
