date,venue,race_no,place,horse_no,horse_name,jockey,gear,commentary
2016-04-10,沙田,11,8,10,超凡夢想 (S203),蔡明紹,B/H,自第十一檔出閘後留居後列，落後五個馬位，在有遮擋下走第三疊。轉直路彎時居相若位置。直路上移出最外疊，末段保持穩勢。
2016-04-10,沙田,11,9,9,牛精叻仔 (S221),何澤堯,B/TT,與對手同步出閘，受催策上前，居第三位。沿途在沒遮擋下走外疊。入直路後未能再增速，末段保持同速。
2016-04-10,沙田,11,10,13,海利多 (V188),韋達,--,自外檔出閘普通，居後列，落後四個馬位，在有遮擋下走第三疊。接近八百米處時難以穩定走勢。入直路時向外移出。末段保持同速。
2016-04-10,沙田,11,11,2,天合 (P212),杜利萊,TT,出閘緩慢，恢復走勢後居中間位置，落後三個馬位，走內欄。直路彎居相同位置。直路上衝刺乏力。
2016-04-10,沙田,11,12,7,正大光明 (S128),史卓豐,B,出閘笨拙，恢復走勢後居前列位置。接近一千米處時碰撞他駒。直路彎居第二位。直路初未能再增速，其後逐漸轉弱。
2016-04-10,沙田,11,13,6,好加加 (P363),蘇狄雄,H,出閘時受擠迫，居後列，落後四至五個馬位。接近八百米處時難以穩定走勢。直路彎落後相同距離。直路上衝刺乏力。
2016-04-10,沙田,11,14,1,銀豐神駒 (S106),羅理雅,XB1,自第一檔出閘一般，居後列，落後五至六個馬位。入直路時居包尾位置。直路初收慢，遙遙尾隨而回。表現難以接受。
