date,venue,race_no,place,horse_no,horse_name,jockey,gear,commentary
2016-10-08,沙田,1,1,4,金沙鑽 (T153),羅理雅,B/H,在九駒中自最外檔出閘迅速，但瞬即留後，留力候上。入直路後不久移離內欄取位。末段衝刺良佳，過終點時僅勝。
2016-10-08,沙田,1,2,6,帝聖名駒 (V282),郭能,--,早段居中間位置。入直路彎時受阻及失位。入直路後望空需時，在催策下上前，但一直未能超越頭馬。
2016-10-08,沙田,1,3,7,光速銀桂 (P422),杜利萊,B,未能加速，跑離對面直路時受妨礙，居中間之後位置，走內欄。轉直路彎時走內疊節省腳程。在馬匹之間持續上前，過終點時最為接近。
2016-10-08,沙田,1,4,2,明月光 (T369),梁家俊,B,在九駒中居前列，跑來搶口。轉直路彎時居第二疊第二位。末段保持同速。
2016-10-08,沙田,1,5,1,兄弟熊 (V203),莫雷拉,--,出閘緩慢，受催策，跑離對面直路時取得領先。跑過八百米處時移入內欄。入直路時被追上。持續力拼，最後一百米被超越。
2016-10-08,沙田,1,6,8,和平開心 (T091),田泰安,--,在九駒中自外檔出閘迅速，居領放馬群中，走外疊，沒有遮擋。自趨近直路彎時起爭奪領先，直路初已獲機會盡展所長。未能保持走勢，最後一百米被超越。
2016-10-08,沙田,1,7,9,鴻圖戰士 (P411),祈普敦,TT,居最後數位。入直路後空位不足，末段保持同速。（流鼻血。）
2016-10-08,沙田,1,8,3,人間尋夢 (V258),潘頓,CP-/XB/TT,受催策，居前列，走第三疊。轉直路彎時失位，直路上保持同速。
2016-10-08,沙田,1,9,5,君子承諾 (V042),韋達,TT,出閘普通，對面直路上居前列，跑來搶口。入直路後不久被拋離。
2016-10-08,沙田,2,1,1,金武士 (T418),莫雷拉,--,受力策，居中間之前位置。四百米處缺乏空位。望空後衝刺強勁，取得勝利。
2016-10-08,沙田,2,2,3,欖球鑽石 (S432),蔡明紹,B,移入內欄，以中等步速輕鬆領放。三百米處帶離對手。保持佳勢至最後一步，僅以短距離之差見負。
2016-10-08,沙田,2,3,7,喜威威 (S032),巫顯東,B-/PC1/TT,受力策，佔取包廂位置。保持佳勢至終點，取得季軍。
2016-10-08,沙田,2,4,13,幸運坊 (T004),杜利萊,H/TT,收慢留後，走第二至第三疊。二百五十米處衝刺強勁。
2016-10-08,沙田,2,5,2,太皇鷹 (T144),祈普敦,B,出閘十分緩慢，居後列，走第二疊。二百米處衝刺強勁。
2016-10-08,沙田,2,6,11,金鎗俠 (N330),蔣嘉琦,TT,受推策上前，居第二疊第二位。直路上僅能保持位置。
2016-10-08,沙田,2,7,14,福之寶 (T429),史卓豐,B,居中間位置，走內欄。直路上大部分途程受阻，未能全力施為。
2016-10-08,沙田,2,8,4,自由哥 (T123),寶遜,--,受推策上前，走第二疊。二百米處洩氣。
2016-10-08,沙田,2,9,12,精益旅程 (S389),潘頓,H-/XB-,受力策，居中間位置，走第二疊。九百米處大力勒避。末段走勢普通。
2016-10-08,沙田,2,10,9,幸運波 (T130),郭能,B-,居後列，走第二疊。直路上未能加速。
2016-10-08,沙田,2,11,5,幸運贏贏 (V091),黃皓楠,H,居後列，走第二疊。毫無進展。
2016-10-08,沙田,2,12,8,勇晉神駒 (T233),羅理雅,B/TT,出閘十分緩慢，居後列，走內欄。從未能追前。
2016-10-08,沙田,2,13,6,頂級大師 (S351),蘇狄雄,B-/H1/PC1/TT,出閘十分緩慢，從未有力一爭。
2016-10-08,沙田,2,14,10,烈風小子 (S338),吳嘉晉,--,收慢留後，從未能構成威脅。
2016-10-08,沙田,3,1,3,按得贏 (V269),楊明綸,H/XB/TT,受力策上前移入內欄，領先一個馬位。保持勁勢，取得勝利。
2016-10-08,沙田,3,2,6,好醒 (T333),田泰安,--,留後，落後領放馬七個馬位，走內欄。入直路時移出外疊，衝刺良佳，取得亞軍。
2016-10-08,沙田,3,3,7,笑眼光 (S291),柏寶,--,受推策上前佔取包廂位置。保持穩勢，取得季軍。
2016-10-08,沙田,3,4,4,靚加加 (V323),祈普敦,B1/XB1,收慢留居中間之後位置，落後領放馬約六個馬位，走內欄。衝刺良佳，取得殿軍。
2016-10-08,沙田,3,5,5,得意繽紛 (V146),莫雷拉,B,居前列，落後領放馬三個馬位，走第二疊，有遮擋。末段保持同速。
2016-10-08,沙田,3,6,9,活力飛龍 (T278),何澤堯,CP/H/XB,上前居領放馬外側位置。保持穩勢，最後二百米轉弱。
2016-10-08,沙田,3,7,1,京城珍寶 (P283),梁家俊,B,居中間位置，落後領放馬四個馬位，走第二疊，有遮擋。直路上毫無表現。
2016-10-08,沙田,3,8,2,滿貫中環 (V220),韋達,B-,沿途居後列，從未能追前。
2016-10-08,沙田,3,9,10,大眾良駒 (P208),黎海榮,--,居中間之後位置，落後領放馬約六個馬位，走第二疊，有遮擋。從未看似有力一爭。
2016-10-08,沙田,3,10,8,勁飛裕 (V159),郭能,B1,出閘緩慢，居中間位置，落後領放馬約五個馬位，走內欄。從未能構成威脅。
2016-10-08,沙田,4,1,2,踏雪無痕 (P438),蔣嘉琦,TT,出閘迅速，在催策下帶頭，領先半個馬位。六百米處騎師放長韁繩。三百六十米處受催策。二百五十米處受力策，交出強勁衝刺。
2016-10-08,沙田,4,2,7,津津樂道 (N248),寶遜,B-,出閘普通，沿欄居中間之後位置。五百五十米處受催策，五百米處受擠迫。三百米處尋找空位，二百五十米處出現空位，末段衝刺甚佳。
2016-10-08,沙田,4,3,11,駿馬翹楚 (T401),祈普敦,B/TT,出閘迅速，早段受催策，居前列，走內欄。三百五十米處受催策，沿欄展開衝刺。
2016-10-08,沙田,4,4,4,精彩樂韻 (V048),梁家俊,H,與對手同步出閘，缺乏前速。一千二百五十米處上前，千一米處受力策，居中間稍後位置，走第二疊。八百米處再受力策，墮居尾三位置。直路上移至跑道中央，受催策，走勢平平，一百五十米處保持走勢。
2016-10-08,沙田,4,5,1,真好漢 (T213),郭能,B/TT,起步時急促向外斜跑，受催策上前，走外疊。九百米處進佔第二位。五百米處受催策，力拼。
2016-10-08,沙田,4,6,5,飛馬再威 (T338),田泰安,H/P/XB,出閘緩慢，受力策跟上馬群，沿欄居尾列。五百五十米處受推策，五百米處碰撞對手，四百米處受擠迫，移至跑道中央，以勁勢直奔終點。
2016-10-08,沙田,4,7,12,凱旋星光 (T224),韋達,TT,自最外檔出閘最快，收慢尋找遮擋，居中間之後位置，走第二至三疊，有遮擋。六百五十米處推進。三百五十米處移出外疊，受催策。一百米處未能再增速。
2016-10-08,沙田,4,8,14,永高 (T202),楊明綸,CP,出閘笨拙，受大力碰撞，收慢留居接近包尾位置，走第二疊，昂首。六百二十米處受擠迫。四百米處尋找空位，三百五十米處勒避。向外移出及向內移入以取位，一百五十米處望空，保持穩勢。
2016-10-08,沙田,4,9,13,心中有善 (V164),蘇狄雄,H-/XB/TT,出閘普通，收慢留居中間位置，在沒遮擋下走第三疊。四百五十米處受催策，但走勢平平，末段再度發力。
2016-10-08,沙田,4,10,8,天胆 (V238),吳嘉晉,--,出閘稍慢，在約束下留居中間位置，走內欄。六百米處受催策。四百米處移離內欄，三百五十米處受力策，二百八十米處受擠迫，未能以勁勢衝刺。
2016-10-08,沙田,4,11,3,樂有盈 (V252),史卓豐,--,出閘迅速，收慢放棄爭奪領先，居中間之前位置，走第二疊。五百二十米處失位。三百五十米處受擠迫。保持普通走勢。
2016-10-08,沙田,4,12,10,金錢路 (P021),何澤堯,V/TT,出閘迅速，在催策下居前列。九百米處前受催策，居第三位，走第二疊。五百二十米處再受催策，移離他駒後蹄。走勢轉弱。
2016-10-08,沙田,4,13,6,騂龍 (V212),莫雷拉,H,出閘普通，受推策上前，爭奪領放馬之後的位置，其後居第五位，走第二疊。五百八十米處受催策，但未能上前，力竭敗退。
2016-10-08,沙田,4,14,9,開心拍檔 (V160),巫顯東,B1,起步時受碰撞，收慢留居後列，其後居尾列，在有遮擋下走第三疊。入直路時移至最外疊。四百米處受催策，移回跑道中央，遙遙尾隨而回。
2016-10-08,沙田,5,1,5,星光勇將 (T325),梁家俊,B/H,出閘迅速，受推策上前，其後收慢，居中間位置，在沒遮擋下走第四疊。六百米處展步上前。四百五十米處挑戰領放馬，受力策，二百米處取得領先，僅能保住勝果。
2016-10-08,沙田,5,2,2,電子鳳凰 (S343),田泰安,--,出閘稍慢，受催策，居接近尾列，走第二疊。六百八十米處受催策上前。五百米處受催策。一百米處在跑道中央上前，有望爭勝，最終不敵頭馬。
2016-10-08,沙田,5,3,1,盈豐駿駒 (S073),柏寶,CP-/P1,出閘後騎師在馬鞍上稍微不穩。首次轉彎時追近領放馬，其後居中間稍前位置，走第二疊。四百二十米處受催策。接近二百二十米處時在馬匹之間展開衝刺，以勁勢上前，五十米處力竭。
2016-10-08,沙田,5,4,8,威勢之寶 (P425),蔣嘉琦,CP/TT,與對手同步出閘，迅速被拋離，留居後列。其後居尾列，走第二疊，一度被馬群拋離。八百米處受催策追前。四百五十米處受催策，移出最外疊，直路上在跑道中央追前甚多，保持走勢。
2016-10-08,沙田,5,5,7,信心出擊 (N226),何澤堯,B/TT,出閘普通，沿欄居中間位置。五百米處失位。四百四十米處受催策。二百七十米處受催策，走勢甚佳，末段追前。
2016-10-08,沙田,5,6,3,鑽之友 (S376),潘頓,H/P/TT,出閘稍慢，受催策，居中間稍後位置，走第二疊。四百七十米處受催策，加速緩慢。末段發力，衝刺強勁。
2016-10-08,沙田,5,7,11,合拍飛龍 (T283),莫雷拉,P/TT,出閘時向上跳躍，受催策，居中間之前位置，在沒遮擋下走第三疊。四百五十米處上前挑戰領放馬，一度取得領先，保持走勢，但五十處墮退，末段轉弱。
2016-10-08,沙田,5,8,12,非凡者 (T089),黃皓楠,B/H,自外檔出閘最快，受力策上前移向內疊，千三米處取得領先，跑來略為搶口。一千米處領先四個馬位，逐漸放慢，五百米處被追上，四百米處受催策，逐漸轉弱。
2016-10-08,沙田,5,9,9,至尊駿爵 (P344),史卓豐,B/TT,出閘笨拙，受催策，首次轉彎時挑戰領放馬，其後居第二位，走第二疊。五百二十米處上前與領放馬並跑。四百七十米處受催策，迅速洩氣。
2016-10-08,沙田,5,10,6,天工駿駒 (V036),楊明綸,B,出閘普通，居中間之後位置，在有遮擋下走第三疊。八百八十米處受催策。六百八十米處受催策。五百米處受力策，但毫無反應。
2016-10-08,沙田,5,11,4,喜利高 (N348),羅理雅,B/TT,出閘迅速，早段取得領先，千三米處被超越，居第三位，走內欄，跑來略為搶口。五百五十米處受擠迫。四百八十米處受催策。二百米處緊貼他駒後蹄，其後轉弱。
2016-10-08,沙田,5,12,10,相中有你 (S300),蘇狄雄,B/TT,出閘緩慢，受催策，居接近尾列位置，走內欄。五百米處受擠迫。四百三十米受催策，但毫無反應，遙遙尾隨而回。
2016-10-08,沙田,6,1,10,雲呢拿 (P439),楊明綸,B,居中間之後位置，落後四個半馬位，走第三疊，有遮擋。以佳勢上前，以半個馬位之先勝出賽事。
2016-10-08,沙田,6,2,13,勇冠王 (T028),梁家俊,B/H/TT,居中間位置，落後四個馬位，走第二疊，有遮擋。以勁勢衝刺，以半個馬位之差不敵頭馬。
2016-10-08,沙田,6,3,1,步步領先 (T354),潘頓,B,居中間位置，落後領放馬三個馬位，走第三疊，有遮擋。持續上前，僅失卻亞軍。
2016-10-08,沙田,6,4,12,金多多 (S439),莫雷拉,B/TT,居中間之前位置，落後一個半馬位，走第三疊，沒有遮擋。直路上領先至五十米處，僅不敵首三名馬匹。
2016-10-08,沙田,6,5,14,和諧氣氛 (S326),田泰安,B/TT2,出閘緩慢，居後列。落後六又四分三個馬位，走第二疊，有遮擋。直路上在外疊以佳勢上前。
2016-10-08,沙田,6,6,5,海利多 (V188),巫顯東,B/TT,居中間位置，落後三又四分三個馬位，走內欄。向外移出，僅能保持同速。
2016-10-08,沙田,6,7,4,康樂神駒 (T363),杜利萊,--,躍出緩慢，居中間之後位置，落後五又四分一個馬位，走內欄。直路上逐漸上前。
2016-10-08,沙田,6,8,8,齊歡笑 (CM339),蔡明紹,P,佔取中間之前位置，落後二又四分一個馬位，走第二疊，有遮擋。早段略為衝前，自二百米處起保持同速。
2016-10-08,沙田,6,9,11,將譽 (V190),吳嘉晉,TT,受催策上前佔取包廂位置，落後一又四分三個馬位。直路初未能望空，其後略為上前。
2016-10-08,沙田,6,10,3,平步青雲 (T096),祈普敦,XB/TT2,收慢留居後列，落後五個半馬位，走第二疊，有遮擋。直路上毫無進展。
2016-10-08,沙田,6,11,6,龍船 (V186),何澤堯,--,受催策上前，居領放馬外側，落後一個馬位。三百五十米處受擠迫，其後收慢。未能追前。
2016-10-08,沙田,6,12,7,一支梅 (V171),黎海榮,XB/TT,沿途居後列，從未有力一爭。
2016-10-08,沙田,6,13,2,飛皇騰達 (T297),郭能,B,受推策上前，切入內欄，領先一個馬位。入直路時被超越及轉弱。
2016-10-08,沙田,6,UR,9,銀豐神駒 (S106),蘇狄雄,XB,早段受催策上前，但騎師於千三米處被拋下。
2016-10-08,沙田,7,1,5,美麗皇牌 (V135),潘頓,TT,出閘迅速，未受推策，落後領放馬三個馬位，走外欄第二疊。跑過四百米處時開始發力上前。一百五十米處取得領先，帶離勝出。
2016-10-08,沙田,7,2,10,手到拿來 (P396),莫雷拉,--,出閘尚可，受約束，落後領放馬三個馬位，移近外欄。跑過三百五十米處時受催策。二百五十米處受鞭策。末段上前，但未能超越頭馬。
2016-10-08,沙田,7,3,2,皇仁大師 (V099),田泰安,--,出閘迅速，移出外欄，墮居中間位置。自六百米處起傾向外閃時難以策騎。其後不願向內移入取位。望空後衝刺良佳。
2016-10-08,沙田,7,4,8,火麒麟 (T052),史卓豐,--,出閘一般，向外移出，但走外欄第三疊或更外疊。跑過四百米處時受催策，在跑道中央衝刺良佳。過終點時最為接近。
2016-10-08,沙田,7,5,11,八心之煌 (S098),蔡明紹,--,出閘一般，向外移出以取得遮擋，墮居後列。跑過五百米處時向內移入至跑道中央，開始發力上前，僅失殿軍。
2016-10-08,沙田,7,6,3,及時取勝 (S431),黃皓楠,B,迅速取得領先，向外移出，但走外欄第三疊或更外疊。以快步速領放，一百五十米處被超越，繼而逐漸墮退。
2016-10-08,沙田,7,7,1,跑寶貝跑 (N033),羅理雅,B,在閘內煩躁不安，出閘緩慢，移出外欄，墮居接近包尾位置。在快步速下獲許順其自然競跑。二百米處向內移入，避開他駒後蹄，走勢一般。
2016-10-08,沙田,7,8,6,澤心星 (S399),寶遜,--,起步時與對手互相碰撞，其後勒避，墮居包尾位置。未受催策直至三百米處。自二百米處起受力策，走勢一般。
2016-10-08,沙田,7,9,7,海之濤 (N317),楊明綸,P,出閘迅速。早段並排領先。跑過七百米處時落後領放馬半個馬位。保持勁勢，二百五十米處洩氣及力竭。
2016-10-08,沙田,7,10,9,雷超 (V414),韋達,TT1,展步緩慢，受催策，但未能加速，在馬匹之間墮退，居後列。四百米處受催策，但再無餘力及力竭。
2016-10-08,沙田,7,11,4,快寶駒 (S240),蔣嘉琦,B/E,出閘笨拙，受催策上前，落後領放馬兩個馬位，固守外欄。走勢順暢，三百米處無以為繼及力竭。表現難以接受。
2016-10-08,沙田,8,1,8,小米周 (T355),蔣嘉琦,--,加速上前取得領先。千二米處加速。二百五十米處加速帶離。保持強勁走勢至終點，從未受威脅，勝來游刃有餘。（締造同班賽事時間紀錄。）
2016-10-08,沙田,8,2,12,歡樂小子 (S235),黎海榮,--,居第三位，緊隨領放馬，步速偏快。跑過三百五十米處時受力策力追頭馬。一百米處進佔第二位，受力策，但未能超越頭馬。
2016-10-08,沙田,8,3,11,加州騰龍 (V170),蔡明紹,TT,出閘迅速，居第二位，步速偏快。入直路時極具爭勝機會，持續力追，但未能拉近差距。一百米處失去亞席。
2016-10-08,沙田,8,4,2,包裝鬥士 (S109),羅理雅,XB,留居中間位置，落後快步速的領放馬四個馬位，走內欄。三百米處前未能望空。末段轉換跑線，走勢良佳，追近季軍馬匹。
2016-10-08,沙田,8,5,6,連利之星 (S093),韋達,B,自大外檔出閘，墮居後列。中段落後快步速的領放馬八個馬位。四百米處移出最外疊，衝刺強勁，跑獲第五名，以末段最為接近。
2016-10-08,沙田,8,6,1,活力歡騰 (S145),莫雷拉,SR,躍出後受約束，落後領放馬六個馬位，走內欄。自三百米處至二百米處缺乏空位。保持一般走勢至終點。
2016-10-08,沙田,8,7,13,神威敖翔 (V150),梁家俊,XB/B1,早段與領放馬並跑，其後受約束。轉直路彎時居第四位。二百米處前持續力追前三位馬匹。末段保持同速。
2016-10-08,沙田,8,8,10,英明神勇 (S266),何澤堯,B/TT,留居中間之後位置，走第三疊。四百米處落後領放馬五個馬位。保持一般走勢至終點，僅保位置。
2016-10-08,沙田,8,9,5,人強馬勁 (P435),田泰安,B/H1/TT,自外檔出閘，居中間位置，走第三疊或更外疊，沒有遮擋。最後四百米保持同速，未能對領先馬匹構成威脅。
2016-10-08,沙田,8,10,14,宅大大 (V094),史卓豐,B,出閘笨拙，居後列，落後快步速的領放馬八個馬位。四百五十米處移離內欄。直路初未能望空，但其後對催策僅能交出有限反應。
2016-10-08,沙田,8,11,4,文藝復興 (T197),潘頓,H/P,躍出時受約束，居中間之後位置，落後領放馬六至七個馬位。彎位前保持位置，在催策下保持同速，未能上前爭勝。
2016-10-08,沙田,8,12,9,超有利 (P230),巫顯東,B/TT,未能加速，墮居包尾位置，落後領放馬九個馬位。轉直路彎時走第三疊。四百米處落後甚遠，超越兩匹已洩氣的對手。從未參與競逐。
2016-10-08,沙田,8,13,3,鈦金剛 (S332),柏寶,--,步速偏快，居中間之後位置，走第三疊。五百米處居第十一位，移出外疊。直路初對催策略為交出反應。二百五十米處洩氣。從未能上前。
2016-10-08,沙田,8,14,7,永同天下 (S263),黃皓楠,V/TT,四百米處居中間位置，落後快步速的領放馬五個馬位，在催策下未能加速，瞬即墮退。
2016-10-08,沙田,9,1,10,靚猴王 (S280),田泰安,B,出閘良佳，上前居領放馬後三個馬位的位置，走第二疊。直路上走內疊，三百五十米處望空，受力策，以短距離之先勝出。
2016-10-08,沙田,9,2,8,夢幻仙子 (V222),郭能,TT,出閘良佳，領先數步，一千零五十米處居包廂位置。五百米處移離內欄，四百米處取得領先。持續斜跑至跑道中央，接近終點時被超越。
2016-10-08,沙田,9,3,14,香江新星 (T432),史卓豐,--,出閘普通，被拋離，九百米處移入內欄，落後領放馬五個馬位。直路上沿欄競跑，但受困而未能望空。二百米處向外移出以望空，但接近終點時再度受困。
2016-10-08,沙田,9,4,7,勁飛勁 (V014),莫雷拉,H/XB/TT,自外檔出閘良佳，受推策上前，居中間之前位置，走第二疊。入直路時向外移出，走勢強勁，僅失一席。
2016-10-08,沙田,9,5,5,好益善 (T302),羅理雅,CP/TT,出閘時受約束，移入內欄，居後列位置。直路彎推進，直路上向外移出，在馬匹之間以穩勢上前。
2016-10-08,沙田,9,6,12,巴基小子 (S442),蔡明紹,TT,出閘時受擠迫，在馬匹之後移入內疊，墮居包尾位置。直路前跟隨馬群，走內欄，走勢平穩，終點線上最為接近。
2016-10-08,沙田,9,7,2,綠勇士 (V126),韋達,TT,出閘時碰撞對手，受催策上前，八百米處收慢，落後領放馬約兩個馬位，大多走第三疊。入直路時走外疊，保持普通走勢，二百米處墮退。
2016-10-08,沙田,9,8,1,鑽飾飛龍 (V002),柏寶,H/P/XB,出閘尚可，缺乏前速，墮居後列位置，走外疊。直路彎走外疊，直路上被帶出更外疊，保持同速。
2016-10-08,沙田,9,9,13,開心遊戲 (V024),蔣嘉琦,B1,自大外檔出閘後受催策上前，走第四疊，九百米處切入領放馬外側位置，落後半個馬位。自三百米處起受催策，逐漸力竭。
2016-10-08,沙田,9,10,6,獅子驄 (V290),鄭雨滇,SR,受力策取得領先，直路前步速中等。跑過三百米處時被超越，持續力拼，一百米處被後上馬匹超越。
2016-10-08,沙田,9,11,11,金鹿 (P121),梁家俊,B,出閘時受約束，在馬群之後切入第二疊，墮居後列位置。轉入直路時向外移出取位，在力策下僅能保持同速。
2016-10-08,沙田,9,12,9,好愉快 (S276),何澤堯,TT,出閘良佳，受催策以保持居中間位置，走第二疊。直路上向外移出取位，僅能保持同速。
2016-10-08,沙田,9,13,4,飛哥 (N342),寶遜,--,出閘普通，被拋離，墮居後列位置。五百米處受催策，直路初未能望空。保持同速。
2016-10-08,沙田,9,14,3,銳闖 (V349),杜利萊,--,出閘時受擠迫，受約束移入內欄，居中間之後位置。保持普通走勢，直路上瞬即受催策，逐漸力竭。
2016-10-08,沙田,10,1,1,旌暉 (V077),梁家俊,H-,早段受推策上前，並排領先。一百五十米處帶離對手，末段未受挑戰，衝刺凌厲，掄元。
2016-10-08,沙田,10,2,13,情趣 (V114),莫雷拉,TT,早段未受力策，居第五位，走第二疊。直路上走勢強勁，一百五十米處發力，帶離餘駒，但僅能逐漸追近頭馬，跑獲亞軍。
2016-10-08,沙田,10,3,5,美麗皇者 (T189),蔣嘉琦,B/TT,早段受推策上前，並排領先，搶口。與對手互相碰撞，失去平衡，一千米處移離前駒後蹄，直路彎前走外疊。末段衝刺強勁，但無力追近首兩名馬匹。
2016-10-08,沙田,10,4,11,瀟灑王子 (V069),黎海榮,B,早段上前，居前列位置，其後居第二位，落後領放馬四分三個馬位。自直路初起並排領先，一百五十米處再無餘力，逐漸墮退。
2016-10-08,沙田,10,5,12,獨具慧眼 (T164),史卓豐,--,居中間位置，早段走第二疊。直路上走勢尚可，末段略為追前。
2016-10-08,沙田,10,6,2,瑩然英峻 (T388),郭能,H/CP1,自外檔出閘，早段墮居後列位置，中段搶口，靠近前駒後蹄競跑。直路上走勢平穩，但從未能構成威脅。
2016-10-08,沙田,10,7,8,阿甘 (T176),羅理雅,CP/XB/TT,自第四檔出閘，居中間位置，走第三疊。直路上走勢尚可，末段略為加速，但無力威脅三甲。
2016-10-08,沙田,10,8,14,甜統 (V089),田泰安,H/XB,自外檔出閘，收慢留居後列位置，走第二疊。直路彎走更外疊，末段走勢平穩。
2016-10-08,沙田,10,9,4,大運舞台 (T256),韋達,B,早段收慢，留居後列位置，走第二疊。直路上走勢僅屬普通。
2016-10-08,沙田,10,10,3,雷公鑿 (V279),鄭雨滇,--,早段居前列第四位，距離領放馬匹不遠，走內欄。直路上毫無表現，最後一百米收慢。
2016-10-08,沙田,10,11,6,麯院風荷 (T112),柏寶,CP/XB/TT,出閘時被碰撞及失去平衡，居中間之前位置，走第三疊，沒有遮擋。直路初居好位，但僅能保持同速，最後一百五十米墮退。
2016-10-08,沙田,10,12,9,精算追擊 (S370),何澤堯,H/P,自大外檔出閘，未能移入內疊，沿途在沒有遮擋下走第四至第五疊。直路上再無餘力，末段略受催策，走勢疲乏。
2016-10-08,沙田,10,13,10,日東昇 (V302),祈普敦,B/H,出閘笨拙，早段墮後，其後沿欄受推策上前至中間位置。直路初毫無表現，最後二百米後勁不繼。
2016-10-08,沙田,10,14,7,時裝精英 (S297),潘頓,B/TT,早段未能展步，包尾，走內欄。從未參與競逐。騎師被查詢。
