date,venue,race_no,place,horse_no,horse_name,jockey,gear,commentary
2016-05-29,沙田,10,11,14,翡翠福星 (V020),吳嘉晉,H1,早段受催策上前，居中間之前位置，走第三疊，有遮擋。三百米處收慢並失去空位，因而失地。自該處起僅能在騎師手足並用催策下上前，末段收慢。
2016-05-29,沙田,10,12,11,迫擊炮 (V034),楊明綸,B,自外檔出閘後嘗試向內移入，居中間位置，沿途走第三疊或更外疊。八百米處緊貼前駒後蹄，難以穩定走勢。其後收慢，七百米處被帶出更外疊。保持穩勢至二百米處，繼而力竭。
2016-05-29,沙田,10,13,7,精算率然 (P355),湯智傑,B,自最外檔出閘後受推策上前，但未能與密集馬群一同向內移入。居前列，走第三疊，沒有遮擋。早段耗力太多，直路上再無餘力。自三百米處起力竭。
2016-05-29,沙田,10,14,10,百威特務 (T423),蘇狄雄,H-/B/TT1,早段上前居馬群後列，走內欄。八百米處貼近前駒後蹄處於窘境。直路早段對催策毫無反應，最後二百米後勁不繼。
2016-05-29,沙田,1,1,2,田黃 (T303),韋達,PC-,自外檔出閘普通，大多居中間位置，走第三疊。入直路後加速良佳，終點線上僅勝。
2016-05-29,沙田,1,2,10,春盈 (V157),田泰安,H,早段受催策，居後列位置，走內欄。直路彎走內欄節省腳程，入直路後移離內欄展開挑戰。衝刺良佳，但末段始終未能追上頭馬。
2016-05-29,沙田,1,3,5,御風雲 (V231),莫雷拉,--,自外檔出閘良佳，跑過一千米處時取得領先。入直路彎時走內欄，入直路時以短距離領先。保持走勢，最後一百米被超越。
2016-05-29,沙田,1,4,14,永常喜 (V107),史卓豐,B/TT,自第一檔出閘良佳，早段並排領先。跑離對面直路時留居前列位置，直路彎保持居好位，但直路上未能加速展開挑戰。
2016-05-29,沙田,1,5,6,贏盡 (V147),楊明綸,B,早段居領放馬匹之間，其後居第三位，落後領放馬不足兩個馬位。入直路時居相若位置，持續力拼，但未能構成威脅。
2016-05-29,沙田,1,6,4,劍凌雲 (T300),潘頓,H/TT1,早段與領放馬匹並跑，瞬即留居第五位，落後僅逾兩個馬位，走內欄。入直路時在內疊上前，但直路初受阻。最後二百米重新發力，跑過一百米處時再度靠近前駒後蹄。
2016-05-29,沙田,1,7,1,快樂寶貝 (V019),羅理雅,B/TT,自外檔出閘，居前列數駒之間，落後領放馬不足三個馬位，走外疊。轉直路彎時走第四疊，入直路時追前，但未能保持走勢，跑過二百米處時力竭。
2016-05-29,沙田,1,8,7,勝途勇士 (V224),梁家俊,H1,出閘良佳，居中間之後位置，末段保持同速。
2016-05-29,沙田,1,9,3,旅遊大使 (T113),鄭雨滇,--,缺乏前速，遙居於後，走內欄。末段略為追前。（翌日不良於行。）
2016-05-29,沙田,1,10,8,主力艦 (T368),蔡明紹,B/TT,自大外檔出閘，受催策上前，居中間位置，入直路時居相若位置。保持同速。
2016-05-29,沙田,1,11,12,電訊大炮 (V144),黃皓楠,--,出閘後居中間位置，受催策。末段在催策下毫無反應。
2016-05-29,沙田,1,12,13,永恆光輝 (V141),何澤堯,H,自外檔出閘良佳，其後收慢留居最後數位。最後二百米保持走勢，超越一匹已洩氣對手。
2016-05-29,沙田,1,13,9,蒜頭爺爺 (V039),寶遜,H1,瞬即墮居後列位置，再無表現。
2016-05-29,沙田,1,14,11,天寳 (V064),蔣嘉琦,--,出閘普通，瞬即恢復走勢，居最後數位，走第三疊。轉直路彎時居相若位置，入直路時墮居包尾位置，瞬即脫離馬群。
