date,venue,race_no,place,horse_no,horse_name,jockey,gear,commentary
2025-05-25,沙田,11,8,6,光年八十 (H170),湯普新,B/TT,出閘緩慢，居中間之後位置。三百米處上前時受緊迫。最後一百五十米洩氣。
2025-05-25,沙田,11,9,9,八駿福昇 (K086),巴度,B/TT,出閘緩慢，被拋離，居包尾位置。保持走勢，但從未能構成威脅。
2025-05-25,沙田,11,10,2,確好勁 (K199),梁家俊,XB/TT,出閘笨拙，觸碰閘廂一側，搶口，居後列。四百米處空位不足。望空後略為追前。
2025-05-25,沙田,11,11,14,滿歡笑 (G461),楊明綸,TT1,居中間位置。入直路時走外疊。二百米處轉弱。
2025-05-25,沙田,11,12,5,長勝金剛 (K266),巫顯東,CP/TT,自大外檔出閘後切入領放。搶口。三百米處被超越，其後轉弱。
2025-05-25,沙田,11,13,1,正極 (K367),麥道朗,B1/TT,居中間位置，走外疊。直路彎緊隨領先馬匹，瞬即轉弱。
2025-05-25,沙田,11,14,13,七彩雲珠 (J433),班德禮,TT,早段走外疊，跟隨領放馬。四百米處迅速轉弱，其後收慢。
2025-05-25,沙田,1,1,4,光年程祥 (K204),蔡明紹,CP1/TT1,出閘普通，居中間稍後位置，走內疊。直路彎走內疊節省腳程。直路初空位不足。一百五十米處望空。衝刺強勁，以一馬頸位之先取勝。
2025-05-25,沙田,1,2,1,不勞而獲 (K377),周俊樂,TT,出閘迅速，居第三位，落後一個半馬位。直路彎落後相同距離。直路上對催策反應良佳。一百米處取得領先。保持佳勢，但接近終點時不敵頭馬。（見競賽事件報告。）
2025-05-25,沙田,1,3,8,快活精神 (K326),潘頓,CP/TT,出閘迅速，居第二位，落後領放馬一個馬位。直路彎前走勢輕鬆。直路上保持佳勢，跑獲季軍，但一直未能超越領放馬。
2025-05-25,沙田,1,4,5,馬達 (K165),梁家俊,CP/TT,與對手同步出閘，居中間位置，走第二疊。入直路時走第三疊。直路初未能望空，二百米處望空。其後略為追前。
2025-05-25,沙田,1,5,11,知道穩勝 (K406),班德禮,TT,與對手同步躍出，落後領放馬兩個馬位，走內疊。入直路時走第二疊，直路初未能望空，其後略為追前。
2025-05-25,沙田,1,6,9,華夏俊馬 (K433),楊明綸,--,出閘時急促向內斜跑，與對手互相觸碰。受催策上前領先。入直路時領先一個馬位，直路初保持佳勢。一百米處未能再增速及被超越，其後轉弱。
2025-05-25,沙田,1,7,12,過關勇士 (K429),潘明輝,TT1,躍出時受擠迫，居包尾位置，落後七個馬位。直路彎沿欄略為追近，直路上略為追前。
2025-05-25,沙田,1,8,7,競駿勇士 (K464),布文,TT1,出閘普通，居中間之後位置，走第二疊。跑過七百米處後向外移出。入直路時落後兩至三個馬位。直路上保持穩勢。
2025-05-25,沙田,1,9,10,星將 (K331),霍宏聲,TT1,躍出時受擠迫，居中間位置，走外疊。入直路時略為追近。直路初略為追前。二百米處未能再增速。末段走勢平穩。（見競賽事件報告。）
2025-05-25,沙田,1,10,6,神燦金剛 (K259),艾兆禮,TT1,起步後不久發生碰撞，居後列，走第二疊。入直路時落後約四個馬位，直路上保持同速。（見競賽事件報告。）
2025-05-25,沙田,1,11,3,勁勇皇駒 (K157),希威森,XB1,出閘普通，居後列，走外疊。入直路時落後四個半馬位。末段保持同速。（見競賽事件報告。）
2025-05-25,沙田,2,1,10,金創福威 (K002),楊明綸,B/TT,在催策下穩步上前，一千米處進佔第五位，落後稍逾兩個馬位。其後收慢避開他駒後蹄，八百米處墮居第六位。入直路時自第五位追前，一百五十米處取得領先。
2025-05-25,沙田,2,2,7,白鷺金剛 (K296),霍宏聲,--,出閘稍慢，但迅速恢復走勢，居中間稍後位置。約七百米處收慢及失位。入直路時自最後數位以佳勢追前，過終點時不敵頭馬。
2025-05-25,沙田,2,3,14,發光發亮 (H385),蔡明紹,B/TT1,出閘普通，瞬即墮居後列。轉直路彎時移離內欄，穩步上前。入直路後在馬匹之間受緊迫。末段以佳勢追前，過終點時最為接近。
2025-05-25,沙田,2,4,2,佳運發 (E435),黃智弘,CP/TT,早段緊隨領放馬，大多居第三位，落後領放馬不逾兩個馬位，走第二疊。進入直路時位置相若。末段保持同速，未能加速。
2025-05-25,沙田,2,5,4,特別美麗 (H123),賀銘年,PC,自外檔出閘後瞬即留後，留力候上。最後一百五十米在催策下以佳勢上前，過終點時最為接近。
2025-05-25,沙田,2,6,9,新力超升 (K188),田泰安,CP-,瞬即留居最後數位之內。轉直路彎時走內欄節省腳程。其後收慢，二百五十米處向外移出取位。末段在催策下持續力拼，但未能構成威脅。
2025-05-25,沙田,2,7,3,龍之光 (K091),奧爾民,B1,居中間位置，走第三疊。八百米處在切入之際受妨礙。轉直路彎時走第四疊，沒有遮擋。末段看來難以被策騎。
2025-05-25,沙田,2,8,5,牛精豪情 (K181),鍾易禮,H/TT,居中間位置，落後領放馬約五個馬位，走內欄。直路初在馬匹之後受緊迫。約一百五十米處被迫收慢。末段再無表現。
2025-05-25,沙田,2,9,12,皇金合 (K099),湯普新,B,受催策，取得領先，對面直路上在跑道中央競跑。開始轉直路彎時切入第二疊。七百米處失去領先位置。保持走勢，直至一百五十米處再無餘力。
2025-05-25,沙田,2,10,8,後無來者 (K049),布文,TT1,早段居領先馬群中，走外疊。直路彎留居第六位，落後約三個馬位，走第三疊，沒有遮擋。入直路時墮居更後位置。末段保持同速。
2025-05-25,沙田,2,11,6,電路一百 (K308),希威森,B1/XB1,瞬即留居中間之後位置。轉直路彎時走第三疊，失去遮擋。入直路時墮居包尾位置。在催策下保持走勢，末段超越已洩氣潰敗的對手。
2025-05-25,沙田,2,12,1,福國寶 (G315),艾道拿,--,居領放馬內側第二位，走內欄。七百米處以短距離領先。直路初被對手追上。最後一百五十米迅速力竭。
2025-05-25,沙田,2,13,13,太行美景 (J314),班德禮,TT,自大外檔出閘後瞬即留居遙遙落後的位置。從未能構成威脅。
2025-05-25,沙田,2,14,11,神舟彎月 (K119),梁家俊,H1/P1/TT,出閘一般，其後逐漸恢復走勢，進佔第三位，落後一個半馬位。九百米處收慢避開他駒後蹄，跑來搶口。入直路時保持同速，居第五位，落後三個馬位。最後二百五十米轉弱。
