date,venue,race_no,place,horse_no,horse_name,jockey,gear,commentary
2025-05-31,沙田,11,7,1,金勝名駒 (H461),奧爾民,TT,跟隨領放馬，走第三疊。四百米處發力。最後二百米力竭。
2025-05-31,沙田,11,8,8,堅闖 (J015),梁家俊,B/SR,居中間位置。半程時墮後及搶口。四百米處伺機取位。三百米處望空。末段保持走勢。
2025-05-31,沙田,11,9,13,同益善 (K254),蔡明紹,B/TT,自大外檔出閘後留後。直路初發生碰撞。末段在催策下毫無表現。
2025-05-31,沙田,11,10,6,競駿光輝 (H135),黃智弘,B,早段跟隨領先馬匹。半程時墮居中間位置。三百米處一度空位不足。一百五十米處轉弱。
2025-05-31,沙田,11,11,3,天威 (J200),楊明綸,V/TT,早段走外疊。過了四百米處後取得領先。三百米處被超越。末段轉弱。
2025-05-31,沙田,11,12,12,明亮天下 (J170),田泰安,B,自外檔出閘後留後，切入內疊，跑來搶口。三百米處在受緊迫下仍居後列。其後毫無表現。
2025-05-31,沙田,11,13,14,東方飛影 (E467),湯普新,B/TT,沿途走大外疊。入直路時追趕領先馬匹。瞬即轉弱。
2025-05-31,沙田,11,14,10,佳駿年年 (K286),鍾易禮,B,出閘後受擠迫，居後列，被拋離。直路彎掙扎上前。三百米處收慢。
