date,venue,race_no,place,horse_no,horse_name,jockey,gear,commentary
2025-05-21,跑馬地,1,1,7,新力 (H325),楊明綸,--,出閘迅速，居中間之前位置，走第三疊。大部分途程沒有遮擋。入直路時落後一個半馬位。衝刺強勁，以短距離之先勝出。
2025-05-21,跑馬地,1,2,1,寶進 (K249),梁家俊,CP/TT,出閘一般，受催策上前領放。入直路時領先一個馬位，直路上保持佳勢，但接近終點時不敵頭馬。
2025-05-21,跑馬地,1,3,4,安都 (K033),布文,V/TT,出閘普通，居中間稍前位置，走第二疊。入直路時落後二又四分三個馬位。衝刺良佳，取得季軍，但未能威脅頭兩名馬匹。
2025-05-21,跑馬地,1,4,11,喜勝駿駒 (J090),黃智弘,TT,起步後不久發生碰撞。居中間位置，走第三疊，有遮擋。直路彎前居相同位置。直路上略為追前。
2025-05-21,跑馬地,1,5,8,星之願 (J480),希威森,H,出閘笨拙，留居後列，走外疊。入直路時落後約六個馬位，直路上移出外疊。追前甚多，過終點時最為接近。
2025-05-21,跑馬地,1,6,3,品德寶寶 (J465),霍宏聲,B/TT,起步後不久與對手互相碰撞，居中間稍後位置，走外疊。早段難以穩定走勢。四百米處開始上前。末段衝刺平穩。
2025-05-21,跑馬地,1,7,12,魅力心 (K053),賀銘年,XB/TT,出閘笨拙，居中間之後位置，落後約四個馬位，走第二疊。直路彎居相同位置，直路上保持同速。
2025-05-21,跑馬地,1,8,2,自動自覺 (K080),巴度,CP1/TT,自外檔出閘後留居包尾位置，落後約七個馬位。直路彎落後相同距離。直路上超越數匹已呈疲態的對手。
2025-05-21,跑馬地,1,9,9,鐵甲驌龍 (J459),鍾易禮,B-/TT,出閘迅速，居第二位，走第二疊。入直路時落後一個馬位，直路初未能再增速，最後二百米轉弱。
2025-05-21,跑馬地,1,10,10,盛勢威楓 (K111),潘明輝,XB,自第一檔出閘普通，居中間之前位置，走內疊。直路彎落後約兩個馬位，直路初未能再增速，最後一百米轉弱。（見競賽事件報告。）
2025-05-21,跑馬地,1,11,6,有色光輝 (K135),周俊樂,--,出閘迅速，落後領放馬四個馬位，走內疊。直路彎走內疊節省腳程。直路初未能再增速，最後二百米逐漸轉弱。（見競賽事件報告。）
2025-05-21,跑馬地,1,12,5,天比高 (K339),田泰安,--,自最外檔出閘，留居後列，落後六個馬位，走內疊。直路彎走內疊節省腳程，直路上毫無進展。
2025-05-21,跑馬地,2,1,9,至旺財 (H273),布文,B/XB,上前跟隨領放馬。入直路時走勢甚佳。加速上前，接近二百米處時取得領先。末段保持勁勢，從容勝出。
2025-05-21,跑馬地,2,2,4,威威父子 (H419),潘明輝,V,與對手同步出閘，受約束，居中間之前位置。入直路時受催策，走外疊。最後三百米力拼，但未能追近頭馬。
2025-05-21,跑馬地,2,3,11,型到爆 (H011),艾兆禮,E/P/TT,自第二檔出閘，居中間位置，走內疊。最後三百米保持穩勢，跑獲季軍。未能威脅遙遙領先的頭馬。
2025-05-21,跑馬地,2,4,8,桃花多 (E488),周俊樂,P-/B2/TT2,躍出後移入內欄，留居中間之後位置，落後七個馬位。跑過四百米處時固守內疊。走勢不俗，但不足以挑戰遙遙領先的頭馬。
2025-05-21,跑馬地,2,5,2,風雲 (J371),班德禮,V/XB,受約束，居中間之後位置，落後領放馬六至七個馬位。直路彎移出外疊。直路上走勢普通。一直未能追上領先馬匹。
2025-05-21,跑馬地,2,6,3,無極勇將 (J169),鍾易禮,CP-/B2/TT,早段居後半馬群中。七百米處墮居後列。末段衝刺不俗，略為追前，但未能構成威脅。
2025-05-21,跑馬地,2,7,6,瀧澤飛駒 (H339),蔡明紹,H/TT,受催策上前，居前列第三位。四百米處受催策，但缺乏加速力，末段未能追近領先馬匹。
2025-05-21,跑馬地,2,8,12,無敵精英 (G129),楊明綸,H/PC/TT,自第一檔出閘，早段略受催策以佔取前列位置。跑過四百米處時對催策反應僅屬一般。從未見具爭勝機會。
2025-05-21,跑馬地,2,9,7,朗日雪峰 (J187),霍宏聲,V/TT,出閘僅屬一般，早段略受催策以切入領放。直路中段呈現疲態。末段被超越。
2025-05-21,跑馬地,2,10,10,千里如飛 (J221),湯普新,B-/TT,居中間位置，走第二疊。五百米處受力策，但毫無表現。從未參與競逐。
2025-05-21,跑馬地,2,11,5,碧海藍天 (H357),田泰安,H/TT,自第十二檔出閘，留居包尾位置，落後領放馬十個馬位。四百米處落後頗遠，末段衝刺乏力。
2025-05-21,跑馬地,2,12,1,閃亮老撾 (J322),梁家俊,V2/TT,早段墮居接近包尾位置。五百米處受催策。入直路時移出外疊。在負頂磅下未能追前。
2025-05-21,跑馬地,3,1,11,加州活力 (J131),鍾易禮,B/TT,居後列，走勢不俗。接近八百米處時開始上前。在催策下追前甚多。
2025-05-21,跑馬地,3,2,8,神駒馬靈 (J162),梁家俊,PC/TT,領放至接近千一米處，早段搶口。末段衝刺頗佳。
2025-05-21,跑馬地,3,3,7,錶之星球 (K151),賀銘年,XB-/TT-,居後列，走勢暢順。最後一百五十米略為加速上前。
2025-05-21,跑馬地,3,4,3,都靈勇士 (G150),霍宏聲,XB,出閘僅屬一般，其後不久受擠迫。居後列，直路彎及直路初受困。末段衝刺不俗。（見競賽事件報告。）
2025-05-21,跑馬地,3,5,6,風繼續吹 (E471),潘明輝,B,居中間之前位置，走勢不俗。以穩勢上前。
2025-05-21,跑馬地,3,6,4,東來欣賞 (J290),布文,H/TT,居中間之後位置，向外移出，開始上前，其後搶口。保持同速至終點。
2025-05-21,跑馬地,3,7,1,論文 (H111),奧爾民,TT,居中間位置，走勢一般。末段走勢平平。（見競賽事件報告。）
2025-05-21,跑馬地,3,8,12,歡喜福星 (G354),艾兆禮,TT,受力策，領放。入直路時轉弱。
2025-05-21,跑馬地,3,9,5,嘉力寶 (K137),田泰安,B,出閘僅屬一般，沿途居後列。無甚表現。
2025-05-21,跑馬地,3,10,9,馬主雄風 (H047),班德禮,TT,出閘僅屬一般。在騎師對坐騎動作有疑慮之際收慢。（見競賽事件報告。）
2025-05-21,跑馬地,3,11,10,冠寶駒 (D359),楊明綸,B-/TT,居中間位置。轉直路彎時墮退。從未參與競逐。
2025-05-21,跑馬地,3,12,2,領航財子 (J305),潘頓,B/XB1/TT,居前列。直路上對催策毫無反應。（見競賽事件報告。）
2025-05-21,跑馬地,4,1,11,極速滿貫 (G277),希威森,--,居中間之後位置，三百米處沿欄加速上前爭勝，二百米處領放，保持佳勢。
2025-05-21,跑馬地,4,2,1,奮鬥心 (J267),奧爾民,TT,走外疊。對面直路上追前，進佔中間位置。入直路時發力，保持走勢。
2025-05-21,跑馬地,4,3,9,美麗歡聲 (H066),艾兆禮,V/TT,跟隨領放馬。入直路時上前爭勝，走第三疊。已獲機會盡展所長，保持走勢。
2025-05-21,跑馬地,4,4,5,長勝威龍 (J464),湯普新,B,自大外檔出閘，墮居包尾位置。四百米處受推策。直路上走外疊。保持走勢，最後一百五十米追前數位。
2025-05-21,跑馬地,4,5,2,三軍勇將 (J360),布文,TT,居中間位置，走外疊，搶口。直路彎走最外疊。保持走勢。
2025-05-21,跑馬地,4,6,6,赤馬雄風 (E028),黃智弘,B/TT,跟隨領放馬，走內欄。二百米處一度極具爭勝機會，但最後一百米再無餘力。
2025-05-21,跑馬地,4,7,4,翠兒威威 (K084),周俊樂,TT,自外檔出閘，留居後列。一百五十米處須移出較外疊。保持走勢，但未能追及領先馬匹。
2025-05-21,跑馬地,4,8,10,連連歡呼 (G195),賀銘年,B/TT,居中間位置。二百米處在嘗試推進時空位不足。一百米處望空，但未能追上領先馬匹。
2025-05-21,跑馬地,4,9,3,精算謀略 (H237),巴度,H,居中間位置。六百米處受催策以保持位置，二百米處空位不足。保持同速。
2025-05-21,跑馬地,4,10,7,皇仁福星 (H128),田泰安,B/XB,跟隨領放馬。三百米處受催策，一百五十米處轉弱。
2025-05-21,跑馬地,4,11,12,宇宙動力 (H156),鍾易禮,B,在領放下搶口，二百米處被超越，其後轉弱。
2025-05-21,跑馬地,4,12,8,大將鵰神 (J378),巫顯東,B-/XB,居後列，留力候上。四百米處被拋離。直路上遙遙落後。
2025-05-21,跑馬地,5,1,6,精益大師 (H134),班德禮,B/TT,出閘迅速，居中間之前位置，走外疊。入直路時落後約兩個馬位。直路上對催策反應良佳。一百五十米處取得領先。末段保持佳勢，勝出賽事。
2025-05-21,跑馬地,5,2,1,萬眾開心 (H208),鍾易禮,B/TT,出閘迅速，早段居中間之前位置，走第二疊。接近六百米處時移入內欄。入直路時落後約兩個半馬位。衝刺良佳，跑獲亞軍，但未能威脅頭馬。
2025-05-21,跑馬地,5,3,8,辣得金 (J087),賀銘年,H/TT,出閘僅屬一般，居中間之後位置，走第三疊，有遮擋。入直路時走大外疊。直路上追前頗多，跑獲季軍。
2025-05-21,跑馬地,5,4,3,天火同人 (E175),黃智弘,CP-/B1/XB2,躍出時受擠迫，居中間之後位置，走外疊。直路彎略為追近。直路上略為追前。
2025-05-21,跑馬地,5,5,4,首駿 (K189),布文,H-/XB/TT,與對手同步出閘，居後列，走外疊。直路彎落後四至五個馬位。入直路時走大外疊。末段追前頗多，但未能構成威脅。
2025-05-21,跑馬地,5,6,2,胡椒軍曹 (E432),梁家俊,--,自第一檔出閘迅速，居中間位置，走內疊。接近五百米處時收慢。入直路時落後四個馬位。衝刺平穩。
2025-05-21,跑馬地,5,7,12,瑤瑤日上 (J423),巴度,--,與對手同步出閘，受催策上前，居前列，走第二疊。趨近六百米處時讓對手過頭。直路彎居第二位。二百米處取得領先。一百五十米處未能再增速，被超越。最後一百米轉弱。
2025-05-21,跑馬地,5,8,5,弦力寶 (K317),田泰安,--,自大外檔出閘，留居後列，走第二疊。入直路時落後五個馬位。最後二百米超越部分已呈疲態的對手。（見競賽事件報告。）
2025-05-21,跑馬地,5,9,11,亮寶 (K067),潘頓,CP/XB/TT,起步時發生碰撞，受催策上前，居前列，走外疊。六百米處取得領先。接近五百米處時移入內欄。入直路時領先一個馬位。二百米處未能再增速，被超越。最後一百米轉弱。（氣管內有血。）（失去左前蹄的蹄鐵。）
2025-05-21,跑馬地,5,10,10,快樂寶寶 (J545),希威森,XB,起步時與對手互相碰撞，失去平衡，留居包尾位置，走內疊。直路彎走內疊節省腳程。直路上衝刺乏力。
2025-05-21,跑馬地,5,11,7,八駿高昇 (J476),蔡明紹,H/TT,起步時發生碰撞，居中間位置，走第二疊。入直路時落後約三個馬位。直路初未能再增速，其後轉弱。
2025-05-21,跑馬地,5,12,9,生生勝利 (J216),奧爾民,H/P/TT,起步時發生碰撞，居前列，走內疊。接近五百米處時讓對手過頭。入直路時居領放馬之後。直路初對催策毫無反應，其後轉弱。（氣管內有血。）（心律不正常。）
2025-05-21,跑馬地,6,1,1,富國兄弟 (J396),蔡明紹,TT,居前列，走第二疊。走勢良佳。終點線上僅勝。
2025-05-21,跑馬地,6,2,4,燭光晚餐 (J468),奧爾民,H,前速甚快，取得領先。保持佳勢。終點線上僅敗。
2025-05-21,跑馬地,6,3,6,天下寵兒 (J359),潘頓,--,跟隨領放馬，走第二疊。保持走勢。已獲機會盡展所長。
2025-05-21,跑馬地,6,4,11,快樂老撾 (J115),梁家俊,CP/TT,居中間位置，走內欄。衝刺尚可。
2025-05-21,跑馬地,6,5,5,電玩精英 (H356),希威森,SR,居中間之後位置，走第三疊。保持一般走勢。
2025-05-21,跑馬地,6,6,10,有盈勇士 (K271),巴度,TT,居後列。末段略為追前。
2025-05-21,跑馬地,6,7,3,砂漿金剛 (G328),鍾易禮,V/TT,居接近中間位置，走第三疊，沒有遮擋。無甚表現。（見競賽事件報告。）
2025-05-21,跑馬地,6,8,7,獵寶勤 (J304),布文,B,居領先馬匹之後。在催策下保持同速。（見競賽事件報告。）
2025-05-21,跑馬地,6,9,2,超強六十 (J071),黃智弘,H/P,居中間位置，走第二疊。直路初受困。未能追前。
2025-05-21,跑馬地,6,10,8,皇寶駒 (K243),霍宏聲,TT1,居中間之後位置，走內欄。對催策反應平平。
2025-05-21,跑馬地,6,11,12,精明勇駿 (G031),楊明綸,V/TT,居中間之後位置，走第三疊。從未能構成威脅。（見競賽事件報告。）
2025-05-21,跑馬地,6,12,9,榮耀盛甲 (K290),田泰安,XB1,居包尾位置。從未參與競逐。
2025-05-21,跑馬地,7,1,2,人和家興 (E061),霍宏聲,B/TT,居好位，跟隨領放馬，走第二疊。入直路時展開挑戰。末段在催策下力拼。終點線上僅勝。
2025-05-21,跑馬地,7,2,5,安康萬里 (J158),潘頓,H1/TT,出閘迅速，居第三位，落後逾兩個馬位，走第二疊。入直路時開始發力，其後領先短距離。終點線上僅敗。
2025-05-21,跑馬地,7,3,6,樂勝天下 (J540),梁家俊,CP,出閘普通，居中間第六位，走第二疊。轉直路彎時受催策。末段在催策下追前。過終點時最為接近。
2025-05-21,跑馬地,7,4,3,無限美麗 (H377),布文,--,居第五位，落後領放馬約三個馬位，走第三疊，沒有遮擋。開始轉直路彎時略為墮後。入直路時走外疊。末段在催策下穩步追前，但未能構成威脅。
2025-05-21,跑馬地,7,5,7,暴風之子 (K176),周俊樂,B,出閘迅速，居第四位，落後約三個馬位，走內欄。直路彎受催策。轉入直路時走內欄節省腳程。末段保持同速。
2025-05-21,跑馬地,7,6,8,美麗邂逅 (E459),鍾易禮,CP/TT,出閘普通，居中間位置，走第三疊。跑過八百米處後失位，墮居第八位。轉直路彎時居最後數位之內，為走最外疊的馬匹之一。末段追前頗多。
2025-05-21,跑馬地,7,7,1,鈁糖武士 (G016),黃智弘,B-/TT,出閘普通，穩步上前，居中間之後位置，走內欄。轉直路彎時居相若位置。入直路時走內欄節省腳程。持續力拼，但未能構成威脅。
2025-05-21,跑馬地,7,8,10,魯班精神 (J233),班德禮,B/TT,自大外檔出閘，遙居包尾位置。大部分途程尾隨馬群直至二百米處。末段走勢良佳，超越已洩氣潰敗的對手。
2025-05-21,跑馬地,7,9,11,縱橫萬里 (H264),希威森,TT,自第一檔出閘迅速，沿欄領放，嘗試一放到底。直路上在內閃之際後勁不繼。最後二百五十米被超越。
2025-05-21,跑馬地,7,10,9,勇威神駒 (G471),潘明輝,TT,自第十一檔出閘，瞬即墮居最後數位之內。從未見具爭勝機會。
2025-05-21,跑馬地,7,11,4,觀天下 (J348),田泰安,TT,居後列。轉入直路時走最外疊。從未能構成威脅。
2025-05-21,跑馬地,7,12,12,太勝駒 (K124),巴度,SR/TT,自第十檔出閘，居最後數位之內。從未見具爭勝機會。
2025-05-21,跑馬地,8,1,3,納百川 (J276),周俊樂,TT,留居接近包尾位置，落後領放馬八個馬位。留力候上直至三百米處。其後衝刺強勁，接近終點時上前取勝，勝姿悅目。
2025-05-21,跑馬地,8,2,4,久久為攻 (E472),湯普新,B/TT,居中間之前位置。直路彎落後領先馬匹不遠。其後走勢良佳。直路中段爭奪領先。五十米處一度取得領先，但末段不敵頭馬。
2025-05-21,跑馬地,8,3,7,盈妍威楓 (J300),梁家俊,B/TT,出閘迅速，早段走外疊。其後展步上前，跟隨領放馬。入直路時取得領先。一百米處前以佳勢力拼。末段不敵頭兩名馬匹。
2025-05-21,跑馬地,8,4,1,信心星 (J161),布文,H/TT,留居包尾位置，落後領放馬十個馬位。在追前之際於接近二百米處時受困。末段向外移出及以佳勢衝刺，跑獲平頭第四名。（騎師因未有力策坐騎，表現未能令小組滿意而被罰停賽。）
2025-05-21,跑馬地,8,4,11,勁好運 (H481),潘明輝,B1/TT,早段搶口，居中間位置，走內欄。最後三百米衝刺頗佳，但一直落後首數名馬匹。
2025-05-21,跑馬地,8,6,6,佛亮老撾 (K174),潘頓,TT,出閘僅屬一般，受約束，居中間之後位置。四百米處受推策。其後保持普通走勢至終點。
2025-05-21,跑馬地,8,7,5,皇仁歡星 (J278),奧爾民,SR-/TT,沿途保持落後領先馬匹不遠。自八百米處起居第五位。已獲機會盡展所長，但末段衝刺僅屬一般。
2025-05-21,跑馬地,8,8,9,紅海勁 (H207),巴度,TT,居中間之後位置，走內欄。四百米處落後六個馬位，但對催策的反應僅屬一般。從未能威脅領先馬匹。（賽後接受獸醫檢查，並無發現任何明顯異常之處。）
2025-05-21,跑馬地,8,9,2,有財有勢 (H037),艾兆禮,B,居後列，落後領放馬八至九個馬位。直路彎位置大致不變。末段落後甚遠，但衝刺僅屬一般。（騎師表示，坐騎在直路上不適應在馬匹之間競跑。）
2025-05-21,跑馬地,8,10,10,開心五月 (K016),鍾易禮,XB/TT,受催策上前，如預期般領放。首八百米以快步速領放。入直路時瞬即被超越。其後在催策下轉弱。
2025-05-21,跑馬地,8,11,12,哈羅威 (J280),楊明綸,V/XB,自第一檔出閘後上前，跟隨領放馬，走內疊。首八百米步速偏快。入直路時在催策下再無餘力。（騎師表示，坐騎未能在一千六百五十米途程上交出好表現。賽後接受獸醫檢查，並無發現任何明顯異常之處。）
2025-05-21,跑馬地,8,12,8,至高心得 (J395),蔡明紹,--,受約束，居中間位置。早段搶口。轉直路彎時再無餘力。末段轉弱，包尾而回。
2025-05-21,跑馬地,9,1,9,騰龍四海 (J317),潘頓,B,與對手同步出閘，居第二位，走第二疊。直路彎前居相同位置。直路上對催策反應良佳。一百五十米處取得領先。保持佳勢，力拒對手的挑戰取勝。
2025-05-21,跑馬地,9,2,3,電源之駒 (E301),巴度,--,與對手同步出閘，居中間之後位置，走第二疊。四百米處開始上前。入直路時走大外疊。衝刺強勁，取得亞軍。僅以一馬頭位之差落敗。
2025-05-21,跑馬地,9,3,12,金牌活力 (J402),田泰安,B/TT,起步後不久發生觸碰，落後約三個馬位，走第三疊，有遮擋。直路彎前居相同位置。末段衝刺良佳，跑入季席。過終點時最為接近。（見競賽事件報告。）
2025-05-21,跑馬地,9,4,6,友愛心得 (J537),霍宏聲,--,出閘笨拙，居中間之前位置，走第二疊。直路彎居相若位置。直路初未能望空。二百米處望空。末段以穩勢衝刺。
2025-05-21,跑馬地,9,5,11,廚神 (K264),潘明輝,CP,起步後不久被碰撞，落後一個半馬位，走第三疊。自七百米處起沒有遮擋。入直路時落後相同距離。直路上保持穩勢。
2025-05-21,跑馬地,9,6,7,伊臣 (G061),艾兆禮,TT2,自大外檔出閘後留居包尾位置。直路彎落後七個半馬位。直路上移出外疊。末段追前甚多。過終點時最為接近。
2025-05-21,跑馬地,9,7,2,八駿巨昇 (H092),鍾易禮,H/TT,自外檔出閘普通，受催策上前，居前列，走外疊。九百五十米處取得領先。六百米處移入內欄。直路彎領先一個馬位。直路初保持佳勢。一百五十米處未能再增速及被超越。最後一百米轉弱。
2025-05-21,跑馬地,9,8,5,巴閉哥 (G335),布文,TT,自第一檔出閘迅速，居中間位置，走內疊。直路彎走內疊節省腳程。入直路後保持走內疊。末段以穩勢衝刺。（見競賽事件報告。）
2025-05-21,跑馬地,9,9,8,超勁赤兔 (K312),梁家俊,E1/TT1,出閘僅屬一般，其後不久失去平衡及失地，居後列，走內疊。入直路時落後六至七個馬位。直路上略為追前。
2025-05-21,跑馬地,9,10,10,金匯昇昇 (H242),湯普新,B/TT1,自外檔出閘後留居後列。入直路時落後五個半馬位。直路上移出外疊。末段以穩勢衝刺。
2025-05-21,跑馬地,9,11,4,奇異果 (K285),奧爾民,TT,與對手同步出閘，居中間之後位置，走內疊。直路彎走內疊節省腳程。直路初未能再增速。其後轉弱。
2025-05-21,跑馬地,9,12,1,天足貓 (G166),賀銘年,TT,出閘迅速，早段取得領先。九百五十米處被超越。中段落後領放馬兩個馬位。直路初對催策反應平平。最後一百米轉弱。（見競賽事件報告。）
