date,venue,race_no,place,horse_no,horse_name,jockey,gear,commentary
2017-10-01,沙田,4,1,1,喜得福 (T421),莫雷拉,TT,出閘迅速，居第二疊第二位，落後領放馬兩個馬位。入直路後上前，受催策，一百米處取得領先，帶離勝出。
2017-10-01,沙田,4,2,4,勝利之星 (CM148),梁家俊,B,在力策下取得領先。千一米處移入內欄，大幅減慢步速。入直路時發力上前。在被對手挑戰下持續力拼，最後一百米被超越。
2017-10-01,沙田,4,3,7,魅力知寶 (V324),韋達,B/H/TT,出閘迅速，並排領先。跑過千一米處時落後領放馬一個馬位。直路初上前，看似具爭勝機會，最後一百米不敵頭馬。
2017-10-01,沙田,4,4,5,繽紛駿驥 (A292),何澤堯,CP1/TT1,出閘迅速，居包廂位置，落後領放馬兩個馬位。直路初在催策下走勢稚嫩，持續力拼至終點。
2017-10-01,沙田,4,5,8,日東昇 (V302),李寶利,V-/B2,出閘笨拙，碰撞他駒及失地，墮居包尾位置。尾隨馬群，入直路時受催策上前，看似具爭勝機會，二百米處無以為繼，其後保持同速。
2017-10-01,沙田,4,6,9,盛勢東方 (V295),田泰安,H,出閘緩慢，受催策保持居中間位置。當賽事步速減慢時走勢欠順。直路初受催策，但僅能保持同速。
2017-10-01,沙田,4,7,6,開心日子 (A333),羅理雅,H/TT,早段獲許穩定走勢，居後列，走第二疊。跑過六百米處時受催策，反應平平。直路上保持同速。
2017-10-01,沙田,4,8,2,悅目星光 (A137),巫顯東,CP/TT,躍出時留後，墮居最後兩位之內，離欄競跑。大多居後列，從未參與競逐。
2017-10-01,沙田,4,9,3,大笑大少 (P297),祈普敦,B,早段受催策保持居中間位置，瞬即再受催策。趨近直路彎時墮退。直路上受力策，但未能交出反應，其後收慢。
2017-10-01,沙田,5,1,11,善財到 (V244),何澤堯,H/TT,自第一檔出閘迅速，落後約一個馬位，走內欄。轉彎時走勢輕鬆。入直路後持續走內疊，衝刺良佳，勝出賽事。
2017-10-01,沙田,5,2,2,紅衣優駿 (A039),田泰安,B,出閘稍慢，居中間位置，走內欄節省腳程直至接近六百米處。直路上略為追前。過終點時最為接近。（接近二百米處時鼻部被他駒騎師的馬鞭擊中。）
2017-10-01,沙田,5,3,8,津津樂道 (N248),潘明輝,--,留居後列，落後六個馬位。沿欄略為推進。接近六百米處時向外移出。直路上衝刺良佳，跑獲季軍。
2017-10-01,沙田,5,4,4,勁嘉輝 (T236),黃皓楠,CP-/B2,起步時碰撞對手，居後列，走外疊，沒有遮擋。中段推進上前。入直路時走第五疊。保持佳勢，接近一百五十米處時未能再增速。過終點時僅失季席。
2017-10-01,沙田,5,5,3,玩得喜 (A239),巫顯東,B,出閘笨拙及失地，居包尾位置，落後七個馬位。入直路時仍居包尾位置。直路初受困。其後望空時略為上前。
2017-10-01,沙田,5,6,1,魚躍鳥歡 (V361),莫雷拉,--,出閘一般，居後列，落後五至六個馬位。入直路時移至大外疊。直路初與對手互相碰撞及失去平衡。其後走勢平穩。（右前腿不良於行。）
2017-10-01,沙田,5,7,9,凱旋星光 (T224),郭能,TT,出閘迅速，落後一至兩個馬位，走第二疊。接近六百米處時向外移出。直路初未能再增速。其後走勢平穩。（左前腿不良於行。）
2017-10-01,沙田,5,8,7,小奇妙 (T298),祈普敦,B/TT,出閘普通，居中間位置，走第二疊。自六百米處起推進。入直路時走第四疊。直路上衝刺乏力。
2017-10-01,沙田,5,9,10,團圓豐收 (V409),楊明綸,B,展步迅速，輕鬆取得領先。入直路後不久被超越，逐漸墮退。
2017-10-01,沙田,5,10,5,大運舞台 (T256),韋達,B,出閘迅速，落後約四個馬位，走第二疊。入直路時移至大外疊。接近四百米處時與對手互相碰撞及失去平衡。其後毫無進展。（見競賽事件報告。）
2017-10-01,沙田,5,11,6,喜歡盈 (A276),梁家俊,H-,自大外檔出閘迅速，受催策上前，居前列。轉彎時未能再增速。直路初再無餘力。
