date,venue,race_no,place,horse_no,horse_name,jockey,gear,commentary
2017-11-29,跑馬地,1,1,12,金錢炮 (T022),何澤堯,B/H/XB,自外檔出閘，逐漸推進，居領放馬外側，步速緩慢。跑過五百米處時加速，迅速追近領放的亞軍馬匹。二百米處帶離兩個馬位，僅保住勝果。
2017-11-29,跑馬地,1,2,11,飛雲寶 (V392),李寶利,--,早段緊迫競跑，其後居中間位置。在緩慢的賽事步速下迅速上前，入直路彎時一度緊追領放馬。入直路時落後一個馬位，在催策下持續力拼，以短距離之差見負。
2017-11-29,跑馬地,1,3,9,電訊大炮 (V144),潘頓,B,居後列，對面直路初收慢，步速緩慢。跑離大石鼓處時加速，迅速上前。轉直路彎及入直路時居第四位。持續追前，過終點時最為接近。
2017-11-29,跑馬地,1,4,7,四小福 (S283),羅理雅,TT,出閘迅速，對面直路上居中間或中間稍前的第五或第六位。入直路彎時墮後。直路上持續力拼，未能構成威脅。
2017-11-29,跑馬地,1,5,10,跑出彩虹 (T237),蔡明紹,B,自第七檔出閘後居前列，跑過千二米處時在領放下切入內欄，對面直路上以慢步速領放。直路彎早段被超越，入直路後被後上馬匹超越。
2017-11-29,跑馬地,1,6,4,滿載而來 (V182),巫顯東,TT,早段受催策以緊隨領放馬，其後受約束，落後一個馬位。入馬房彎時居第四位，落後兩個馬位。轉直路彎時走勢遲緩。入直路後受妨礙。受催策，但未能加速。
2017-11-29,跑馬地,1,7,6,滿貫中環 (V220),莫雷拉,V/TT,居中間稍前位置，走內欄。入直路彎時墮後，入直路時重奪位置，落後領放馬約兩個馬位。在催策下保持同速至終點。
2017-11-29,跑馬地,1,8,8,金叻星 (S113),田泰安,TT,自外檔出閘後瞬即留後，移入內欄。轉直路彎時開始上前。入直路時走外疊。末段追前甚多，過終點時最為接近。
2017-11-29,跑馬地,1,9,1,金禧足球 (A085),梁家俊,--,在領放馬之後受困，大石鼓處居第三位，其後墮退。入直路時落後兩個馬位。受催策，但再無餘力。
2017-11-29,跑馬地,1,10,3,天賦致寶 (S417),祈普敦,B-,出閘迅速，居中間之後位置，走內欄。入直路彎時進一步墮後，末段追前甚多，超越已洩氣潰敗的馬匹。
2017-11-29,跑馬地,1,11,2,育成天下 (V276),史卓豐,B-/V1/TT,自外檔出閘迅速，居後列。跑過六百米處時短暫發力，直路彎早段進佔中間位置，瞬即轉弱。
2017-11-29,跑馬地,1,12,5,架勢堂 (V309),貝湯美,CP,從未看似有力一爭。
2017-11-29,跑馬地,2,1,7,一馬當先 (S044),史卓豐,B/TT,居包廂位置，步速中等。三百米處以勁勢衝刺，勝出賽事。
2017-11-29,跑馬地,2,2,2,旅英公爵 (T345),田泰安,TT,收慢，居領放馬匹稍後位置，走第二至第三疊。三百米處逐漸上前，跑獲亞軍。
2017-11-29,跑馬地,2,3,12,精選直前 (V329),梁家俊,H,沿欄居後列，步速中等。二百五十米處穩步上前，跑獲季軍。
2017-11-29,跑馬地,2,4,9,歡喜心 (A224),莫雷拉,--,居中間位置，步速中等。三百米處逐漸上前。
2017-11-29,跑馬地,2,5,3,皇家魅力 (A356),柏寶,TT,出閘十分緩慢，受推策佔取中間位置，走內欄，步速中等。二百米處洩氣。
2017-11-29,跑馬地,2,6,8,快樂火龍 (V108),巴度,H/XB/TT,早段受推策，居中間位置，走第二至第三疊，步速中等。僅能保持位置。
2017-11-29,跑馬地,2,7,4,精彩傳奇 (B029),李寶利,--,居中間之後位置，走第二疊，步速中等。直路上走勢尚可。
2017-11-29,跑馬地,2,8,11,常山耆寶 (A275),吳嘉晉,B/H,受推策移入內欄，以中等步速領放。二百五十米處再無餘力。
2017-11-29,跑馬地,2,9,1,幸福一生 (S382),祈普敦,P-,起步時收慢，沿途走第三疊，步速中等。走勢一般。
2017-11-29,跑馬地,2,10,10,泡泡達人 (T346),巫顯東,B/TT,收慢留居後列以取得遮擋，走第二疊，步速中等。未能加速。
2017-11-29,跑馬地,2,11,6,至尊大師 (A357),蔡明紹,TT1,收慢留居後列，走內欄，步速中等。毫無進展。
2017-11-29,跑馬地,2,12,5,好友營 (A369),郭能,B1,受力策上前，步速中等。轉直路彎時外閃。直路上在轉弱之際嚴重內閃 。
2017-11-29,跑馬地,3,1,9,進綵 (T187),莫雷拉,V1,出閘普通，居中間之後位置，走內欄。接近千一米處時勒避他駒後蹄。趨近六百米處時開始推進。跑過一百米處時加速。衝刺強勁，勝出賽事。
2017-11-29,跑馬地,3,2,3,金如意 (A172),潘頓,B,出閘迅速，居領先馬匹之後位置。跑過一千米處時受催策以保持位置。跑過六百米處時推進，取得領先。直路上走內欄，走勢強勁。僅以一馬鼻位之差見負。
2017-11-29,跑馬地,3,3,2,康樂神駒 (T363),郭能,--,出閘後留後，沿途留居包尾位置。接近五百米處時開始推進。直路上以佳勢力拼。衝刺強勁。
2017-11-29,跑馬地,3,4,8,其樂無窮 (S147),羅理雅,B/XB,居中間之後位置，走內欄。接近一千米處時移出第二疊。趨近五百米處時推進。入直路時移出最外疊。末段追前甚多，衝刺強勁。
2017-11-29,跑馬地,3,5,7,皇帝誥令 (T274),梁家俊,H/TT,居中間位置，走內欄。接近一千米處時移出第二疊。接近六百米處時推進。直路上沿途力拼。衝刺強勁。
2017-11-29,跑馬地,3,6,4,榮冠大道 (V378),潘明輝,V,逐漸上前，接近千五米處時居領放馬外側。跑過六百米處時墮後。趨近四百米處時受催策。跑過一百米處時勒避他駒後蹄。衝刺普通。
2017-11-29,跑馬地,3,7,1,快樂神駒 (T416),韋達,V/XB,出閘緩慢，居中間位置。於賽事中段接近一千米處時發力上前。趨近六百米處時受催策，居領放馬外側。其後一直受催策，直路上僅能保持同速。
2017-11-29,跑馬地,3,8,12,天長地久 (S100),吳嘉晉,B,受催策以佔取包廂位置。跑過八百米處時墮退。轉直路彎時對催策反應平平。未能上前。
2017-11-29,跑馬地,3,9,11,豐盛人生 (V346),田泰安,B,出閘迅速，居領先馬匹之後位置。接近五百米處時嘗試推進。跑過一百五十米處時轉弱。未能上前。
2017-11-29,跑馬地,3,10,5,精彩樂韻 (V048),祈普敦,V,居中間之後位置。沿途對催策毫無反應。
2017-11-29,跑馬地,3,11,6,傲行者 (A111),杜利萊,SR-/TT-,趨近千八米處時在搶口之際勒避他駒後蹄，居中間位置。於賽事中段跑過一千米處時上前，取得領先。接近七百米處時受催策，但逐漸墮退。直路初疲態畢呈。必須試閘及格後才可再次出賽。
2017-11-29,跑馬地,3,12,10,欣喜欣喜 (V247),史卓豐,B/TT,出閘普通，取得領先。跑過一千米處時墮後。入直路後迅速力竭。必須試閘及格後才可再次出賽。
2017-11-29,跑馬地,4,1,7,喜盈盈 (T054),何澤堯,B,起步緩慢，向內移入以取得遮擋，居中間位置。轉直路彎時向外移出。跑過二百米處時數度與他駒互相碰撞，其後逐漸增速。接近終點時上前領先，勝出賽事。
2017-11-29,跑馬地,4,2,8,七彩 (V044),田泰安,B/TT,走勢順暢，直路前居領放馬之後位置。跑過一百米處時追上領放馬。接近終點時被超越。
2017-11-29,跑馬地,4,3,10,金威利 (S087),巫顯東,--,受力策，沿欄競跑，跑過九百五十米處時取得領先。入直路時發力上前。最後一百米受催策。接近終點時被後上馬匹超越。
2017-11-29,跑馬地,4,4,3,知道勝 (S218),巴度,B/TT,大部分途程居中間位置，離欄競跑。進入直路時移出外疊。二百米處上前，數度與他駒互相碰撞。保持勁勢至終點。
2017-11-29,跑馬地,4,5,4,金鹿 (P121),潘頓,B-,起步時與他駒互相碰撞，未受催策，居中間之後位置，走內欄。轉直路彎時進佔較接近位置。直路上保持佳勢。末段保持同速。
2017-11-29,跑馬地,4,6,9,哈哈笑 (T071),郭能,CP,被拋離，居後列，離欄競跑。直路上移出外疊，走勢普通。
2017-11-29,跑馬地,4,7,5,勝在煌 (S425),莫雷拉,TT,出閘後瞬即向內移入以取得遮擋，墮居後列，走內欄。轉直路彎時仍走內欄。三百米處向外移出取位，但僅能保持同速。
2017-11-29,跑馬地,4,8,12,飛快叻 (P330),蔡明紹,CP/TT,受力策以佔取前列位置，落後領放馬兩個馬位，走外疊，沒有遮擋。直路彎多走腳程。保持勁勢至二百米處，其後漸呈疲態。
2017-11-29,跑馬地,4,9,2,星二快勝 (V320),祈普敦,H/TT,出閘後瞬即在馬群之後切入，居包尾位置。轉直路彎時被馬群拋離。末段上前。
2017-11-29,跑馬地,4,10,11,有福氣 (V389),梁家俊,V-,出閘迅速，受催策上前，落後領放馬三個馬位，走第二疊。在追趕領放馬的馬群中競跑至二百米處，其後收窄步幅。
2017-11-29,跑馬地,4,11,6,勝利公爵 (T136),羅理雅,H/TT,出閘迅速，早段並排領先。趨近及轉直路彎時居領放馬外側。保持佳勢至二百米處，其後急促墮退。表現難以接受。
2017-11-29,跑馬地,4,12,1,大天龍 (T339),李寶利,H,起步時與他駒互相碰撞，受推策上前，居中間位置，走外疊。跑過六百米處時受催策，逐漸失地。包尾而回。
2017-11-29,跑馬地,5,1,5,喜進 (A188),潘頓,H/XB,出閘迅速，受催策上前，居第二位。沿途走勢暢順。衝刺良佳，輕鬆勝出賽事。
2017-11-29,跑馬地,5,2,6,天皇巨星 (V367),李寶利,B,起步時與他駒互相碰撞，早段受阻礙，居中間位置，落後五至六個馬位，走第二疊。自接近四百米處起推進。直路上追前甚多，跑獲亞軍，未能威脅頭馬。
2017-11-29,跑馬地,5,3,12,大地和平 (S254),潘明輝,B/TT,自第九檔出閘迅速，受催策上前，取得領先。直路彎領先三個馬位。直路初保持佳勢。最後一百米被超越，僅保住季席。（見競賽事件報告。）
2017-11-29,跑馬地,5,4,4,金飯碗 (T289),田泰安,TT,與對手同步出閘，接近一千一百五十米處時受阻礙，落後四至五個馬位，走內欄。直路彎居相同位置。末段走勢平穩，跑入殿軍，未能威脅前三名馬匹。
2017-11-29,跑馬地,5,5,8,紅褲精神 (S329),巴度,CP,出閘普通，落後六至七個馬位，走內欄。直路彎前居相同位置。接近三百五十米處時向外移出。末段走勢平穩。
2017-11-29,跑馬地,5,6,1,活力勇士 (A313),貝湯美,H1,出閘稍慢，居中間之後位置，走第二疊。直路彎仍落後九個馬位。直路上略為上前。
2017-11-29,跑馬地,5,7,7,暴風俠 (A123),史卓豐,V,起步時與他駒互相碰撞，恢復走勢後居第三位，走第二疊。直路彎落後約五個馬位。直路初未能再增速，其後逐漸轉弱。
2017-11-29,跑馬地,5,8,2,魅力之子 (T373),巫顯東,--,自最外檔出閘，留居後列，走第三疊，沒有遮擋。直路彎落後十個馬位。末段走勢平穩。
2017-11-29,跑馬地,5,9,9,劍凌雲 (T300),莫雷拉,--,出閘普通，居後列，走第二疊。直路彎落後九個馬位。直路上保持同速。（氣管內有血。）
2017-11-29,跑馬地,5,10,11,好慷慨 (V402),何澤堯,H,起步時與他駒互相碰撞，居後列，落後十個馬位。直路彎仍遙居於後。直路上保持同速。
2017-11-29,跑馬地,5,11,10,盛勢東方 (V295),吳嘉晉,H,起步時受擠迫，沿途居尾列，從未看似有力一爭。
2017-11-29,跑馬地,5,12,3,運財之星 (S127),梁家俊,B,起步時受擠迫，沿欄居後列。直路彎未能再增速。直路上轉弱。包尾而回。
2017-11-29,跑馬地,6,1,2,駿明珍寶 (V229),杜利萊,B/H,居中間之前位置，落後兩個半馬位，走第二疊。末段與對手叮噹馬頭，以半個馬位之先取勝。
2017-11-29,跑馬地,6,2,11,育成寶貝 (T427),巫顯東,B/TT,居第二疊第二位，落後領放馬約一個馬位。追趕頭馬至終點，以半個馬位之差落敗。
2017-11-29,跑馬地,6,3,7,馬功臣 (A296),莫雷拉,--,起步時與對手互相碰撞，居中間位置，落後四個馬位，走第二疊。末段保持頗佳走勢，跑獲季軍。
2017-11-29,跑馬地,6,4,9,越感 (T273),田泰安,--,起步後受擠迫，居中間之後位置，落後六又四分一馬位，走第二疊。追前頗多，末段衝刺良佳。
2017-11-29,跑馬地,6,5,3,中華之光 (A168),貝湯美,B/TT,起步後受阻礙，居約中間位置，落後五又四分一馬位，走第二疊。移出外疊，僅能保持同速。
2017-11-29,跑馬地,6,6,5,摯友無敵 (S279),潘明輝,--,受催策移入內欄，領先約一個馬位。再無餘力，跑過一百五十米處時被超越。
2017-11-29,跑馬地,6,7,4,香江穩勝 (T254),祈普敦,CP,受推策上前。一千米處轉彎時走外疊。推進至領放馬外側，落後一又四分一馬位。一百五十米處洩氣。（因閘內的表現而須經試閘及格後才可再次出賽。）
2017-11-29,跑馬地,6,8,1,陀飛輪 (T051),李寶利,B/XB,留居後列，落後九個馬位，走第二疊。追前，末段走勢一般。
2017-11-29,跑馬地,6,9,8,中環武士 (V267),韋達,XB-,受催策居中間之前位置，落後二又四分三馬位。入直路時移入內欄。自二百米處起至一百米處受困。末段衝刺一般。（騎師因選取的騎法而被警告。）
2017-11-29,跑馬地,6,10,12,地主群英 (A295),梁家俊,--,起步後受阻礙，居中間之後位置，落後六個半馬位，走內欄。末段僅能略為追前。
2017-11-29,跑馬地,6,11,6,勝利寶石 (P310),巴度,B/TT,留居接近包尾位置，落後七又四分三馬位，走內欄。末段未能上前。
2017-11-29,跑馬地,6,PU,10,手到拿來 (P396),史卓豐,--,趨近一千米處時有不妥，因而被收停。
2017-11-29,跑馬地,7,1,7,加州福星 (A415),蔡明紹,B/TT,出閘迅速，受推策上前。千一米處取得領先，切入內欄。入直路時加速上前，保持勁勢至終點。
2017-11-29,跑馬地,7,2,2,開心有你 (T402),潘明輝,XB,出閘迅速，並排領先。千一米處墮居包廂位置。三百米處移離內欄展開挑戰，但未能追及領放馬。
2017-11-29,跑馬地,7,3,4,話得事 (A162),柏寶,--,出閘迅速，瞬即居第二疊第二位的理想位置。入直路時移出外疊，以勁勢力拼至終點。
2017-11-29,跑馬地,7,4,10,好友無敵 (A217),巫顯東,--,利用排最內檔的優勢固守內欄，落後領放馬三個馬位。轉直路彎時及直路上持續走內欄，保持佳勢，但未能構成威脅。
2017-11-29,跑馬地,7,5,9,新威龍 (V412),梁家俊,H/TT,大多居中間位置，走第二疊。轉直路彎時受催策，但直路上僅能保持同速。
2017-11-29,跑馬地,7,6,6,大聚會 (V293),史卓豐,TT,居後列，走內欄，獲許以本身步速競跑。直路上在內疊取位，僅能保持同速。
2017-11-29,跑馬地,7,7,5,狀元才 (V016),貝湯美,TT,出閘後瞬即收慢，向內移入以取得遮擋，墮居包尾位置。入直路時看似已洩氣潰敗，但末段在馬匹之間略為追前。
2017-11-29,跑馬地,7,8,8,有心人 (T248),韋達,B/TT,出閘普通，墮居後列，走內欄。直路前一直遙居於後，其後超越已洩氣的對手。
2017-11-29,跑馬地,7,9,1,公証福將 (A148),羅理雅,TT,受力策上前，但未能取得遮擋，居中間位置，走外疊。趨近直路彎時大力搶口，失位。直路上力竭。氣管內有大量血液。
2017-11-29,跑馬地,7,10,11,中華寶貝 (S172),莫雷拉,B/TT,出閘後瞬即收慢，向內移入以取得遮擋，居中間之後位置，走第二疊。入直路時移出大外疊，僅能保持同速。
2017-11-29,跑馬地,7,11,3,祥勝駿駒 (T331),田泰安,H,自外檔出閘後受催策上前，居領放馬外側位置，落後半個馬位。入直路後瞬即受催策，但力竭。
2017-11-29,跑馬地,7,12,12,安友 (V291),何澤堯,--,早段受催策，保持在中間位置。轉直路彎時失地，入直路後瞬即墮居包尾位置。
2017-11-29,跑馬地,8,1,8,精壯神駿 (S414),郭能,B,出閘後居前列，追趕領先馬匹，走第二疊。入直路時走勢強勁。一百五十米處取得領先，在力拼下保住勝果。
2017-11-29,跑馬地,8,2,4,海利多 (V188),羅理雅,B/TT,居中間之後位置，走內欄。二百五十米處向外移出，以勁勢展開挑戰，逐漸追近，過終點時落後頭馬半個馬位。
2017-11-29,跑馬地,8,3,10,精算博奕 (T409),莫雷拉,B/TT,中段居第五位，落後領放馬三個馬位，走內欄節省腳程。最後三百米持續力拼。最後一百五十米仍落後頭馬，末段失去亞軍。
2017-11-29,跑馬地,8,4,11,明月光 (T369),田泰安,B,早段居後列。對面直路上進佔較接近位置。入直路時受催策，走外疊。末段逐漸上前，過終點時最為接近，僅失季軍。
2017-11-29,跑馬地,8,5,2,大運起 (A109),祈普敦,B/TT,逐漸上前，千二米處居領放馬外側位置。直路前居相同位置。三百米處取得領先，力拼，但最後一百五十米未能抗衡後上馬匹的挑戰。
2017-11-29,跑馬地,8,6,1,勝利仔 (S355),柏寶,H,留居中間之後位置，落後步速緩慢的領放馬六個馬位，走第二疊。四百米處居第十位。直路上走外疊，保持佳勢。
2017-11-29,跑馬地,8,7,3,鋒芒畢露 (V131),史卓豐,V/XB,出閘迅速，早段取得領先。接近千二米處時居領先馬匹之後位置。三百米處展開挑戰，奮起力追，但最後一百五十米僅能保持位置。
2017-11-29,跑馬地,8,8,5,心好事成 (S162),梁家俊,B,留居尾二位置。轉直路彎時落後領放馬七個馬位。末段衝刺良佳，但早段落後太遠，後追不及。
2017-11-29,跑馬地,8,9,12,王者再現 (V156),巴度,B,居中間位置，走第三疊或更外疊。大部分途程沒遮擋。直路上保持同速，未能威脅前列馬匹。
2017-11-29,跑馬地,8,10,6,騰煌 (S447),巫顯東,V,自第十二檔出閘後收慢，沿途居後列。四百米處落後九個馬位。末段略有進展，但從未構成威脅。（騎師被查詢騎法。）
2017-11-29,跑馬地,8,11,9,人強馬勁 (P435),韋達,CP-/B2/TT,居中間位置，走第二疊。最後三百米未能追前，從未看似能構成威脅。
2017-11-29,跑馬地,8,12,7,共創更好 (V381),貝湯美,B,受催策上前。跑過千三米處時切入內欄領放。以緩慢步速領放。入直路時未能發力。二百米處挨擦內欄，因而失去平衡，繼而墮退。
