date,venue,race_no,place,horse_no,horse_name,jockey,gear,commentary
2017-03-01,沙田,1,1,1,特獎 (V189),潘頓,B/TT,早段受緊迫，遙居於後。對面直路上及直路彎在外疊逐漸上前。入直路時居第八位，落後逾四個馬位，走最外疊。奮起力拼，一百米處取得領先。
2017-03-01,沙田,1,2,4,糖黐豆 (S205),何澤堯,B,出閘普通，居中間之後位置。直路初受困。末段衝刺良佳。
2017-03-01,沙田,1,3,3,幸運神駒 (V179),蘇狄雄,CP-/H-/TT,出閘笨拙，因而失地。自馬房彎起居中間之後位置，走外疊。入直路時移至跑道中央，持續上前，過終點時最為接近。
2017-03-01,沙田,1,4,13,幸運贏贏 (V091),黎海榮,B/SR1,自第一檔出閘後受催策，留居領放馬稍後位置，走內欄。二百米處在催策下取得領先，但後勁不繼，一百米處被超越。
2017-03-01,沙田,1,5,11,大爆發 (T203),韋達,TT,居前列，其後收慢，留居中間之前位置，靠近內欄競跑。直路前居相若位置。二百米處受困，向內移入取位。末段以佳勢力拼。
2017-03-01,沙田,1,6,8,好性格 (V060),郭能,B/XB,出閘迅速，居領放馬稍後位置，轉入馬房彎時受阻礙。對面直路上居第二疊第二位，即馬群中的第四位，其後居第五位。直路初在催策下保持走勢，但末段再無餘力。
2017-03-01,沙田,1,7,2,數碼先鋒 (V177),柏寶,B,自外檔出閘後居後列，走內欄。轉入直路彎時一度進佔較接近位置。入直路時沿欄上前，二百米處落後領放馬不逾兩個馬位。末段後勁不繼。
2017-03-01,沙田,1,8,10,頌義 (S354),田泰安,B,自最外檔出閘後居後列。入直路時受催策。最後二百米走勢甚佳。
2017-03-01,沙田,1,9,14,彩利 (N192),蔡明紹,B,出閘迅速，居中間之後位置。轉直路彎時走第四疊。三百米處須收慢。其後在催策下保持同速。
2017-03-01,沙田,1,10,5,七彩 (V044),吳嘉晉,TT,出閘迅速，早段受鞭策。對面直路上墮居中間位置，落後約三個馬位。最後五百米受催策，但墮退。
2017-03-01,沙田,1,11,7,非凡者 (T089),黃皓楠,B,自外檔出閘後早段受催策。對面直路上逐漸上前。轉直路彎時居領先馬匹外側位置。入直路後迅速力竭。
2017-03-01,沙田,1,12,12,活潑飛揚 (V061),莫雷拉,CP,出閘後瞬即帶頭，大部分途程領先，二百米處被超越。受催策，但力竭。（騎師被查詢此駒表現令人失望的原因。）（氣管內有血。）
2017-03-01,沙田,1,13,9,我是高手 (T261),梁家俊,CP/TT,出閘迅速，跑來搶口。對面直路上居中間位置，走外疊。入直路時居相若位置，仍走外疊，瞬即墮退。
2017-03-01,沙田,1,14,6,保證滿意 (P286),李寶利,PC/TT,受催策上前，馬房彎走外疊。對面直路上領先或爭奪領先。最後三百米後勁不繼，受催策，但轉弱。
2017-03-01,沙田,2,1,1,君悅灣 (P421),莫雷拉,B/H/TT,受推策上前，並排領先。自七百米處起控制大局，保持走勢，僅以短距離之先勝出賽事。
2017-03-01,沙田,2,2,3,獨具慧眼 (T164),潘頓,CP,收慢留後，走第二至第三疊。三百米處衝刺強勁，跑獲亞軍。
2017-03-01,沙田,2,3,13,歐洲巨星 (V313),蔡明紹,H/TT,收慢留居後列，走內欄。三百米處以勁勢衝刺，跑獲季軍。
2017-03-01,沙田,2,4,10,騏名燈 (T031),田泰安,B-/P2/TT,受力策上前，走內欄。三百米處衝刺良佳。
2017-03-01,沙田,2,5,5,智有心得 (V354),梁家俊,B/XB/TT-,受推策保持居中間位置，走第二疊。二百五十米處略為衝刺。
2017-03-01,沙田,2,6,11,鑽之友 (S376),何澤堯,H/P/TT,受推策上前固守內欄，居中間位置。二百米處略為衝刺。
2017-03-01,沙田,2,7,12,駿瑪 (T340),黃皓楠,--,受力策上前固守內欄，取得領先。七百米處被超越。保持走勢，二百米處洩氣。
2017-03-01,沙田,2,8,8,盛勢 (V243),韋達,B-,出閘後收慢，居後列有遮擋位置，走第二至第三疊。二百米處衝刺強勁。
2017-03-01,沙田,2,9,9,金像神話 (P431),黎海榮,V/TT,出閘十分緩慢，居後列，走第二疊。二百米處略為衝刺。
2017-03-01,沙田,2,10,4,奪目商人 (N111),李寶利,H/PC,收慢留居中間之後位置，走第三至第四疊。二百米處略為衝刺。
2017-03-01,沙田,2,11,14,路路發 (N186),蘇狄雄,--,收慢留後，走第三疊。未能加速。
2017-03-01,沙田,2,12,7,一支梅 (V171),蔣嘉琦,XB/TT,受力策上前，走第二疊。三百米處瞬即再無餘力。
2017-03-01,沙田,2,13,6,奪寶王 (V335),吳嘉晉,B,出閘十分緩慢，從未能推進。
2017-03-01,沙田,2,14,2,英友重友 (V198),柏寶,XB,居後列，走第三疊。從未有力一爭。
2017-03-01,沙田,3,1,10,嶺喜峯 (V090),黃皓楠,B,受推策上前佔取前列位置。儘管沿途在沒有遮擋下走外疊，但走勢強勁，以半個馬位之先勝出賽事。
2017-03-01,沙田,3,2,12,飛躍成功 (P231),韋達,TT,受力策上前，居領放馬外側位置。保持勁勢，最後一百米被頭馬超越。
2017-03-01,沙田,3,3,1,追風追月 (V355),巫顯東,P1/TT,受催策上前固守內欄，並排領先。保持穩勢，最後一百米轉弱。保住季席。
2017-03-01,沙田,3,4,6,智愛 (A010),潘頓,B,上前佔取包廂位置。末段保持同速，跑獲殿軍，未能構成威脅。
2017-03-01,沙田,3,5,2,一本萬利 (V234),梁家俊,TT1,居中間位置，落後領放馬三個半馬位，走內欄。走勢良佳。
2017-03-01,沙田,3,6,8,歡悅星 (S277),柏寶,B/TT,居中間位置，落後領放馬四個馬位，走第二至第三疊，有遮擋。走勢僅屬一般。
2017-03-01,沙田,3,7,3,慷慨寶 (S096),郭能,B/TT,居前列，落後領放馬三個馬位，走第二至第三疊，有遮擋。保持同速，最後一百五十米轉弱。
2017-03-01,沙田,3,8,5,情意相投 (T364),田泰安,XB/TT,居中間之後位置，落後領放馬約六個馬位，走內欄。直路上毫無表現。
2017-03-01,沙田,3,9,4,環保戰士 (N193),蔡明紹,V/XB/TT,居中間之後位置，落後領放馬約五個馬位，走第二疊，有遮擋。從未能上前。
2017-03-01,沙田,3,10,9,和平開心 (T091),何澤堯,--,受催策上前，落後領放馬一個馬位，走第二疊，有遮擋。入直路後瞬即嚴重轉弱。
2017-03-01,沙田,3,11,7,大把籌碼 (S055),黎海榮,BO/TT,沿途居後列，從未看似有力一爭。
2017-03-01,沙田,3,12,11,執子之手 (P185),莫雷拉,--,沿途居後列。從未有力一爭，包尾大敗而回。
2017-03-01,沙田,4,1,2,騂龍 (V212),蔡明紹,H/B1,出閘良佳，一千六百五十米處上前領先，帶離對手，千四米處移入內欄。轉入直路時領先一個馬位，受催策，直路上保持佳勢，掄元。
2017-03-01,沙田,4,2,4,連利進寶 (T181),柏寶,B/TT,出閘良佳，落後一個馬位，走內欄。六百五十米處受催策，瞬即受力策。轉入直路時受催策，移至跑道中央，最後三百米處力追頭馬，但未能追上。
2017-03-01,沙田,4,3,10,想贏就贏 (T385),何澤堯,TT,出閘笨拙，受催策，被拋離，居中間之後位置，走內欄。八百五十米處受催策，三百五十米處受力策，二百五十米處向外移出，保持走勢，末段跑入季席。
2017-03-01,沙田,4,4,8,旅遊大使 (T113),莫雷拉,B/TT,出閘時受擠碰，受催策佔取內欄，居中間位置。七百五十米處受催策，五百米處再受催策，三百五十米處受困，三百米處向外移出，其後保持同速。
2017-03-01,沙田,4,5,3,和諧氣氛 (S326),潘頓,B/TT,出閘時嚴重受阻礙，初時受催策，居尾二位置。自一千一百五十米處起走第三疊上前，八百二十米處居中間位置，轉彎時走第五疊，受催策上前。二百八十米處取得領先，但再無餘力，一百七十米處被超越，轉弱。
2017-03-01,沙田,4,6,7,風采 (P423),史卓豐,XB,出閘後留居後列位置，走第三疊。一千米處略為追前，七百五十米處居中間之後位置，六百米處受催策，直路彎走大外疊，受催策，在跑道中央略為追前。
2017-03-01,沙田,4,7,9,好腳頭 (S131),田泰安,B-/H-/PC2/TT,出閘時受阻礙，留居後列位置，走內疊。七百米處推進上前，五百米處受催策。直路彎受力策，三百米處向外移出，碰撞對手及失去平衡，保持穩勢。
2017-03-01,沙田,4,8,14,大道至公 (T329),韋達,B,出閘後受催策上前，居第二位，走第二疊，沒有遮擋。六百五十米處受催策，四百米處落後一個馬位，受催策，居啣接位置，一百五十米處再無餘力，力竭。
2017-03-01,沙田,4,9,6,幸運七星 (V263),李寶利,--,出閘良佳，受催策，首次轉彎時居前列位置，走第四疊。其後留居第二疊第二位，八百米處移至第三疊，一度推進上前，五百米處須受催策，瞬即受力策，乏力轉弱。
2017-03-01,沙田,4,10,13,津津樂道 (N248),蘇狄雄,--,出閘後向內斜跑，阻礙對手，留居包尾位置。六百米處受催策，直路彎在催策下略為追前，走勢疲乏至終點。
2017-03-01,沙田,4,11,5,金龍 (S339),郭能,B/TT,出閘緩慢，居中間位置，走第二疊，有遮擋。七百五十米處移至第三疊，受催策，五百米處受催策，轉入直路時受力策，再無餘力。
2017-03-01,沙田,4,12,11,沙角威龍 (S148),梁家俊,B,出閘笨拙，與對手碰撞，受催策，首次轉彎時居中間位置，走第四疊，其後走第三疊，沒有遮擋。八百五十米處略為追前，走第四疊，六百五十米處居第四位，受催策，轉入直路時再無餘力。
2017-03-01,沙田,4,13,12,千真萬確 (S328),黎海榮,CP/TT,出閘後領先，受催策，但瞬即被超越，留居中間位置，走第二疊，有遮擋。八百米處受催策，七百米處移離對手後蹄，墮退，包尾轉入直路，收慢。
2017-03-01,沙田,4,14,1,數碼世界 (T424),吳嘉晉,B,被碰撞及失地，居中間之後位置，走第二疊，有遮擋。九百米處墮後，八百米處受催策，轉彎時受力策，再無餘力，直路上收慢。
2017-03-01,沙田,5,1,11,喜得龍 (V009),莫雷拉,TT,出閘迅速，未能跟上前速。在催策下居領放馬稍後位置。居第三位，走第二疊。四百五十米處受催策，三百七十米處望空，二百五十米處並排領先。其後瞬即帶離對手。
2017-03-01,沙田,5,2,12,勁風 (T285),吳嘉晉,PC,出閘迅速，受力策上前。居主馬群中間位置，走第二疊。四百米處受催策，二百九十米處避開他駒的後蹄。以勁勢衝過終點。
2017-03-01,沙田,5,3,2,頌友 (N360),郭能,B/TT,與對手同步出閘，居中間之前位置，走內欄。七百米處受催策，三百八十米處再受催策，二百八十米處空位不足。望空後以勁勢衝刺。
2017-03-01,沙田,5,4,3,超然 (V255),韋達,P-/TT,出閘略為笨拙，早段居中間之後位置，走第二疊。九百米處受力策，自八百米處起改善走勢，四百五十米處在推策下走第四疊。受催策，持續上前。一百米處未能再加速。
2017-03-01,沙田,5,5,4,八心之友 (A007),田泰安,B,出閘普通，前速不快。受力策，追近領放馬。居第四位，走第三疊。四百四十米處加速，保持普通走勢，最後一百米力竭。
2017-03-01,沙田,5,6,10,瀟洒兄弟 (V022),潘頓,B/TT,出閘迅速，在力策下追迫領放馬。七百五十米處追及領放馬，六百米處以短距離領先，走第二疊。五百米處再被超越，三百五十米處受催策，二百五十米處以短距離領先。其後瞬即被超越。保持普通走勢，五十米處轉弱。
2017-03-01,沙田,5,7,6,必搏 (V226),史卓豐,B/H/TT,出閘普通，收慢留居中間之後位置，走第三疊。五百五十米處受催策，其後瞬即再受催策。四百五十米處在推策下走第五疊，入直路時走最外疊。以普通走勢過終點。
2017-03-01,沙田,5,8,9,御風雲 (V231),何澤堯,TT1,出閘最快，受催策，但未能加速。居中間之前位置，走第四疊。三百六十米處受催策，自二百米處起保持同速至終點。
2017-03-01,沙田,5,9,8,大將風雲 (N426),蘇狄雄,B,出閘笨拙，受力策，但未能加速。一千米處落後尾二賽駒三個馬位，七百米處落後四個馬位。四百米處追上對手，受推策。在馬匹之間上前，一百米處未能再增速。
2017-03-01,沙田,5,10,1,勇冠多 (V376),黃皓楠,--,出閘普通，順其自然上前，迅速取得領先。八百米處被追及，其後瞬即被超越。六百米處以短距離落後，居第二位，走內欄。五百米處重奪領先位置。二百七十米處受催策，二百五十米處洩氣，轉弱。
2017-03-01,沙田,5,11,5,金筷子 (P120),黎海榮,--,出閘迅速，收慢留居主馬群後列位置。七百五十米處包尾，走第三疊，受催策。直路上移至跑道中央，但未能跟上。
2017-03-01,沙田,5,12,7,錢途再現 (A046),梁家俊,--,出閘略為緩慢，受約束居主馬群包尾位置。沿欄推進至中間之後位置。五百米處受催策，從未有力一爭。
2017-03-01,沙田,6,1,3,傾心星 (V217),韋達,B/H/TT,居中間之後位置，落後八個馬位，走第三疊，有遮擋。自七百米處起受鞭策，持續推進，走勢良佳，勝出賽事。
2017-03-01,沙田,6,2,2,勁精神 (V181),吳嘉晉,TT,沿欄受推策上前，爭奪領先，七百米處單騎領放。保持走勢，最後五十米被頭馬超越。
2017-03-01,沙田,6,3,10,機緣再現 (T376),潘頓,B/TT,居中間之前位置，落後四又四分三個馬位，走第二疊，保持佳勢至終點。
2017-03-01,沙田,6,4,1,小龍兒 (S264),巫顯東,--,缺乏前速，居後列，落後十二又四分三個馬位，走第三疊，有遮擋。以佳勢上前，走勢良佳，跑獲殿軍。
2017-03-01,沙田,6,5,4,真好漢 (T213),郭能,B/TT,出閘緩慢，居後列，落後十三又四分三個馬位，走內欄。自二百五十米處起追前頗多，保持勁勢。
2017-03-01,沙田,6,6,8,紅運精彩 (T417),莫雷拉,H/P/TT,受催策上前，居前列，落後二又四分三個馬位，走第二疊，保持走勢，二百米處再無餘力。
2017-03-01,沙田,6,7,5,勁嘉輝 (T236),李寶利,B-/P1,尾隨馬群，落後十二又四分三個馬位，走第二疊，有遮擋。逐漸追前，但未能構成威脅。
2017-03-01,沙田,6,8,11,愛寶 (P287),黃皓楠,H,受催策上前，走第二疊。並排及爭奪領先直至七百米處。保持走勢，二百五十米處洩氣。
2017-03-01,沙田,6,9,6,包裝天才 (V174),蘇狄雄,--,居中間位置，落後六又四分三個馬位，走內欄。末段保持同速。
2017-03-01,沙田,6,10,13,凱明神駒 (T195),田泰安,B/TT,居中間稍後位置，落後八個馬位，走內欄。直路上毫無進展。
2017-03-01,沙田,6,11,14,紅海灣 (T159),蔣嘉琦,B,居後列，落後十一又四分三個馬位，走內欄。早段略為追前。其後保持同速。
2017-03-01,沙田,6,12,7,軍勇戰神 (V053),何澤堯,--,收慢，居接近包尾位置，落後十一個半馬位，走第三疊，有遮擋。直路上未能追前。
2017-03-01,沙田,6,13,12,幸福一生 (S382),史卓豐,P1,居中間位置，落後六個半馬位，走第二疊。直路上再無餘力。
2017-03-01,沙田,6,14,9,中游神箭 (A169),梁家俊,XB/TT,居中間稍前位置，落後五又四分三個馬位，走第三疊，沒有遮擋。轉直路彎時嚴重轉弱，從未有力一爭。
2017-03-01,沙田,7,1,1,心花怒放 (P214),蔣嘉琦,V,受力策取得領先，但因對手居於內側而未能移入內欄。入直路時加速帶離一個馬位。在催策下持續力拼，以短距離之先勝出。
2017-03-01,沙田,7,2,2,公証揚鳴 (V078),田泰安,B,出閘迅速，但早段未能追及領放馬，墮居後列，走第二疊。跑過五百米處時開始發力上前。入直路時移出最外疊。衝刺強勁，僅以短距離之差落敗。
2017-03-01,沙田,7,3,12,霸氣 (S204),巫顯東,B,自外檔出閘，受力策並排領先，但走第三疊。其後落後領放馬兩個馬位，走第二疊。入直路時受催策上前，但儘管受力策，仍未能追近對手。
2017-03-01,沙田,7,4,7,阿甘 (T176),史卓豐,CP/XB/TT,起步後不久收慢，墮居最後兩位，走內欄。五百米處向外移出上前，但在馬群之後受困。直路初向內移入。其後再向外移出以望空，衝刺強勁。
2017-03-01,沙田,7,5,6,仁愛之星 (T389),潘頓,B,出閘一般，繼而被對手碰撞。其後受催策上前，落後領放馬三個馬位，走第二疊。入直路時望空，穩步上前，未能構成威脅。
2017-03-01,沙田,7,6,3,鐵男 (V264),柏寶,H,起步時碰撞對手，失去平衡，墮居後列。受催策追前，居中間位置，落後領放馬四個馬位，走內欄。直路上儘管轉換位置，但未能取位上前。末段外閃，難以策騎。
2017-03-01,沙田,7,7,10,再創商機 (V340),黃皓楠,H-/B1,自外檔出閘，受催策上前，居中間位置，但走第三疊，沒有遮擋。轉直路彎時受催策上前。入直路時移出外疊，在力策下保持普通走勢。
2017-03-01,沙田,7,8,4,靚猴王 (S280),郭能,B,出閘尚可，上前居中間之後位置，走第二疊。略為移出外疊。直路上移出更外疊，但保持同速。
2017-03-01,沙田,7,9,9,超凡夢想 (S203),何澤堯,B/H,出閘一般，缺乏前速，居中間之後位置，走內欄。直路上保持一般走勢。一百米處須向外移出以望空。
2017-03-01,沙田,7,10,11,威先生 (T334),蘇狄雄,H/P,受力策固守內欄。直路前居領放馬內側，落後半個馬位。跑過三百米處時受催策，逐漸墮退。
2017-03-01,沙田,7,11,8,至叻熊 (S337),蔡明紹,--,出閘笨拙，失地，繼而在馬群之後切入內疊，居最後兩位。入直路時受催策之際再無餘力。
2017-03-01,沙田,7,12,5,正是你 (S349),吳嘉晉,B/TT,自大外檔出閘，受催策上前，居中間之後位置，但走外疊。轉入直路時須受催策。直路上墮退。
2017-03-01,沙田,8,1,9,藍天堡馬 (T186),黎海榮,H,自第十檔出閘普通，居第五位，落後三個馬位，走外疊。直路彎居相同位置。衝刺強勁，取得勝利。
2017-03-01,沙田,8,2,2,活力寶 (T009),田泰安,--,出閘稍慢，沿欄居中間位置，落後三至四個馬位。直路彎向外移出。直路初未能望空，接近三百米處時勒避，其後移出大外疊，衝刺凌厲，取得亞軍。
2017-03-01,沙田,8,3,11,嫡愛寶 (V287),史卓豐,B,出閘迅速，居中間位置，落後三至四個馬位。自六百米處起推進。入直路時走大外疊，衝刺良佳，最後一步失去亞席。（賽後翌晨左前腿不良於行。）
2017-03-01,沙田,8,4,4,一哥 (P361),潘頓,B/H/TT,出閘迅速，沿欄居第四位，落後兩至三個馬位。直路彎前走勢輕鬆。直路上保持穩勢，取得第四名，但未能構成威脅。
2017-03-01,沙田,8,5,1,軍歌 (T103),李寶利,B,出閘普通，居後列，落後六個馬位，走第二疊。直路彎前居相同位置。直路上追前甚多，但未能威脅前數名馬匹。
2017-03-01,沙田,8,6,5,飛龍駒 (S156),柏寶,B,自第九檔出閘迅速，受催策上前，居前列。直路彎居第二位。直路初保持佳勢，接近二百米處時未能再增速，保持同速。
2017-03-01,沙田,8,7,6,加州議長 (A114),郭能,TT,出閘緩慢，恢復走勢後居第三位，沿途沒有遮擋。直路初未能再增速，其後逐漸轉弱。（見競賽事件報告。）
2017-03-01,沙田,8,8,12,最驫 (A022),巫顯東,TT,出閘十分笨拙，恢復走勢，過了九百米處後取得領先。直路初保持佳勢，接近二百米處時未能再增速，其後被超越及轉弱。
2017-03-01,沙田,8,9,8,有心人 (T248),韋達,TT,出閘笨拙，失地，居後列。直路彎仍落後約五個馬位。直路上衝刺乏力。
2017-03-01,沙田,8,10,7,豈等閒 (S312),黃皓楠,B,自外檔出閘後留居包尾位置。直路彎仍遙居於後。衝刺乏力，從未能構成威脅。
2017-03-01,沙田,8,11,3,鄉村輝煌 (T011),蘇狄雄,H,與對手同步出閘，居中間之後位置，走外疊。直路彎轉弱。直路初再無餘力。包尾大敗而回，表現難以接受。
