date,venue,race_no,place,horse_no,horse_name,jockey,gear,commentary
2022-11-12,沙田,10,9,2,美麗奔馳 (G231),蔡明紹,H/TT,出閘普通，早段居中間位置，走外疊。千二米處受催策上前。中段居第二疊第二位。直路初在催策下反應平平。最後二百米逐漸轉弱。
2022-11-12,沙田,10,10,14,合夥芙蓉 (G256),潘明輝,P-/H/PC1,與對手同步出閘，居中間位置，走內疊。跑過五百米處後向外移出。直路初未能再增速，其後保持穩勢。
2022-11-12,沙田,10,11,7,旭日暉 (G300),希威森,CP-/SR-/B1/TT,自外檔出閘普通，受催策上前，取得領先。入直路時受對手挑戰。直路初未能再增速及被超越。最後二百五十米轉弱。
2022-11-12,沙田,10,12,10,越駿歡欣 (G446),馬雅,--,出閘稍慢，居後列，走第三疊，有遮擋。入直路時走大外疊。直路上衝刺乏力。
2022-11-12,沙田,10,13,11,閃耀威龍 (G427),霍宏聲,TT,自第一檔出閘普通，居中間之前位置，走內疊。中段墮居中間位置，落後約三個馬位。直路初未能再增速。最後二百五十米轉弱。（見競賽事件報告。）
2022-11-12,沙田,10,14,5,逆市奇爸 (E321),麥利奧,TT,自第十二檔出閘，留居後列，走外疊。中段略為追近。入直路時落後三個馬位。直路初未能再增速。最後三百米轉弱。（氣管內有血。）
